Index	Homograph	Context	TargetWord	Label
1	белка	К охотничье-промысловым видам относятся: изюбр, лось, кабарга, косуля, кабан, дикий северный олень, белка, соболь, барсук, рысь, ондатра, росомаха, медведь, водоплавающая дичь, боровая дичь.	белка	бе+лка
2	белка	Утром в школе, после обеда в универе (химия и математика), потом тренировки (футбол), как белка в колесе всю неделю.	белка	бе+лка
3	белка	"Мама и малыш так просто и органично составили одно целое, а ему, добытчику и главе семейства, теперь приходится самому готовить себе ужин, а на закуску выслушивать попреки: ""Я тут кручусь, как белка в колесе, а ты... "", или умильное сюсюканье: ""А вот мы как хорошо пописали-покакали..."	белка	бе+лка
4	белка	Что это ты делаешь, Заяц? -спросила Белка.	Белка	бе+лка
5	белка	И Белка поплыла рядом.	Белка	бе+лка
6	белка	Не толкайся, -шепнула Белка.	Белка	бе+лка
7	белка	Белка поймалась на гриб.	Белка	бе+лка
8	белка	Здорово! -сказала Белка, когда сели на крыльце пить чай.	Белка	бе+лка
9	белка	Клиенту нужны атомные тайны русской мафии – будет вам и белка, будет и свисток, а равно атомный физик.	белка	бе+лка
10	белка	Белка бежала-бежала в своем колесе – и так целых пол дня, а потом вдруг провалилась вместе с колесом куда-то в тартарары...	Белка	бе+лка
11	белка	Пятнадцать процентов со сделки платят... с прибыли фирмы пятнадцать процентов... крутишься месяцами как белка в колесе... вот я и попросила.	белка	бе+лка
12	белка	Признаюсь, к своему стыду, что тогда я не могла взять в толк, почему все так безумно рады, что в космос полетели уже не Белка и Стрелка, а некий взрослый человек.	Белка	бе+лка
13	белка	На рябине, что росла у забора, неведомо откуда появилась белка.	белка	бе+лка
14	белка	Белка побежала по стволу и повисла на ветке, качнулась – перепрыгнула на забор.	Белка	бе+лка
15	белка	Белка спрыгнула на землю, и больше ее не было видно, но мне стало весело.	Белка	бе+лка
16	белка	На рябину тем временем вернулась белка.	белка	бе+лка
17	белка	Был конец октября, и белка вылиняла уже к зиме.	белка	бе+лка
18	белка	Не белка и не бурундук.	белка	бе+лка
19	белка	Еще не прилетели! – говорила Белка.	Белка	бе+лка
20	белка	"Белка сидела в дупле и знала, что это Ежик стоит под сосной, играет ""Грустного Комарика "" и называет ее Рыжим Солнышком..."	Белка	бе+лка
21	белка	А Ежик играл целый день до вечера и, когда уставал, кивал головой зайцам – и они потихонечку барабанили, чтобы Белка знала, что Ежик все еще стоит внизу и ждет, когда она выглянет.	Белка	бе+лка
22	белка	прячется в дупле Белка,	Белка	бе+лка
23	белка	Что это ты делаешь, Медвежонок? – спросила у него Белка.	Белка	бе+лка
24	белка	Ты разве дерево? – удивилась Белка.	Белка	бе+лка
25	белка	И потом, если ты не веришь, ты можешь побегать по мне, Белка, и увидишь, какое я хорошее дерево!	Белка	бе+лка
26	белка	А где твои птицы? – спросила Белка.	Белка	бе+лка
27	белка	Белка, – сказал он – найди для меня, пожалуйста, немного птиц.	Белка	бе+лка
28	белка	Это какая же птица согласится жить на Медвежонке? – спросила Белка.	Белка	бе+лка
29	белка	Попробую, – пообещала Белка.	Белка	бе+лка
30	белка	Медвежонок – позвала Белка.	Белка	бе+лка
31	белка	Белка больше всего любила орехи.	Белка	бе+лка
32	белка	Белка набрала их целую корзину и спрятала в дупле самой толстой морковки.	Белка	бе+лка
33	белка	Тогда бы я вышел на поляну, крикнул на весь лес, и Белка прибежала бы ко мне, а я бы ей сказал:	Белка	бе+лка
34	белка	Здравствуй, Белка!	Белка	бе+лка
35	белка	""" А Белка бы распушила свой хвост, помахала им в разные стороны и ответила: ""Здравствуй, Ежик!"	Белка	бе+лка
36	белка	"""Ты протаптывай по земле, – сказала бы Белка, – а я – поверху!"	Белка	бе+лка
37	белка	Принесла его Белка, подсунула под дверь и убежала.	Белка	бе+лка
38	белка	"""– "" Это Изюбрь! ""– скажет Белка."	Белка	бе+лка
39	белка	Дескать, будет вам и белка, будет и свисток.	белка	бе+лка
40	белка	Гопчик, как белка, легкий – по перекладинам взобрался, прибил гвоздь, проволоку накинул и под трубу подпустил.	белка	бе+лка
41	белка	Шухов кивнул и, как белка, быстро залез наверх.	белка	бе+лка
42	белка	"Материковская махорка, ярославская ""Белка "" или ""Кременчуг № 2 ""."	Белка	бе+лка
43	белка	Я даже до сих пор не успел обзавестись семьей: как белка в колесе.	белка	бе+лка
44	белка	Ванька, выскочив на мороз, сразу очнулся и, как белка, взобрался по лестнице на самый верх домны.	белка	бе+лка
45	белка	И по елкам ловко скачет, И влезает на дубы, И в дупле орешки прячет, Сушит на зиму грибы (белка)	белка	бе+лка
46	белка	Я стыдился собственной наготы, но понимал, что, если что-то сделаю не так, бабка хлестнет меня ивовым прутом по влажной спине, как конягу, и, конечно, еще и лопатой огребет, потому шмыгал туда и обратно, как белка в зоопарке.	белка	бе+лка
47	белка	Обычная белка.	белка	бе+лка
48	белка	Одни звонят в час ночи, другие в три, в четыре, в половине пятого и шестого… и только белка как положено, отмеряла время, пряча орешки в домик.	белка	бе+лка
49	белка	Потому что белка схватила свой последний орешек, повернулась и спряталась в домике.	белка	бе+лка
50	белка	Белка смешно, как маленький человечек, обеими лапками несет стланиковую шишку.	Белка	бе+лка
51	белка	Я и так как белка в колесе — всем приготовь, принеси, унеси.	белка	бе+лка
52	белка	У вашей сестры муж очень влиятельный, а то была бы Валентину Ивановичу… и белка, и свисток.	белка	бе+лка
53	белка	То есть «белка» была.	белка	бе+лка
54	белка	Кручусь, как белка, сразу в нескольких колесах!	белка	бе+лка
55	белка	Вокруг вас даже прыгала белка, пытаясь вас отвлечь.	белка	бе+лка
56	белка	Опять стекла с дерева рядом, а потом замерла перед Готлифом белка со вздёрнутым хвостом.	белка	бе+лка
57	белка	Но бесстрашная белка упорно разглядывала Михаила Яновича.	белка	бе+лка
58	белка	Белка обитает там же.	Белка	бе+лка
59	белка	Однако белка цапнула и взлетела на дерево.	белка	бе+лка
60	белка	А белка уже прыгала за ним с дерева на дерево, руша снег.	белка	бе+лка
61	белка	Белка сразу запрыгала с дерева на дерево, руша снег.	Белка	бе+лка
62	белка	Белка пошевелила пушистым хвостиком.	Белка	бе+лка
63	белка	Белка, будто пушинка, подхваченная ветром, метнулась и пошла считать деревья.	Белка	бе+лка
64	белка	Жми, Белка, божественный кореш!	Белка	бе+лка
65	белка	Или Тамара Жирмунская – про то, как страстно Белла «крутила баранку автомобиля, любила рискованную езду, ничего не боялась» – и тут же, следом, непременное напоминание: «Недаром Вознесенский написал: «Ах, Белка, лихач катастрофный!»».	Белка	бе+лка
66	белка	Белка, божественный кореш», переживет друга лишь на полгода.	Белка	бе+лка
67	белка	Он был своего рода местным узлом торговли со странами Европы и Азии, из него в Западную Европу и Азию везли меха (в основном белка и горностай), а в другие города России – зерно.	белка	бе+лка
68	белка	На ветке у самого игнатовского лица – белка: худая, грязно-серая, с тощим белым подпушком и желтыми щеками, длинными разбойничьими кистями ушей – мясо!	белка	бе+лка
69	белка	За пушниной – белка, колонок, изредка соболь – ходила только зимой, когда зверь выкунит, покроется густой лоснящейся шерстью.	белка	бе+лка
70	белка	Неподалеку легкий шорох – темная, уже одевшаяся к зиме в пышно-серое белка строчит по земле, водит острыми ушками.	белка	бе+лка
71	белка	Белка уже рядом: поблескивает карими глазками, тянется черными сморщенными пальчиками к жесткой гореловской ладони.	Белка	бе+лка
72	белка	Ахает выстрел – и вот уже белка с темно-кровавым пятном вместо глазницы неподвижно лежит на пестро-коричневой хвое.	белка	бе+лка
73	белка	Просто Белка, соседка по кишиневской комнате.	Белка	бе+лка
74	белка	Но Белка далеко не тупица, и выгоды своей никогда не упустит.	Белка	бе+лка
75	белка	А Белка и запираться не стала: ну да, а что такого, подбирала себе по вкусу!..	Белка	бе+лка
76	белка	Белка подняла свои недовольные брови.	Белка	бе+лка
77	белка	Белка просияла.	Белка	бе+лка
78	белка	Белка в самых простых словах попросила Иосифа Ш. устроить её на работу.	Белка	бе+лка
79	белка	На окне подрагивают головками и застенчиво улыбаются столь любимые Хомяком ромашки, шевелит несмело занавеску лёгкий ветерок, любопытная белка заглядывает в распахнутое окно с ветки раскидистого дуба, замирают на миг в небе облака – и с тихим мелодичным скрипом откидывается крышка старого сундучка...	белка	бе+лка
80	белка	Упитанная рыжая белка с растрепанным хвостом, тяжело пометавшись из стороны в сторону, стрелой промчавшись по забору, скользнула в лес, только ее и видели — вот тебе и неожиданное приветствие.	белка	бе+лка
81	белка	Беседа «Что такое здоровый образ жизни?» (Занятие на спортплощадке: подвижные игры на свежем воздухе «Стрижи», «Белка в дупле») (1 ч.)	Белка	бе+лка
82	белка	Порхнет сойка и прошепчет весть рыжей белке, а белка настрекочет с ветвей серому волку.	белка	бе+лка
83	белка	Тело имело утраты: соседские кошки, ежи, да и вообще, экология в тех местах была хорошая, животный мир богатый и плотоядный, одна белка не изменила вегетарианству.	белка	бе+лка
84	белка	Белка переселилась в другие кущи, младший с невесткой получили урезанную компенсацию и судятся теперь с дорожной компанией, внучка третьего зама, выселенная с родного огорода, оставила чтение и целиком переключилась на крикливые шоу из купленного на отступные телевизора и сладкое, потому что ужиться с окружающим миром с помощью одного только чтения она уже никак не может.	Белка	бе+лка
85	белка	Белка любит свое колесо	Белка	бе+лка
86	белка	Потому, что если вы не готовы это сделать, то вы менее готовы к выживанию в дикой природе, чем среднестатистическая белка.	белка	бе+лка
87	белка	Следующим делом буду копать бункер, как белка.	белка	бе+лка
88	белка	В награду за эту небывалую щедрость моя белка получила 10 килограмм свежего очищенного фундука из магазина, пусть радуется.	белка	бе+лка
89	белка	Белка (давно не писал о белках, да?) освоила разнообразную диету не только из кукурузы, но и из птичьего корма.	Белка	бе+лка
90	белка	Неделю Леня крутился, как белка в колесе.	белка	бе+лка
91	белка	И в прихожей прелестная рыжая белка в колесе, неутомимо свершавшая свой бесконечный неподвижный бег…	белка	бе+лка
92	белка	Белка по-прежнему бежала в своем колесе: не арестовали и не расстреляли.	Белка	бе+лка
93	белка	И первое, что увидел Йозеф, была белка в клетке на комоде, все так же, как прежде, бежавшая в своем колесе.	белка	бе+лка
94	белка	А у кого не было родственников, те крутились как белка в колесе: заводили ишака с бочкой, ездили по воду и торговали по дворам поведерно или подрабатывали на кладбище, на похоронах.	белка	бе+лка
95	белка	Я не крепостная девка Белка!	Белка	бе+лка
96	белка	С тех пор у нас не бывает так, чтобы тебе и белка, и свисток, а либо замирение народов, либо электровоз.	белка	бе+лка
97	белка	Самая известная вещь Кима – роман-сказка «Белка» – вышел в 1985 году.	Белка	бе+лка
98	белка	Она – белка, крутящаяся в колесе, чтобы не сдохнуть от ожирения.	белка	бе+лка
99	белка	Проваливается во вкусный, глубокий сон, под охраной замершей снеженной ели, по которой летит вверх серый хвостатый вихрь — белка, сыпля на землю мягкую розовую пудру.	белка	бе+лка
100	белка	На память потомкам остались также названная в его честь тропическая бабочка-птицекрыл (Trogoportera brookiana), белка Брука (Sundasciurus brookei), рододендрон Брука (Rhododendron brookei) и насекомоядное растение непентес Раджа Брук (Nepenthes rajah).	белка	бе+лка
101	белка	С утра до позднего вечера я как белка в колесе.	белка	бе+лка
102	белка	А у меня – дом, работа, дом, работа, как белка в колесе.	белка	бе+лка
103	белка	Белка в колесе и есть со своими работами, собаками, детьми и прочими глупостями.	Белка	бе+лка
104	белка	Будет тебе и комсомол, и экономика, и белка, и свисток.	белка	бе+лка
105	белка	Утешить мышь приходит навязчивая белка, которая предлагает ей станцевать лесной вальс.	белка	бе+лка
106	белка	Белка дрожит от страха, так как мышь была с ней груба».	Белка	бе+лка
107	белка	И еще белка черная, слюдяная.	белка	бе+лка
108	белка	Белка шишку грызет, хрустит, а новый, посторонний здесь человек думает – это призрак грызет кость.	Белка	бе+лка
109	белка	Фабрикой заведовала Старуха, вертевшаяся, как белка в колесе, или заводной апельсин.	белка	бе+лка
110	белка	Оно крутится во времени, как белка в колесе.	белка	бе+лка
111	белка	Доведется попасть в первый зал – знайте, белка с камбалой на занавесе иллюстрируют поговорку: «Легче белке в море камбалу поймать, чем найти кинотеатр без голливудских фильмов».	белка	бе+лка
112	белка	Белка и Стрелка вернулись на Землю.	Белка	бе+лка
113	белка	В мультфильме «Белка и Стрелка»	Белка	бе+лка
114	белка	(где Гагарина нет – но, говорят, был: Белка и Стрелка встречают коллегу на Внуковском аэродроме и – снизу, со своего уровня – видят, как по дороге у него развязывается шнурок; затем эту сцену якобы вырезали по цензурным соображениям, чтобы не очернять светлую память о Юрии Алексеевиче), оказавшись в космосе, «звездные собаки» сначала встречают первый, запущенный за три года до них спутник (и меняют в нем батарейку, как в карманном фонарике: очень трогательно, на нем тут же начинает пульсировать красная пятиконечная звезда), а затем, после ряда необдуманных действий Стрелки, тушат пожар на борту, попадают в пояс астероидов и обнаруживают в дальнем отсеке таинственного незнакомца.	Белка	бе+лка
115	белка	В квартире его жили белка в колесе и попугай в клетке.	белка	бе+лка
116	белка	На высоком заборе сидела белка.	белка	бе+лка
117	белка	Только летом белка была рыжая, а сейчас стала серой и очень пушистой.	белка	бе+лка
118	белка	Ты что, дурачок? – поинтересовалась белка, свесив вниз острую мордочку.	белка	бе+лка
119	белка	– Ха-ха-ха! – веселилась белка.	белка	бе+лка
120	белка	Запомни: я – белка.	белка	бе+лка
121	белка	– Ладно, – хмыкнула белка.	белка	бе+лка
122	белка	Правда, белка всегда сидела высоко на дереве.	белка	бе+лка
123	белка	– Куда собрался? – спросила белка, помахивая хвостом.	белка	бе+лка
124	белка	Бедненький, – пожалела его белка.	белка	бе+лка
125	белка	Там ни снега, ни ветра. – Разве это дом? – усмехнулась белка.	белка	бе+лка
126	белка	Он понял: белка права.	белка	бе+лка
127	белка	Белка семечки из еловых шишек грызёт.	Белка	бе+лка
128	белка	Показана белка.	белка	бе+лка
129	белка	Белка – оранжевое пятнышко на зеленом фоне.	Белка	бе+лка
130	белка	Девушка с мужчиной бегут, падают, хрустят сучья, крупно – белка метнулась… крупно – гриб, на него наступает Наталья, гриб лопается…	белка	бе+лка
131	белка	Там жили белка, два бурундучка, молодой сокол.	белка	бе+лка
132	белка	Краем глаза она заметила, как мимо метнулась белка, легко прошуршав по сосне.	белка	бе+лка
133	белка	А в «живом уголке» было много других животных: белка, лисенок, ушастый ежик, ворона, кролики, морские свинки и волнистые попугайчики.	белка	бе+лка
