Index	Homograph	Context	TargetWord	Label
1722	белка	Высказывается предположение о том, что конкурентные взаимоотношения между этими белками могут проявляться и в отношении рецептора аполипопротеина Al, что нарушает участие последнего в регуляции биосинтеза белка и приводит к снижению массы тела у ВИЧ-ин-фицированных больных.	белка	белка+
1723	белка	По окончании инкубации клетки отмывали от несвязавшегося белка ФСБ с 20% «нормальной» человеческой сыворотки, переносили 25 мкл суспензии клеток в лунку чистого планшета и вносили моноклональные антитела к CD4, инкубировали 20 мин при комнатной температуре.	белка	белка+
1724	белка	Ранее нами было показано, что апоАI в комплексе с восстановленными формами стероидных гормонов принимает участие в усилении экспрессии генов, повышая, таким образом, скорость биосинтеза белка в различных тканях [3, 4].	белка	белка+
1725	белка	Влияние комплекса тетрагидрокортизол-аполипопротеин А-1 на взаимодействие РНК-полимеразы с эукариотической ДНК и на скорость биосинтеза белка в гепатоцитах //	белка	белка+
1726	белка	Аминокислота треонин в 303-м положении белка мыши заменилась на аспарагин, а аспарагин в 325-м — на серин.	белка	белка+
1727	белка	Сейчас представляется вероятным, что именно аминокислота в 325-м положении является ключевой в организации процесса фосфорилирования белка ферментом протеин-киназой С, а это в свою очередь стимулирует начало «чтения» гена.	белка	белка+
1728	белка	Накопление мутаций в гене белка ведет к меньшему распознаванию феромонов, и рабочие муравьи становятся более толерантными, что и приводит к сохранению большего количества маток в колониях социалов.	белка	белка+
1729	белка	Стауэрс для чистоты эксперимента оставляла большую часть рецепторного белка, изымая из гена только тот участок, который кодирует феромон, связывающий фрагмент рецепторного протеина.	белка	белка+
1730	белка	Для этого в Ла-Джолле в нейробласты при помощи специальных методов ввели ген ЗФБ – зеленого флюоресцирующего белка, протеина медуз, благодаря которому обитатели тропических вод светятся в ночи.	белка	белка+
1731	белка	Расчеты, проведенные Дельбрюком, показывали, что «трансмутация гена» ограничена кубиком со стороной всего лишь с десяток атомов, что было значительно меньше молекулы белка, которому отводили роль вещества наследственности.	белка	белка+
1732	белка	Все, кто писал и говорил до них о ДНК – Полинг, Чаргафф, Франклин в меньшей степени, – все же мыслили категориями белка, протеина, но никак не двуцепочечности с точки зрения БИОЛОГИИ!	белка	белка+
1733	белка	Из-за высокой питательности (они содержат в два раза больше белка, чем пшеница, и в три раза больше, чем рис) их даже называют мясом тропиков.	белка	белка+
1734	белка	Оскудение коснулось и эстуариев, например Чесапикского залива в США, который заслужил наименование «фабрики белка».	белка	белка+
1735	белка	Что же касается структуры пищевого рациона, то по норме он должен включать не менее 90–100 г белка в день.	белка	белка+
1736	белка	Потребление белка на душу населения, в граммах (по Д. Григу)	белка	белка+
1737	белка	Причем любая из них по сути представляет собой специализированную «минипробирку» с зондом, состоящим из ДНК, РНК, индивидуального белка, олигонуклеатида, рецептора, лиганда и т.д., необходимыми для проведения химических и ферментативных реакций с анализируемыми образцами.	белка	белка+
1738	белка	Чтобы бульон был совершенно прозрачным, готовят так называемую «оттяжку»: 2-3 яичных белка, с которыми смешивают 5-кратное по объему количество бульона.	белка	белка+
1739	белка	Снять с огня, остудить и всыпать 2 столовых ложки тертого сыра, вбить 2 желтка и 2 взбитых до пены белка.	белка	белка+
1740	белка	Взбивайте 2 яичных белка, пока не загустеют, и очень осторожно смешайте с ягодным пюре.	белка	белка+
1741	белка	Скелет» клетки образован длинными молекулами белка актина, и каждая такая полимерная молекула состоит из множества отдельных звеньев-мономеров.	белка	белка+
1742	белка	Кроме того, волокна актина вместе с волокнами другого белка, миозина, осуществляют сокращение и расслабление мышечных клеток тела, но об этом чуть дальше.)	белка	белка+
1743	белка	Внутри каждой мышечной клетки имеются длинные волокна белка миозина.	белка	белка+
1744	белка	Параллельно этому букету со всех сторон расположены длинные волокна белка-актина, и каждая миозиновая головка присоединяется к одному такому волокну.	белка	белка+
1745	белка	А. Егоров (Австрия, Институт прикладной микробиологии) доложил о результатах исследования снижения патогенности вируса гриппа путем укорочения белка NS1 и указал на перспективность такого способа аттенуации вируса в создании нового типа живой гриппозной вакцины.	белка	белка+
1746	белка	Дефектные по репликации векторы на основе NS-белка вируса гриппа оказались мощными иммуногенами в отношении Т-клеточного ответа.	белка	белка+
1747	белка	Как большинство естествоиспытателей, он считал словесное искусство низшим проявлением художественности во вселенной по сравнению с музыкой, архитектурой или строением белка, и поэтому сказал: «А я опасаюсь, что ты от природы экономно наделен умственными способностями».	белка	белка+
1748	белка	Не сочетайте вместе два разных вида белка, например мясо и яйца, иначе вскоре будете награждены отрыжкой.	белка	белка+
1749	белка	В это время организм нуждается в большом количестве животного белка, минеральных элементов, витаминов и... углеводов.	белка	белка+
1750	белка	Современная биотехнология позволяет в корне изменить ситуацию, при которой мы 30 – 40 процентов белка пускаем в отходы при переработке мяса.	белка	белка+
1751	белка	Хотя хромосомы часто приравнивают к ДНК, не надо забывать, что в них белка в два раза больше, чем ДНК.	белка	белка+
1752	белка	Рядом с рыбным фаршем, водой, крахмалом и разными усилителями вкуса обнаруживаю «генетически модифицированный концентрат соевого белка».	белка	белка+
1753	белка	Важнейшей биологической функцией нуклеиновых кислот является их участие в процессах биосинтеза белка, которые лежат в основе механизмов роста, развития организма, передачи и воспроизводства наследственных признаков.	белка	белка+
1754	белка	Агранулярная эндоплазматическая сеть принимает участие в синтезе углеводов и липидов, гранулярная – в синтезе белка.	белка	белка+
1755	белка	Это своеобразные фабрики белка, обладающие высокой производительностью:	белка	белка+
1756	белка	за час рибосомы синтезируют белка больше, чем их общая масса.	белка	белка+
1757	белка	Эластические волокна состоят из белка эластина.	белка	белка+
1758	белка	Плазма крови, лишенная белка, называется сывороткой.	белка	белка+
1759	белка	Он характеризуется повышенным обменом веществ, усиленными процессами синтеза белка.	белка	белка+
1760	белка	Секрет (слезы) имеет слабощелочную реакцию и содержит хлорид натрия, следы белка, слизи, бактерицидный фермент лизоцим и иммуноглобулины.	белка	белка+
1761	белка	Ведь они содержат много белка, жиров и минеральных веществ – железо, кальций, цинк, йод, калий и фосфор, причем в шляпках фосфора всегда больше, чем в ножках (как и у человека).	белка	белка+
1762	белка	Более половины женщин РФ получает с пищей белка меньше физиологического минимума, 44% рожениц к моменту родов страдает анемией от плохого питания.	белка	белка+
1763	белка	За лактацию, пока овца кормит ягненка, ее молочные железы вырабатывают от 50 до 200 кг молока, которое содержит до 6% белка и более 7% жира (в коровьем молоке и того, и другого в два раза меньше).	белка	белка+
1764	белка	На 5-6 порций: 500 г фейхоа, 5 ст. ложек сахара, 2 яичных белка, 10 г желатина.	белка	белка+
1765	белка	В нем много белка, жиров, витаминов.	белка	белка+
1766	белка	Богата эта группа и микроэлементами: железом, которое участвует в формировании белка и повышает сопротивляемость организма к болезням, уже упоминавшегося магния, и витамина Е, обладающего антиоксидантным действием.	белка	белка+
1767	белка	Показано, что накопление белка core коррелировало с наличием репликативной формы РНК ВГС в печени и с повышенным уровнем АЛТ.	белка	белка+
1768	белка	Масалова О. В., Самохвалов Е. И., Петракова Н. В. Выявление маркеров вируса гепатита С – белка нуклеокапсида, РНК и вирусспецифических антител в плазмах кропи доноров //	белка	белка+
1769	белка	При сравнении кодируемых аминокислотных последовательностей выявлена 1 аминокислотная замена в частичной последовательности оболочечного белка G2 (Не на Thr в позиции 262) по сравнению с другими представителями вируса Сеул.	белка	белка+
1770	белка	Исследованная область белка G2 является высоко-консервативной: аминокислотные последовательности штаммов SR-11, В-1, К1-83, SEO 80-39 на участке 244-334 полностью идентичны, а последовательность штамма R-22 отличается от них только 1 аминокислотной заменой.	белка	белка+
1771	белка	Таким образом, выявленное единичное различие в исследованном фрагменте белка G2 является существенным для характеристики изолятов из Владивостока.	белка	белка+
1772	белка	Хотя нуклеотидные последовательности изолята 7393 отличаются от соответствующих последовательностей штаммов SR-11, К1-83, SEO 80-39 (2,4, 3,0, 4,2% различий соответственно), однако эти замены являются молчащими, и кодируемая аминокислотная последовательность 7393 полностью идентична исследованному фрагменту белка G2 трех указанных штаммов.	белка	белка+
1773	белка	По действующему законодательству не маркируются и продукты, полученные с применением ГМ, но не содержащие ДНК белка и признаваемые эквивалентными традиционному аналогу.	белка	белка+
1774	белка	Так, показано с помощью метода магнитного резонанса и кругового дихроизма, что трехмерная структура эпидермального фактора роста мыши при рН 7,0 (когда белок активен) и кислом рН 2,0 (когда белок не способен связываться с рецептором) практически не меняется, за исключением небольшого участка на С-конце белка [6].	белка	белка+
1775	белка	На примере другого белка, пируваткиназы мышцы кролика, являющегося тетрамером, с использованием оптических и биохимических методов также показано, что при низких значениях рН и низкой ионной силе частично сохраняется его двухмерная структура.	белка	белка+
1776	белка	S. Polyak и соавт. [13-15] использовали тетрациклинрегулируемую систему, описанную M. Gossen и H. Bиjuard как систему, регулирующую генную экспрессию в человеческих клетках [9], и выявили, что тетрациклинрегулируемая экспрессия белка NS5A отменяла его влияние на ИФН-индукцию транскрипционного фактора ISGF-3, фосфорилирование STAT-1, PKR и антигены 1-го класса МНС.	белка	белка+
1777	белка	РНК этого варианта вируса идентифицирована как геном ВГС методами обратной транскрипции и ПЦР (ОТ-ПЦР) с использованием праймеров к 5'-NTR и к области генома ВГС, кодирующей нуклеокапсидный белок, а также методом секвенирования фрагмента генома ВГС, кодирующего область нуклеокапсидного белка ВГС.	белка	белка+
1778	белка	Фармакологическое действие – противомикробное, бактериостатическое – нарушает образование комплекса между транспортной РНК и рибосомой, что приводит к нарушению синтеза белка.	белка	белка+
1779	белка	Сконструированный в ГНЦ вирусологии и биотехнологии «Вектор» с использованием методов олигонуклеотиднаправленного мутагенеза мутантный вариант Adel2 аденовируса человека серотипа 5 является дефектным по гену белка Е1В 55К (несет делецию 2309-3427 пар оснований – п. о.) и избирательно размножается на р53-дефицитных раковых клетках, вызывая их разрушение [3].	белка	белка+
1780	белка	Ранее было показано, что полученный в США мутантный аденовирус ONYX-015, несущий деле-цию в гене белка Е1В 55К (отличается от Adel2 локализацией и протяженностью делеции), имеет 100-кратное ограничение по инфекционности для нормальных клеток человека и сохраняет репликативную активность дикого типа аденовируса серотипа 5 для опухолевых р53-дефектных клеток человека [8].	белка	белка+
1781	белка	Выявленная замена является консервативной и, вероятно, не приводит к изменению конформационной структуры белка.	белка	белка+
1782	белка	Разработана мультипептидная иммуноферментная тест-система для серотипирования генотипов вируса гепатита С (ВГС) и отработан метод такого типирования при исследовании сывороток больных гепатитом С. Тест-система разработана на основе 10 типоспецифических пептидов, моделирующих различные участки вариабельного региона NS4-белка ВГС.	белка	белка+
1783	белка	Был синтезирован набор из 10 типоспецифических пептидов, моделирующих различные участки вариабельного региона NS4-белка ВГС, ограниченного аминокислотными остатками 1683-1732.	белка	белка+
1784	белка	Аминокислотные последовательности синтезированных пептидов (подчеркнуты), моделирующих N- и С-участки вариабельного региона NS4-белка ВГС, ограниченного аминокислотными остатками 1683-1732.	белка	белка+
1785	белка	А. В. Шустов и соавт. [8] объясняют это расхождение с цитированными выше работами [2, 3, 11] тем, что авторы вышеупомянутых публикаций генотипировали вирусные изоляты методом амплификации фрагмента гена С-белка ВГС с использованием типоспецифических праймеров [14] без сопоставления получаемых результатов с данными секвенирования.	белка	белка+
1786	белка	Серологическое исследование эпитопов белка NS5 вируса гепатита С и их значение для клиники и диагностики	белка	белка+
1787	белка	Для молекулярно-генетической характеристики изолятов вируса кори был выбран фрагмент генома вируса, кодирующий С-конец белка нуклеопротеина (М-ген), характеризующийся наибольшей вариабельностью.	белка	белка+
1788	белка	Через 7 лет в лаборатории Д. К. Гайдушека была экспериментально продемонстрирована вариабельная, но важная роль микроглии в процессе образования амилоидных бляшек при прионных болезнях и высказано мнение о том, что наблюдаемая вариабельность отражает специфическую связь ее с данной нозологической формой и реализуется на уровне синтеза иРНК для белка-предшественника скрепиассоциированного амилоида [6].	белка	белка+
1789	белка	В связи с этим целью настоящей работы явилось обнаружение цитопролиферативной активности у инфекционного прионного белка, действие которой можно было бы наблюдать на самых начальных этапах инфекционного процесса, что, по существующему мнению, достаточно демонстративно можно выявлять в системах in vitro [15].	белка	белка+
1790	белка	В отличие от прошедшего обработку ферментами молочнокислой палочки белка, содержащегося в кефире и сырах, белок творога хуже усваивается организмом.	белка	белка+
1791	белка	Положительная корреляция (r = 0,42; p = 0,03) найдена между экспрессией белка NS5 в клетках печени и частотой выявления антител к этому белку.	белка	белка+
