Index	Homograph	Context	TargetWord	Label
603	белка	Согласно конкретному реализму русских христианских мыслителей, к которым принадлежит и Франк, человек – не белка в колесе, жизнь его в мире – не коловращение в пустоте.	белка	бе+лка
604	белка	Ведь главное в животных – это когда они двигаются, мы и замечаем их в движении! – когда заяц бежит, белка прыгает, птица летит, змея ползет.	белка	бе+лка
605	белка	Кто как белка уже завертелся в этом колесе, вряд ли поможет ее решить, надежда может быть как раз на тех, кто этой инерции не поддался».	белка	бе+лка
606	белка	Главная тайна этого древнего бора, тщательно продуманная Иваном совместно с первейшим его дружком Демидкой Золотухиным, состояла в том, что чем дальше, тем выше росли там деревья, так что кудлатые кроны их сокрывались в облаках, благодаря чему обыкновенная белка могла взбираться по ним в самую высоту и грызть там свой орешек, усевшись на излучинке молодого месяца.	белка	бе+лка
607	белка	Демидка не сомневался, что и белка на что-нибудь сгодится в мудреном хозяйстве у бар.	белка	бе+лка
608	белка	Скажите, это у вас хорошая белка? – приступил он, держа руку на пряжке ремня.	белка	бе+лка
609	белка	В сущности, лес жил прежней жизнью... вот ветерком рвануло позолоченные листья с осинника, вот испуганной стайкой вспорхнули красные дрозды, и вслед за ними огненная же белка перескочила на соседнюю запылавшую ветку.	белка	бе+лка
610	белка	Во всяком случае, вам нечего бояться: вы же не наследница, не родня, а просто ключница тут... пленная белка в черном мешке, вот кто вы!	белка	бе+лка
611	белка	Черная белка, сидя на ветке, любопытно глядит на человека – и снова принимается грызть кору; испуганный соболь мелькает вдали и быстро скачет с дерева на дерево; одинокая цапля с жалобным криком взлетает с болота, отбросив назад длинные ноги... мошки вьются столбом над кровоцветными ржавцами»...	белка	бе+лка
612	белка	Невдалеке зацокала белка.	белка	бе+лка
613	белка	Кругообразным движением, распушив хвост и задевая им прутья решетки, белка с утра до вечера носилась по клетке, как заведенная: с пола на нижнюю жердь, потом на верхнюю, под крышей, затем прыжком на пол – и снова на нижнюю жердь.	белка	бе+лка
614	белка	И так вот и вертишься, как белка в колесе....	белка	бе+лка
615	белка	С непривычки попробуй-ка: белка, она вон как заводная прыгает, а ее в глаз уцелить надо, иначе шкурка порченая...	белка	бе+лка
616	белка	Белка объест приманку, а сторожок и не стронет.	Белка	бе+лка
617	белка	Под бойком лежала уже замерзшая белка.	белка	бе+лка
618	белка	Вон белка-то лежит, – возразил я.	белка	бе+лка
619	белка	А может, здесь не белка была, а горностай или колонок?..	белка	бе+лка
620	белка	Он не украл: белка-то вон она!	белка	бе+лка
621	белка	Ведь не полезла же белка в кулемку во время нашей драки, а перед тем кулемка была пуста, это мы видели оба.	белка	бе+лка
622	белка	Вообще за дни, проведенные мною в городе, я очень хорошо усвоила выражение «кручусь, как белка в колесе».	белка	бе+лка
623	белка	В наше отсутствие объягнилась Белка.	Белка	бе+лка
624	белка	А Данилов говорит: война только недавно кончилась, будет вам и белка, будет и свисток, а пока фонды небольшие, управляйтесь в пределах плана.	белка	бе+лка
625	белка	Но как только вспомнишь, что зима тоже является подготовкой к лету, так и чувствуешь, что до конца дней своих так и будешь кружиться, сперва как белка в колесе, потом – как слепая лошадь, только не помню где, в чем кружатся слепые лошади, но знаю, что кружатся!	белка	бе+лка
626	белка	Между прочим, кстати о белке, у меня была белка, сразу в клетке и в колесе, т.е. белка в квадрате.	белка	бе+лка
627	белка	Между прочим, кстати о белке, у меня была белка, сразу в клетке и в колесе, т.е. белка в квадрате.	белка	бе+лка
628	белка	Я была маленькая, беличья клетка стояла на окне в моей детской, белка была рыжая с белой грудкой, и смотреть на то, как она крутится в колесе, было совсем неинтересно.	белка	бе+лка
629	белка	Завертелся я, как белка в колесе, и сейчас чувствую себя буквально выдохнувшимся.	белка	бе+лка
630	белка	Белка переходит дорогу.	Белка	бе+лка
631	белка	На внутренних сторонах обложки атрибуты наших постановок: тут цилиндр и бич директора цирка, пастушьи посохи из вертепа, шмель и белка царя Салтана, шляпа, топор и трубки дровосека из «Красной Шапочки» и т. д.	белка	бе+лка
632	белка	Вот белка тоже без дупла, И мышь за тем же здесь была, Скворец остался без гнезда, Он тоже залетал сюда.	белка	бе+лка
633	белка	Что-то я все время верчусь, как белка, – сказал он: - Самому надоело.	белка	бе+лка
634	белка	Я же целый день как белка в колесе верчусь на своем товарном складе – вешаю гвозди и отпускаю гвозди, принимаю мыло и отпускаю мыло, и выписываю накладные, и ругаюсь с поставщиками...	белка	бе+лка
635	белка	На мой вопрос, какая же здесь связь, он совершенно уверенно заявил, что убивать белок для себя – это безусловно заболеть, что это твердо установлено им на личном опыте, что ни один евен не бьет белку для себя и не ест ее мяса, хотя они убивают их тысячами, ибо когда белка предназначена для сдачи, то все обстоит благополучно, а как только она истребляется для личного пользования, так немедленно человек заболевает.	белка	бе+лка
636	белка	С книжной полки на стол и со стола на подоконник весело перелетала пушистая белка, взятая из зоопарка.	белка	бе+лка
637	белка	Испуганная всей этой возней, белка взобралась на самую верхнюю полку и, спрятавшись за толстый словарь, недоверчиво поглядывала вниз на непривычный порядок.	белка	бе+лка
638	белка	Получила белка воз орехов, когда зубы стерлись.	белка	бе+лка
639	белка	Лева все время вертится, как белка в колесе, выискивая денежные занятия.	белка	бе+лка
640	белка	Вот и вертится сердечный наш райкомщик, как белка в колесе, чтобы удовлетворить эту потребность человека.	белка	бе+лка
641	белка	Первая Белка.	Белка	бе+лка
642	белка	Вторая Белка.	Белка	бе+лка
643	белка	Я чую – и заяц тут, и белка в дупле, и ворон на суку, и куропатки в сугробе.	белка	бе+лка
644	белка	Из дупла высовывается Белка.	Белка	бе+лка
645	белка	Белка прячется.	Белка	бе+лка
646	белка	Но белка идет там и во рту несет что-то длинное.	белка	бе+лка
647	белка	Белка, вспугнутая, действительно бросилась вверх по осине вместе с добычей, но не задержалась, а большим полетом с самой верхушки перелетела вместе с добычей на елку и там спряталась в густоте.	Белка	бе+лка
648	белка	Когда погибнет весь осиновый лес и на его месте завоет сибирский ветер в еловой тайге, одна осина где-нибудь в стороне на поляне уцелеет, в ней будет много дупел, узлов, дятлы начнут долбить ее, скворцы поселятся в дуплах дятлов, дикие голуби, синичка, белка побывает, куница.	белка	бе+лка
649	белка	Белка была еще во всем зимнем меху.	Белка	бе+лка
650	белка	Там, в богатстве шишек, хозяйствует белка, клесты и, наверное, еще много неизвестных мне существ.	белка	бе+лка
651	белка	Белка, однако, заметила меня и замерла.	Белка	бе+лка
652	белка	Осенью лист соседних берез завалил его, сверху белка насыпала много шелухи от шишек, и вот теперь я пришел за пушниной.	белка	бе+лка
653	белка	Догадываюсь, что наверху как раз надо мной сидит белка с еловой шишкой.	белка	бе+лка
654	белка	В это время белка бросила целую шишку и чуть не выбила у меня книжку из рук.	белка	бе+лка
655	белка	С одиннадцати до двух мы не ходим, в это время белка сидит на сучке в большой густоте и умывается лапками.	белка	бе+лка
656	белка	Думаю о белках понятно, если большой запас, ты помнишь о нем легко, но мы видим сейчас по следам, что вот здесь белка через снег пробилась в мох, достала спрятанные там с осени два ореха, тут же их съела, потом, отбежав десяток метров, опять нырнула, опять оставила в снегу скорлупу от двух-трех орехов и через несколько метров сделала третью полазку.	белка	бе+лка
657	белка	Эта белка до того привыкла к Манькову, что вскакивала на него с разбегу, как на ствол дерева, и сидела у него на плече, когда он гулял.	белка	бе+лка
658	белка	Дурак, белка это!	белка	бе+лка
659	белка	А горячий Нургалей сразу после этих взрывов, как белка, выскочил из траншеи с двумя бутылками горючей смеси.	белка	бе+лка
660	белка	Она знает: днем белка наелась еловых семян и сушеных грибов и теперь спит крепким, безмятежным сном, надеясь, что вход в ее дупло надежно закрыт мхом.	белка	бе+лка
661	белка	Пропала белка! – сожалеюще сказал Зеленцов.	белка	бе+лка
662	белка	Кот досмерти испугался волка и, как белка, бросился на дерево, на котором спрятался медведь.	белка	бе+лка
663	белка	Знают же, черти, что верчусь как белка с этой акадэвакуацией, и все же считают возможным замахнуться и вдарить!	белка	бе+лка
664	белка	По высокому стволу сосны пробежала жирная красная белка, на секунду замерла на обломанном сучке и посмотрела вниз своими черными стеклянными глазками.	белка	бе+лка
665	белка	Вот белка, – та предусмотрительнее.	белка	бе+лка
666	белка	Если ей нехватает в лесу шишек, белка за ними к людям не пойдет.	белка	бе+лка
667	белка	Видел его в последний раз: «Я как белка.	белка	бе+лка
668	белка	Белка осыпала друзей такими насмешками, что им стало стыдно.	Белка	бе+лка
669	белка	Если вы хотите выручить маленькую девочку, я покажу вам, где живет людоед, хотя очень его боюсь, – сказала белка.	белка	бе+лка
670	белка	Белка запрыгала по деревьям, друзья поспешили за ней.	Белка	бе+лка
671	белка	Белка не выдержала и одним махом вбежала на стену.	Белка	бе+лка
672	белка	Прежде чем он встал, белка спрыгнула ему на спину, перебежала двор, шмыгнула через решетку окна и принялась грызть веревку, которой была связана Элли.	белка	бе+лка
673	белка	Сюда! – пропищала белка из кухни, и друзья бросились на ее зов.	белка	бе+лка
674	белка	Элли спрыгнула со стола, и все четверо – Железный Дровосек, Страшила, Элли и белка – побежали из замка в лес.	белка	бе+лка
675	белка	Квирр... квирр... славно сделано! – восхитилась белка и поскакала по деревьям, рассказывая всему лесу о гибели свирепого людоеда.	белка	бе+лка
676	белка	Указывает на высокую ель – на макушке, в ветвях, белка скачет.	белка	бе+лка
677	белка	Виктор замер как белка в дупле.	белка	бе+лка
678	белка	Я верчусь, как белка в колесе.	белка	бе+лка
679	белка	Чисто театральна и действенна концовка второго акта – сцена между Таисией мечущейся вверх и вниз по лестнице, как белка в колесе, и порывающейся к ней игуменьей.	белка	бе+лка
680	белка	Птицы улетели, и чужая белка быстро бросилась бежать, завидев Серую Сову.	белка	бе+лка
681	белка	Из кустов шарахнулась белка и промчалась вверх по сосне так быстро, что Травка успел только вздрогнуть.	белка	бе+лка
682	белка	Тут был целый зверинец: огромный медведь с подносом в лапах, лисица, волк, белка.	белка	бе+лка
683	белка	Вдруг смотрю – одна белка нацелилась, хвост распушила и прыг прямо на «Беду», на палубу.	белка	бе+лка
684	белка	Там, знаете, и слоны, и тигры, и крокодил, и птица марабу, и белка эта самая висит тут же в клетке.	белка	бе+лка
685	белка	Да какая еще белка, не моим чета!	белка	бе+лка
686	белка	Мои бездельницы, сидят в трюме, объедаются халвой, а у этой сделана вертушка, и она там все время, как заводная, как белка в колесе, так и прыгает, так и вертится.	белка	бе+лка
687	белка	Золотых рыбок он одобрил, сказал: «Хороши, канальи!» Белка и синичка ему тоже понравились.	Белка	бе+лка
688	белка	Пусть белка учится залезать в свою башенку по лесенке.	белка	бе+лка
689	белка	Живу, как белка в колесе.	белка	бе+лка
690	белка	Звери водятся всякие: медведи, рысь, барсук, колонок, горностай, белка.	белка	бе+лка
691	белка	Видишь, белка не наших краев, чернявая.	белка	бе+лка
692	белка	А хочешь, я тебе расскажу, как белка купила курицу?	белка	бе+лка
693	белка	Затем он стал рисовать, и один из ребят гениально проницательно воскликнул – «белка», за что подвергся всеобщему порицанию, а Михаил Петрович так даже слегка обиделся.	белка	бе+лка
694	белка	Мало того, что это белка, она к тому же Колымская.	белка	бе+лка
695	белка	Для маленькой птички, о которой рассказано в книжке, белка – страшный зверь: поэтому автор и употребил слово «морда».	белка	бе+лка
696	белка	Королек, как мышь, скользнул в листве дубка; низко пролетела земляная оса, держа в лапках труп гусеницы; давешняя белка с прерывистым, скребущим звуком, вскарабкалась по коре.	белка	бе+лка
697	белка	Как раз в то время, когда я писал это – рядом закурлыкала белка и вот после некоторых усилий, когда мы первобытным способом бомбардировали ее камнями, дармовой завтрак нам на сегодня обеспечен.	белка	бе+лка
698	белка	Конечно он не мог удержаться от соблазна что-бы не запустить в нее камнем и не потрясти деревца, на котором сидела белка.	белка	бе+лка
699	белка	Решив что перед ней не живое существо, а дерево, белка спасаясь от погони, вихрем взлетела на верхушку этого страшного дерева, которое уронив компас, заорало благим матом (маты, впрочем были не только благие) перепугав до смерти и без того напуганную белку.	белка	бе+лка
700	белка	Белка конечно за это время куда-то перекочевала, но зато мы наткнулись на обширную площадь на которой, почти на каждом деревце, торчал искусно заготовленный между двумя веточками сушеный грибок.	Белка	бе+лка
701	белка	Медведь и тетерев, белка и заяц при первых признаках осени все идут искать и есть грибы.	белка	бе+лка
702	белка	Белка, бурундук пробираются лесными тропками через Урал на запад.	Белка	бе+лка
703	белка	Потом мое внимание привлекла белка, которая занималась делом еще более серьезным: ловила собственный хвост.	белка	бе+лка
704	белка	Хвост удирал, куда глаза глядят, и белка во погоне за своим пушистым продолжением вьюном вертелась вокруг ствола мохнатой ели, рыжим, солнечным зайчиком мелькала в ветвях.	белка	бе+лка
705	белка	Но едва привалили к берегу, белка укусила за палец державшего ее коммунара и умчалась в лес.	белка	бе+лка
706	белка	Она сидела у него на руке, как белка на лапе у медведя, улыбчиво поблескивая шустрыми глазами на мужиков, на «батюшку».	белка	бе+лка
707	белка	Ура! – и Васька, как белка, поскакал по сучьям вниз и спрыгнул с дерева.	белка	бе+лка
708	белка	Каждому хозяин надо объяснить: уйдет рыба, уйдет сохатый, уйдет белка и лиса – беда будет.	белка	бе+лка
709	белка	Бобрик отправился еще раньше, Белка ему сопутствует.	Белка	бе+лка
710	белка	В настоящее время хорошо известно, что американская серая белка вытесняет местную серую белку в различных частях Англии, но совершенно неизвестно, почему это происходит, и не существует никакого объяснения этого факта.	белка	бе+лка
711	белка	Белка на поляне.	Белка	бе+лка
712	белка	За этим деревом и пряталась от меня белка.	белка	бе+лка
713	белка	Но белка-то на дереве?	белка	бе+лка
714	белка	Белка в центре, вы ходите по кругу, значит, – ходите кругом белки.	Белка	бе+лка
715	белка	Серенькая белка в два прыжка перебежала дорогу.	белка	бе+лка
