Index	Homograph	Context	TargetWord	Label
1	виски	Ее было так много, что нефтью заполнили все бочки из-под виски в округе.	виски	ви+ски
2	виски	Во время той прогулки он то и дело заходил в магазинчики в поисках фляжки для виски, как потом выяснилось, для любимой жены.	виски	ви+ски
3	виски	В отелях Дайана либо спала, либо выходила со своей неизменной фляжкой виски, опираясь на трость.	виски	ви+ски
4	виски	Я выглянула из-за чужих спин и увидела человека в майке, с полотенцем на шее, в ковбойских сапогах, с бокалом виски.	виски	ви+ски
5	виски	Он сел к моему компьютеру и стал пить свой виски.	виски	ви+ски
6	виски	Известно также, что он любит виски и хорошие сигары.	виски	ви+ски
7	виски	И вдруг до моего измученного мозга (по состоянию здоровья я в этих кошмарных гастролях практически не пил: так, немножечко виски, чуть больше пива) дошло название местечка.	виски	ви+ски
8	виски	"Мы где-то загуляли с друзьями, и один из них сказал: "" Вот хорошо бы сейчас поехать на хоккей "" (не потому, что нас так уж интересовал хоккей, а вспомнили про пресс-бар, где торговали джином и виски)."	виски	ви+ски
9	виски	"Он на этом вечере поднял бокал с виски и сказал: ""Игорь, я хочу выпить за вас и за ваши фокусы ""."	виски	ви+ски
10	виски	Да вот и мой приятель Жак, знаток всех сортов виски.	виски	ви+ски
11	виски	Коньяк, джин, виски отвергаю, причем с негодованием.	виски	ви+ски
12	виски	"Он курит или не курит (а если курит, то предпочитает тонкие голландские сигары), носит джинсовые рубашки или пиджаки (а если пиджаки, то любит английские), пьет или не пьет (а если пьет, то виски ""чивас ригал "") и так далее."	виски	ви+ски
13	виски	"Из багряного закатного океана поднимается гигантская бутылка виски ""Катти Сарк ""."	виски	ви+ски
14	виски	"Хорошо, что хотя бы выпускают такой виски! """	виски	ви+ски
15	виски	"Мы все тогда – Казаков, Евтушенко, Вознесенский – ходили со Стейнбеком и драматургом Эдвардом Олби с приема на прием, такая довольно нелепая ""светская "" жизнь, но как же еще пообщаться писателям? ""Биг Джон "" шел по Москве в невероятно длинном и огромном твидовом пальто, казалось, там, в карманах, у него большие запасы всего самого необходимого: табак, виски, чернила, бумага, сюжеты, метафоры..."	виски	ви+ски
16	виски	Мучного не ест, сладким не злоупотребляет, виски разбавляет, увлекается спортом: гольф, бассейн, бег трусцой.	виски	ви+ски
17	виски	Пил я водку, пил я виски, только жаль, без вас, Быстрицкий!	виски	ви+ски
18	виски	Еще меня устраивает, например, виски с содовой...	виски	ви+ски
19	виски	"Приятели Дмитриева по КПЖ (клуб полуженатиков), к которым Дмитриев кидался в минуты отчаянья, когда ссорился с Леной, были люди малоимущие – их состояния заключались у кого в автомобиле, у кого в моторной лодке, в туристской палатке, в бутылках французского коньяка или виски ""Белая лошадь "", купленных случайно в Столешниковом и хранящихся на всякий пожарный дома в книжном шкафу, – и могли одолжить не больше четвертака, сороковки от силы, а достать необходимо было не меньше полутора сот."	виски	ви+ски
20	виски	Вкуснейшие ананасные джусы, и апельсиновые джусы, и ледяное виски с содовой, пиво, кофе – все перегоняется в липкий соленый пот.	виски	ви+ски
21	виски	Представляешь, я сижу перед камином, ноги покрыты пледом, глоток виски, читаю Бомарше и подбрасываю полешки, а?	виски	ви+ски
22	виски	Коктейли, виски, ром, коньяк, опять коктейли, опять коньяк, опять виски всех систем.	виски	ви+ски
23	виски	Словно виски закусывал икрой.	виски	ви+ски
24	виски	И за обедом Иосиф с удовольствием выпил два или три двойных виски.	виски	ви+ски
25	виски	Ну, казалось бы, какой там виски под соленый огурец и винегрет!	виски	ви+ски
26	виски	Но надо понимать, что Бродский, выросший в молодой литературной среде послевоенного Ленинграда, воспитанный на трофейных американских фильмах, на ковбойских джинсах, о которые легко зажигается спичка, на виски с содовой, на английском языке, на сигаретах «LM», которые курил его кумир Оден, — был куда большим западником, чем сами западники.	виски	ви+ски
27	виски	Составив списки нужных людей, включая медийные персоны, посольство по домашним адресам направляло к ним курьера с презентом – фирменной бутылкой виски и приглашением 4 июля, в день независимости США, пожаловать на прием в резиденцию посла Спасо-хаус.	виски	ви+ски
28	виски	В июле 2009 г. на складе виски Jim Beam в штате Кентукки, США, вспыхнул пожар, причиной которого, по предварительным данным, стал удар молнии во время грозы.	виски	ви+ски
29	виски	Литература Джойса пропитана виски.	виски	ви+ски
30	виски	Больше всего событий приходится, конечно, на последний день: участники едят ту же еду, которой завтракал Блум (самое известное блюдо книги – жареная баранья почка), участвуют в экскурсии по памятным местам в компании актеров, проводят публичные чтения, поют песни и пьют виски.	виски	ви+ски
31	виски	Так было, когда отец, отхлебнув хозяйского виски, засадил «мерседес» в бредовое, но крепкое рекламное сооружение – при этом сам, затесненный надувными подушками, отделался буквально царапиной, тогда как боссу въехавшим штырем снесло полчерепа, и безволосый скальп его валялся на заднем сиденье, похожий на лоскут от рваного мяча.	виски	ви+ски
32	виски	Экономно прикладывались только к профессорской фляжке с виски «Шивас Регал»; если перед сном хватало сил, растирались спиртом, причем Колян, нацедив себе в ладонь, сначала отхлебывал, а потом уже принимался размазывать и расшлепывать остатки по тощему телу, напоминая в сумерках гигантского таракана.	виски	ви+ски
33	виски	В сумке у него бутылка отличного виски восемнадцатилетней выдержки, неподдельная Шотландия, так что похмельная люмпен-интеллигенция перебьется, перед Мазуром не стояла задача втираться им в доверие в качестве заграничного друга перестройки…	виски	ви+ски
34	виски	У меня есть отличный виски, Шотландия, восемнадцати лет выдержки…	виски	ви+ски
35	виски	К врачу она меня и через три дня свозит, виски похлебать согласились…	виски	ви+ски
36	виски	Уж тут-то он ни за что не вышел бы из образа: немало помотавшись по свету, прекрасно знал, что именно с такой скромной закусочкой и цедят виски респектабельные западные люди.	виски	ви+ски
37	виски	А впрочем, политик с социологом виски пили пусть и не одним махом, как поступили бы русские, но и не западными воробьиными глоточками.	виски	ви+ски
38	виски	Поскольку пьяным себя не чувствовал, достал из холодильника свое виски.	виски	ви+ски
39	виски	Майки, заскочи ко мне, если есть настроение глотнуть виски.	виски	ви+ски
40	виски	У тебя еще остался тот великолепный виски?	виски	ви+ски
41	виски	Она забросила в ротик виски столь же лихо – но все же чуть закашлялась, поморщилась, на лице изобразилось некоторое страдание.	виски	ви+ски
42	виски	Слегка раскрасневшаяся от правильной дозы виски, Беатрис легонько поморщилась:	виски	ви+ски
43	виски	Она разделалась со своим виски и безмятежно сказала:	виски	ви+ски
44	виски	Он допил свое виски и сидел, глядя в стол.	виски	ви+ски
45	виски	Пустой самовар посреди стола, три стакана с ложечками в них, на две трети налитые опять-таки жидкостью цвета крепкого флотского чая (виски закончился, но ребятки Лаврика в два счета раздобыли в городе неплохой коньяк, не местный скверноватый, а армянский), местная копченая колбаса (вот она была неплоха), сахар-печенье (главные образом для декорации), всякая плотная закуска…	виски	ви+ски
46	виски	Джеклондоновские старатели – те и на Юкон тащили кофе и виски...	виски	ви+ски
47	виски	Необыкновенное обилие ароматов и вкусов: виски, земляника, карамель, киви, мед, папайя, лимон.	виски	ви+ски
48	виски	Из талькохлорита чего только ни делали: и облицовочные плиты, и декоративные изделия, даже «ледяные» кубики, которые бросали вместо льда в виски или другие требующие поддержания низкой температуры напитки.	виски	ви+ски
49	виски	Он сидел там, перед ним была пустая бутылка из-под виски.	виски	ви+ски
50	виски	Я всегда пил, что наливали: коньяк или ром, виски или родную водяру.	виски	ви+ски
51	виски	Здоровенная кружка, наполненная до краёв хорошим виски, стояла в центре полукруга, распространяя спиртовой аромат на всё поле.	виски	ви+ски
52	виски	Тревожно огляделся по сторонам, схватил кружку с виски и припал к ней, счастливо булькая, не замечая больше ничего вокруг.	виски	ви+ски
53	виски	Лепрекон судорожно допил остатки виски и метнулся бежать.	виски	ви+ски
54	виски	Абсолютное большинство крепкого спиртного в мире – коньяк, односолодовый виски, граппа, текила, кальвадос, сливовица и прочие – это дистилляты.	виски	ви+ски
55	виски	По такой технологии, только преимущественно из ячменя, производится односолодовый виски.	виски	ви+ски
56	виски	Аналогичную роль в производстве виски играют дубовые бочки: они не только насыщают напиток дубильными и прочими ароматическими веществами, но и нейтрализуют излишние примеси.	виски	ви+ски
57	виски	Отдельный вопрос, почему изначально идентичные напитки – хлебное вино и виски – пошли такими разными путями?	виски	ви+ски
58	виски	Возможно, все дело в банальном отсутствии у нас такого количества бочек из-под хереса – а именно в них, как известно, минимум три года традиционно выдерживается правильный виски.	виски	ви+ски
59	виски	То же касается виски, граппы, кальвадоса и текилы – в них сивушного масла не меньше.	виски	ви+ски
60	виски	Хлебное же вино, обладающее своим собственным вкусом, пьется точно также, как коньяк или, скажем, односолодовый виски: по чуть-чуть, глоточками.	виски	ви+ски
61	виски	Ведь выкрутились же шотландцы, а вслед за ними и все другие производители виски.	виски	ви+ски
62	виски	Когда появился способ ректификации, они просто стали смешивать дистиллят с ректификатом, в результате чего получился массовый и дешевый blended, то есть смешанный виски.	виски	ви+ски
63	виски	Именно к этому классу принадлежат все известные сейчас массовые сорта виски – разница только в количестве дистиллята: в очень дешевых его совсем мало, в средних по цене – ну, вероятно, половина.	виски	ви+ски
64	виски	И возникло движение за настоящий односолодовый виски, который был благополучно возрожден; это произошло несколько десятилетий назад.	виски	ви+ски
65	виски	По словам профессионалов, делать капучино все равно что заливать хороший виски колой.	виски	ви+ски
66	виски	А на столе стояла бутылка виски.	виски	ви+ски
67	виски	Перевел взгляд на Руслана, потом – на бутылку виски.	виски	ви+ски
68	виски	Рита, выпьете виски? – спросил Руслан.	виски	ви+ски
69	виски	Руслан, наконец, налил виски в стаканы, а Кеша нашёл не только турку, но и сушёный имбирь.	виски	ви+ски
70	виски	Кеша выпил виски и шоколадку съел.	виски	ви+ски
71	виски	Рита, как и Руслан, держала стакан с виски, сохраняя руками тепло.	виски	ви+ски
72	виски	Руслан плеснул в стакан виски, сел возле Кеши.	виски	ви+ски
73	виски	Например, травянисто-сырой запах виски, с нотой молока.	виски	ви+ски
74	виски	Вкусный, почти густой, пахнущий виски и сливками.	виски	ви+ски
75	виски	Во всю эту глухую ночь только бесшумный Павлик иногда входил к набыченным, страшно сосредоточенным игрокам, приносил икорки, шашлыков, виски для хозяина, колы для мальчугана.	виски	ви+ски
76	виски	В день штыка в жопе я сижу восемь часов в холодном Домодедовске и думаю о Чернавочке и допиваю виски из дьюти-фри.	виски	ви+ски
77	виски	Посидев в кабаке, он идет стричься, потому что запах хорошего виски подчеркивает новизну прически.	виски	ви+ски
78	виски	И всюду прослеживается связь с западными канонами привлекательности, почерпнутыми из произведений Э. – М. Ремарка и Э. Хемингуэя: «Ася Пекуровская –... яркая, элегантная, с глазами, заведенными тушью за виски, раскованная, самоуверенная, привыкшая к поклонникам, дерзкая на язык.	виски	ви+ски
79	виски	Глоточек виски или коньячку.	виски	ви+ски
80	виски	Нормальный парень, сейчас все такие: чуть-чуть дури, много виски, много телок, – Филипп издал скабрезный смешок, – и много уколов от триппера.	виски	ви+ски
81	виски	Но открывать виски с утра Кеша не стал – он знал, насколько это обещание зыбко и обманчиво.	виски	ви+ски
82	виски	Колин, еще виски? – приветливо осведомилась хозяйка у молодого дипломата, будто ничего не слыша.	виски	ви+ски
83	виски	Тень от пожарной каланчи во второй раз накрыла стакан с виски.	виски	ви+ски
84	виски	И когда, обессиленный, выплеснулся на берег, и его подхватили многие руки, и обступили, радостно щебеча, туземцы, и когда жадно хватил виски из фляжки, поднесенной ему полицейским, и когда, уже растертый жестоко полотенцем, уже в непропавших-таки брюках сидел за общим столом, обжигаясь запеченной в пальмовом листе рыбой, запивая ее пальмовым же вином, ему казалось: какие милые люди!	виски	ви+ски
85	виски	Главное в технологии проявления и печатания, – говорил отец, то пропадая, то проявляясь в красном свете, – не перепутать виски с проявителем…	виски	ви+ски
86	виски	Бабушка же, пэрша и сэрша, оказалось, не только прикладывалась тайно (о чем все знали) к виски и обыгрывала гостей по маленькой в скат, но (о чем никто не знал, кроме управляющего) увлекалась скачками и нюхала кокаин.	виски	ви+ски
87	виски	Эх ты! – в сердцах всплескивал руками отец, причем так ловко, что не столько смахивал, сколько подхватывал бутылку виски.	виски	ви+ски
88	виски	Первый в своей жизни глоток виски…	виски	ви+ски
89	виски	А когда продышался, то плюнул в ванночку с жидкостью цвета виски, в которой только что проявился его отец, и слил в раковину.	виски	ви+ски
90	виски	Этикетки виски (шесть сортов).	виски	ви+ски
91	виски	Лучше уж виски – много жидкости вредно, особенно в зрелом возрасте.	виски	ви+ски
92	виски	Скоро, скоро мой последний виски!	виски	ви+ски
93	виски	Чай? кофе? сигара? коньяк? виски?	виски	ви+ски
94	виски	Порция виски в хорошей компании…	виски	ви+ски
95	виски	Цепляясь за эту соломинку, N послушно пил спирт с измельченными в нем позвонками бенгальского тигра, виски с растворенными семенниками изюбря, а также особый настой новозеландской валерианы, одна капля которой делала неисправимым алкоголиком любого кота.	виски	ви+ски
96	виски	И вообще, что касается будней, мир вокруг рака-отшельника, заползающего по вечерам, словно в панцирь, в безлюдный дом и записавшего в окончательные друзья весьма молчаливых сообщников – стаканы, рюмки и бокалы для коньяка, – совершал свои обороты; там бурлили какие-то войны и пузырились революции, и, когда, перебивая общение N с доброй порцией старого виски, начинал бормотать телевизор, глашатаи этого мира, мелькая в светящемся ящике, призывали вернуться к реальности («Голосуйте!	виски	ви+ски
97	виски	Пиво будешь или хочешь виски?» «Сам возьму», – буркнул я.	виски	ви+ски
