Index	Homograph	Context	TargetWord	Label
1075	виски	Или вам уже нельзя? – спросил он и достал из своего кофра виски «Белая лошадь».	виски	ви+ски
1076	виски	У Стигера по этому случаю обнаружилась бутылка виски, я рассказал, насколько мне позволял мой английский, о том, что это за праздник для нашего народа, что это второй день рождения нашей страны.	виски	ви+ски
1077	виски	Но праздник прошел очень здорово, всем понравилось, до этого я подарил ребятам на Первое мая каждому по деревянной, расписанной хохломским узором рюмке, и вот, наполнив их американским виски, мы подняли тост за Победу.	виски	ви+ски
1078	виски	Палантан, хмыкнув еще, запрокинул голову назад и вылил в себя виски, по привычке резко и решительно, как в последний раз.	виски	ви+ски
1079	виски	А сейчас вдруг заторопился: выплеснул в стакан остатки виски из бутылки, махом выпил, крякнул и мощно поднялся из-за стола.	виски	ви+ски
1080	виски	Когда Палантан понял это, то предложил капитану в аренду за виски усилительную аппаратуру, установленную в тюрьме лет пять назад для прослушивания камер.	виски	ви+ски
1081	виски	Будто предчувствуя такое их желание, старуха буфетчица принесла им виски и немного закуски.	виски	ви+ски
1082	виски	Потом буфетчице пришлось еще сходить за виски, потому что офицеры угощали солдат.	виски	ви+ски
1083	виски	Растравили, гады, глотком виски…	виски	ви+ски
1084	виски	Не верю, что такой политик, как Ельцин, мог купиться на виски.	виски	ви+ски
1085	виски	Крутя головой, долго ловил взгляд официанта, а когда тот подошел, заказал, стесняясь произношения, еще один виски, столь же крамольный в Европе, как в России водка.	виски	ви+ски
1086	виски	Он перевел дух, допил четвертый виски, вовремя вытребованный догадливым Лажечниковым, и, откинувшись в кресле, стал смотреть сквозь большое окно бара на улицу.	виски	ви+ски
1087	виски	Уже вторая – крепче, виски – на четверть была пуста.	виски	ви+ски
1088	виски	Хорошие стихи... – она взяла стакан; взглянув, сколько в нем осталось виски, подумала, что быстро выпьет, а они уже будут в постели, потому что она, конечно, хочет с ним в постель, но уже не пойдешь... налила еще.	виски	ви+ски
1089	виски	Посмотрим, что ты можешь...» Она все-таки успела сделать два больших глотка, тут же скопившихся во рту, лезущих наружу – она пила чистое виски, – но, поборов желание организма, видимо, освободиться от алкоголя, она сглотнула его и уже тянула руки к Димитрию.	виски	ви+ски
1090	виски	Но пить больше нечего, – Димитрий болтнул оставшимся в бутылке виски.	виски	ви+ски
1091	виски	Димитрий затянулся, выпил виски и подошел к Славице.	виски	ви+ски
1092	виски	Джим открыл Славке бутылку виски.	виски	ви+ски
1093	виски	В холодильнике, помимо неизвестно откуда появившейся бутыли виски, в отделении для овощей, лежала морковь-зебра.	виски	ви+ски
1094	виски	И даже виски было там, на кухне.	виски	ви+ски
1095	виски	Впрочем, уже сделала спасительный глоток из бутыли виски.	виски	ви+ски
1096	виски	Надо подстраиваться под здоровый американский образ жизни, – сказал Влад и, пойдя на кухню, плеснул себе в стакан виски.	виски	ви+ски
1097	виски	Валерьянка запивал виски ромом, купался в шампанском и сплевывал коньяк.	виски	ви+ски
1098	виски	Он залпом выпил стакан виски и потерял сознание».	виски	ви+ски
1099	виски	Я пью неразбавленный виски, Пью водку с зернистой икрой, А друг мой, писатель Левицкий, Лишь бабочек мучить герой…	виски	ви+ски
1100	виски	Заказывали виски?	виски	ви+ски
1101	виски	Заказали по двойному виски с тоником.	виски	ви+ски
1102	виски	Кормила нас пшенной с пережаренным луком кашей, налила и по рюмочке виски.	виски	ви+ски
1103	виски	Слушал, запивая виски, поскольку был весьма депримирован последние два дня.	виски	ви+ски
1104	виски	Проводить приемы им и совсем неловко, так как гости предпочитают виски или что-то в этом роде.	виски	ви+ски
1105	виски	Так что сейчас В.Л. купил здесь пару бутылок виски для чрезвычайных случаев.	виски	ви+ски
1106	виски	Правда, от него осталась только орденская книжка – саму звезду дядя в Торгау, на Эльбе, сменял у какого–то американца на бутылку виски – тому очень хотелось, а никто не соглашался отдать «Звездочку».	виски	ви+ски
1107	виски	Он достал из холодильника бутылку виски и отхлебнул прямо из горла.	виски	ви+ски
1108	виски	У меня в «мерсе» коньяк, виски...	виски	ви+ски
1109	виски	Аллах запретил сок виноградной лозы, про виски ничего не сказал.	виски	ви+ски
1110	виски	Они пили виски.	виски	ви+ски
1111	виски	В невероятном волнении, весь дрожа и приплясывая на своих худых, уже старческих ногах, он с трудом, расплескивая недопитое виски, поставил стакан на книжную полку и обеими руками попытался расстегнуть тугой ворот рубахи.	виски	ви+ски
1112	виски	Но все равно они шли и улыбались незнакомым людям, а незнакомые люди улыбались им, и на Кировской, у ворот бегичевского особняка, вихрился людской водоворот, потому что там толпились летчики наших союзников и угощали желающих виски.	виски	ви+ски
1113	виски	Мне было больно и грустно читать донесения Степаниды, что Батюшка, теряя веру в свое предназначение, стал попивать (все чаще выгребала она из Его кабинета бутылки из-под виски и содовой).	виски	ви+ски
1114	виски	Небо было разорвано в клочья, но на оторванном от общего слоя облаке стареющий миллионер все еще протягивал стакан виски уже расстрелянной бомбардировщиками юной любовнице.	виски	ви+ски
1115	виски	У стойки стоял багроволицый американец и сосал обычное их виски-сода.	виски	ви+ски
1116	виски	А может, угостить вас виски? – осведомился тем не менее бизнесмен.	виски	ви+ски
1117	виски	Я спокойно взял нетронутую бутылку виски и, легонько взвесив в руке, спросил у Наташи:	виски	ви+ски
1118	виски	Они заволновались и стали поспешно пододвигать мне свою посуду, куда я щедро, до края бухал виски.	виски	ви+ски
1119	виски	Проклятое виски нанесло чувствительный урон.	виски	ви+ски
1120	виски	Приезжает ковбой в Техас на лошади для того, чтобы выпить бокал виски.	виски	ви+ски
1121	виски	Заходит ковбой в салун, берет виски пьет, говорит бармену:	виски	ви+ски
1122	виски	Слушай, Джо, я не хочу сказать ничего плохого про твое виски...	виски	ви+ски
1123	виски	Сидят как-то ковбои в своем любимом салуне, пьют виски.	виски	ви+ски
1124	виски	Приезжий человек на Диком Западе зашел в салун, заказал себе виски с содовой, сидит пьет.	виски	ви+ски
1125	виски	Ковбой подъехал к бару и с ходу заказал пятнадцать бутылок виски:	виски	ви+ски
1126	виски	Стакан виски бесплатно.	виски	ви+ски
1127	виски	Дали ему стакан виски.	виски	ви+ски
1128	виски	Невозмутимый бармен наливает в миску виски, кладет рядом помидор.	виски	ви+ски
1129	виски	Чтоб виски да помидорами закусывать?	виски	ви+ски
1130	виски	На эти деньги она купила Левушке заводной мотоцикл, сестре – цветы, а Фиме – полгаллона виски.	виски	ви+ски
1131	виски	Там, сдвинув шляпу на затылок, опрокидывают двойное виски.	виски	ви+ски
1132	виски	Жизнерадостные журналисты, против своего обыкновения, совсем по-русски принесли с собою в спортивных сумках изрядный запас выпивки – виски, джин, тогда это было в новинку – все пошло в ход, я много и наравне с гостями пил, когда все пьют много, то выпивки обязательно не хватает, и уже почти ночью, перед расставанием, я открыл дверь, ведущую из мастерской в квартиру, и громко крикнул:	виски	ви+ски
1133	виски	На первом этаже был буфет, где многие останавливались выпить один-два стаканчика виски со льдом, или пиво, или просто сок, или «Кока-колу».	виски	ви+ски
1134	виски	Вручил подарок – посольскую водку и виски.	виски	ви+ски
1135	виски	В свое время, Борис Леонидович Рославцев подарил мне на 60-летие пятилитровую четверть прекрасных английских виски.	виски	ви+ски
1136	виски	Когда я об этом вспомнил, то сразу Маше сказал (и она активно меня поддержала), что наступил «звездный час» этим виски.	виски	ви+ски
1137	виски	А здесь пять литров чистейших виски!	виски	ви+ски
1138	виски	Этот концерт слушал плохо, так как был несколько в опьяненном состоянии (то ли это было шампанское в баре Мэле, то ли виски у Фрэнсиса – а может и что-нибудь другое), во всяком случае, не от хорошего настроения – что подошло к финалу шестого квартета, названного «Меланхолия».	виски	ви+ски
1139	виски	В первый же вечер после нашего приезда в огромном конференц-зале отеля состоялся, как это обычно бывает, прием, где в невероятной тесноте, держа в руках стаканы с виски, участники ученого сборища, диффундируя друг через друга, взаимно «обнюхивались».	виски	ви+ски
1140	виски	Так, недавно публичному бичеванию подвергся итальянский католический священник, у которого нашли бутылку виски, 16 бутылок вина и ящик пива.	виски	ви+ски
1141	виски	Я видел, как на его лице, чуть раскрасневшемся от виски, отсвечивают разные мысли – от проверки того, не ляпнул ли он а разговоре со мной лишнего, до сомнения в моей принадлежности к такому учреждению.	виски	ви+ски
1142	виски	Кроме того, как мне показалось, он не знал, что ему делать с недопитой бутылкой виски – оставить мне или забрать.	виски	ви+ски
1143	виски	Рем Степанович взял из бара бутылку виски, открутил с хрустом пробку, плеснул в бокал, жадно выпил.	виски	ви+ски
1144	виски	Я пью виски со льдом.	виски	ви+ски
1145	виски	И мне чуть-чуть плесни виски.	виски	ви+ски
1146	виски	Сидит у стойки, пьет свое виски со льдом.	виски	ви+ски
1147	виски	Вы бы закусили, – сказал Геннадий, просто съежившись от этих длинных глотков, от этого неразбавленного виски, которое сейчас забушевало пламенем в Кочергине.	виски	ви+ски
1148	виски	Кому кофе подавай, кому чай, кому виски, кому джин.	виски	ви+ски
1149	виски	Джинсы «Левис», пластинки «Биттлз» или «Роллинг-Стонов», шотландское виски – вот его идеал.	виски	ви+ски
1150	виски	Жена Гансона – переводчица и секретарь московского филиала – подала кофе и виски.	виски	ви+ски
1151	виски	МИД Канады (выходец из России) и как бы между прочим за стаканом виски сказал: «Почему бы вам мистер Яковлев не заменить 11 ваших работников на 11 дипломатов?»	виски	ви+ски
1152	виски	И виски с содовой в граненых шестикопеечных стаканах...	виски	ви+ски
1153	виски	Менеджер тайком протащил за пазухой бутылку виски, спрятал ее за сливным бачком туалета, отделанного бразильским малахитом, куда время от времени путешествовали умиравшие от скуки «Хвостатые», чтобы приложиться, а заодно выкурить чинарик марихуаны, к которой они уже привыкли.	виски	ви+ски
1154	виски	Неужели Альенде не понимает, что он обречен?» Только вчера соотечественник корреспондента, изрядно накачавшийся босс из ИТТ – интернациональной телефонной компании, шепнул ему в баре, вылавливая пальцами лед из виски и швыряя его себе в бездонную, но уже отказывающуюся от спиртного глотку: «Спеши брать интервью у президента…	виски	ви+ски
1155	виски	По обыкновению, только мы пили даже и виски, хотя здесь жарко, особенно на солнце.	виски	ви+ски
1156	виски	Затем Секретев, напоив нас виски, проводили в аэропорт.	виски	ви+ски
1157	виски	Она достает из портфеля шоколад и бутылку виски «Лонг Джон».	виски	ви+ски
1158	виски	Он знал, где можно достать виски, взял такси и поехал.	виски	ви+ски
1159	виски	Он, собираясь, приказал закупить рыбы и виски.	виски	ви+ски
1160	виски	Из питья – джин, виски, «Куба либре» и «Мохито» (с травкой), а из еды креветки в тесте, чернослив с орехами в кожуре из грудинки, ветчинная рулетка, кальмары в тесте, жареные куриные ножки и под конец сладости вроде берлинского печенья – вполне вкусно.	виски	ви+ски
1161	виски	За религию, за политическую идею, за искусство, за семью, за бутылку виски, за разврат, а когда уже не за что держаться – держится за собственный, личный страх смерти.	виски	ви+ски
1162	виски	Барс торжественно вручил бутылку шотландского виски Сашке Голубеву, который, несмотря ни на что, оказался лучшим стрелком.	виски	ви+ски
1163	виски	Потом повесил рюкзак на березу, сел, взял бутылку с виски и побулькал около своего уха:	виски	ви+ски
1164	виски	Когда по кругу пошла бутылка с виски, я, не прощаясь, ушел к реке.	виски	ви+ски
1165	виски	Надя, на мгновение покинувшая кухню, чтобы повесить пиджак, под выдох его вернулась, но на необычное его глотание виски не отозвалась никак, только мигом поставила перед ним прибор, закуску и подсела к столу, глядя на него снизу вверх.	виски	ви+ски
1166	виски	Она вскочила и занялась розами, а Афанасий Иванович, выпив одну за другой три рюмки виски и съев что-то, наконец успокоился, повеселел и решил начать с того, чтобы познакомиться с негром поближе.	виски	ви+ски
1167	виски	Виски? – предложил Афанасий Иванович, обнял негра и увлек на кухню, где негр с удовольствием стал посасывать виски из рюмки, раздражая Афанасия Ивановича этой своей чуждой нам привычкой.	виски	ви+ски
1168	виски	Когда Алик Желтов, как и все до и после него, остолбенел от Надиной красоты, явившись впервые к ней в гости вместе со мной, а Алеша тосковал в Москве, откуда слал Наде ежедневно письма и телеграммы с описаниями своего чувства и вопросами к ней насчет здоровья и про то, не передумала ли она и не собирается ли вернуться либо просто приехать в гости, он был бы счастлив, ничего бы себе не позволил, только так, как она захочет, а деньги он на дорогу пришлет, он продал только за последнюю неделю девятнадцать «Летучих Голландцев», как он именовал свои парусники, плывущие по волнам и срисованные им с известной рекламы виски, так что с наличностью у него хорошо; когда прочие поклонники жужжали вокруг нее комариной тучей, от Афанасия Ивановича не было ни слуху ни духу.	виски	ви+ски
1169	виски	Помимо всего прочего, а может быть, главным образом, – ему жалко наших 30 франков, а девочки требуют виски...	виски	ви+ски
1170	виски	Секретарша принесла бутылку виски, лед и два бокала.	виски	ви+ски
1171	виски	Вы не взглянули на мою секретаршу, вы не допили виски, короче, вы не в форме.	виски	ви+ски
1172	виски	Сейчас Маша уже отдыхает, у нее разболелась голова, но она все же за успехи предложила выпить по10 гр. виски.	виски	ви+ски
1173	виски	И с ним пили виски, молчали, а пили.	виски	ви+ски
1174	виски	Сначала пили джин, виски, а около 23 часов сели за столы со скатертями и приборами и прислуга подавала сначала что-то очень острое, а потом что-то вроде индейки с салатом, на десерт – сухофрукты, мороженое и крендельки с орехами.	виски	ви+ски
1175	виски	А я хотел бы теперь сидеть в аэропорту какого-нибудь экзотического города в неведомой стране, попивать двойную порцию виски в ожидании больших дел и писать тебе совсем другое письмо.	виски	ви+ски
1176	виски	А потому что плох был со встречи Нового года, и он мне подлечиться дал – бутылку великолепного шотландского виски.	виски	ви+ски
1177	виски	И заругался в полную мощь, опасаясь, естественно, более всего за целостность виски в кармане, а не за шею.	виски	ви+ски
