Index	Homograph	Context	TargetWord	Label
579	виски	Жена заподозрила неладное, стала следить за нянькой, и обнаружилось, что эта хитрая старая мисс в бутылочку с молоком всякий раз добавляет немного виски, чтобы ребенок не плакал и все время спал.	виски	ви+ски
580	виски	Был виски.	виски	ви+ски
581	виски	Только рядом на полу еще стояла недопитая бутылка виски.	виски	ви+ски
582	виски	Процессы производства и рецепты разных марок различались, но главным было то, что при производстве абсента не создается крепкий алкоголь, как в случае виски или бренди; спирт, полынь и другие травы просто соединяются вместе...»  (Фил Бейкер).	виски	ви+ски
583	виски	О столь возвышенных предметах, как вино и виски, можно писать по-разному, что и сделали авторы.	виски	ви+ски
584	виски	А вот том «Шотландский виски» известного журналиста Эркина Тузмухамедова по поэтичности тянет на балладу, что, впрочем, не мешает изданию тоже содержать бочку необходимой информации.	виски	ви+ски
585	виски	Что касается выбора напитков, то всем огненным знакам, к каковым относится и Овен, рекомендуем в любой праздник, а на сегодняшней стрельцовской Луне особенно, красное сухое, игристые вина, полусладкое шампанское, зубровку, коньяк, шотландское виски, из водок предпочтительны «Московская», «Столичная», «Смирновская», «Пшеничная», «Кремлевская» (упаси Боже употребить все сразу!), из закусок неплохо остановиться на морепродуктах, импортных деликатесах, фруктах, орехах во всех мыслимых (но разумных) сочетаниях.	виски	ви+ски
586	виски	Перечислим вина: розовые, красные сладкие, шампанское сладкое, мускат, настойки, ликер, ром, коньяк, ирландское виски.	виски	ви+ски
587	виски	К фолиантам, посвященным виски и французским винам, недавно прибавились еще два практических путеводителя – о коньяках и шампанском.	виски	ви+ски
588	виски	Семга панируется в кунжутном семени, овощи сдобрены соевым соусом, на гарнир подаются фрукты в карамели, а четыре вида жареного мяса, политого виски, эффектно поджигаются на столе клиента.	виски	ви+ски
589	виски	Для домашнего использования предлагаем рецепт от ресторана «Ливерпуль»: простой в приготовлении, вкусный и нарядный стейк с овощами, тихую музыку «Битлз», пиво (например, Guinness) и какое-нибудь выдержанное виски в качестве дижестива.	виски	ви+ски
590	виски	Она шокирует, провоцирует, издевается: выплескивает на сцену содержимое ночного горшка, пьет виски прямо из горлышка бутылки, нахально интересуется интимными анатомическими особенностями негров, выплясывает африканский танец и неуклюже заваливается на спину не в силах удержать осанку.	виски	ви+ски
591	виски	Как сильная натура, Овен предпочитает крепкие напитки с сильным вкусом – такие, как виски или коньяк.	виски	ви+ски
592	виски	Ей нравится доводить все до совершенства, поэтому, открыв для себя однажды какой-нибудь напиток, виски к примеру, она не остановится, не попробовав все сорта и не научившись различать на вкус года и страны.	виски	ви+ски
593	виски	Козерог предпочитает строгие напитки, такие, как классическое виски, single-malt, хорошие французские вина.	виски	ви+ски
594	виски	Отдернул портьеру, наложил пальцы на лоб Маркину, большим и средним пальцем охватил виски.	виски	ви+ски
595	виски	Кое-кто из ошалевших от нищеты, а может, от наркотиков или дешевого виски гарлемцев стал поговаривать, будто Черная Мамба – возлюбленная стены!	виски	ви+ски
596	виски	Обратите внимание, как все красиво: он съезжает с трамплина Воробьевки на чемодане, в который уложено все самое дорогое в его жизни – несколько американских детективов, бутылка виски – с таким багажом и впрямь впору бросаться с трамплина...	виски	ви+ски
597	виски	Я не знал, могу ли его поздравить с пятидесятым днем рождения, впрочем, и желания такого не испытывал, и, едва дождавшись, когда полковник тронет свою стопку, заглотнул виски.	виски	ви+ски
598	виски	Я тебе виски наливаю, вот...	виски	ви+ски
599	виски	Он вылил остатки виски из бутылки по стопкам.	виски	ви+ски
600	виски	Кто бы мог подумать, что по каналам доставки спирта и виски, отлаженным в годы «сухого закона» в Америке, после его отмены десятки лет беспрерывно «качают» наркотики?	виски	ви+ски
601	виски	Помощник добавлял следом в каждую из фарфоровых манерок по несколько капель змеиной желчи, меда и местного виски «Мекхонг».	виски	ви+ски
602	виски	Шведы ходят в другие места, где подают виски и водку.	виски	ви+ски
603	виски	Приземистый индус неторопливо налил виски в стакан Ханга.	виски	ви+ски
604	виски	Свой стакан Джеффри не трогал, он не хотел приезжать к Ольге с запахом виски.	виски	ви+ски
605	виски	Нуган допил виски в стакане.	виски	ви+ски
606	виски	Изнервничавшийся и усталый Джеффри, у которого белградская простуда после глотка виски переплавилась в головную боль, наорал на него, выскочил из машины, потом снова сел и заставил по справочнику искать свою улицу – Сандерс-роуд.	виски	ви+ски
607	виски	За соседним столом двое индусов, возле которых томился официант с бутылкой виски и ведерком льда на алюминиевом подносе, кричали, обсуждая цены на мануфактуру.	виски	ви+ски
608	виски	Официант по винам с хрустом свернул алюминиевую пробку с квадратной бутылки виски «Олд Парр».	виски	ви+ски
609	виски	Ведь не зря деловые американцы во время встречи и делового разговора рюмочку-две виски или коньячка пропустят.	виски	ви+ски
610	виски	И еще они поняли, что в картонных ящиках были два одинаковых графина с виски.	виски	ви+ски
611	виски	Никогда раньше они не пили виски, хотя, конечно, слышали об этом напитке.	виски	ви+ски
612	виски	В ней было написано, что самое хорошее в Шотландии виски было настояно в двух больших бочках, а затем бутилировано.	виски	ви+ски
613	виски	Там же был нарисован стакан, на дне которого была обозначена полоска виски, а остальное было заштриховано, что обозначало содовую воду.	виски	ви+ски
614	виски	С тех пор Андрей никогда не пьет виски, даже при запахе его начинает тошнить.	виски	ви+ски
615	виски	Он еще только начал все это обдумывать, а виски уже рванул под небом бомбой-самоделкой грамотных городских партизан, подлым устройством, нашпигованным обрезками гвоздей – направленная взрывная волна ударила вверх и, пройдя носоглотку, начисто сметя скопившийся там необязательный обонятнельный хлам, прицельно накрыла мозг, и каждый острый обрезок с бешеным ускорением воткнулся в свою клетку коры.	виски	ви+ски
616	виски	Другое дело (подхлестнутые ветрами Северного моря, мысли Вадима развили недурную скорость), что есть виски за двадцать шесть латов – а есть за двести двадцать шесть.	виски	ви+ски
617	виски	О, виски, – не слишком уверенно сказал хорьковидный и тут же опять возликовал.	виски	ви+ски
618	виски	Действительно хороший выбор только в гастрономическом отделе: практически дьютифришные цены на виски.	виски	ви+ски
619	виски	Итак, пейте сколько угодно виски, вина, пива, курите сигареты, трубки, сигары – это всё хорошие, разрешенные психотропы.	виски	ви+ски
620	виски	Когда всеблагий наш Господь Послал свой гнев на Сан-Франциско, Зачем разрушил Он все церкви, Но пощадил Хоталинг-виски?	виски	ви+ски
621	виски	Опрокинешь стаканчик виски – у всех шары на лоб.	виски	ви+ски
622	виски	Ну вот, теперь полный комплект: красный «Попов», оранжевый «Гордон», желтое виски «Катти Старк», зеленый мятный ликер, голубой «Сапфир Бомбея», синий импортный кальвадос, фиолетовая водка «Небеса».	виски	ви+ски
623	виски	Говорит мне: «Оксана, принеси нам виски», – повелительным тоном.	виски	ви+ски
624	виски	И все время: «Оксана, улыбайся!» А я и понятия не имею, где это виски стоит.	виски	ви+ски
625	виски	Вместе с бутылкой шотландского виски – в порядке компенсации, так надо понимать.	виски	ви+ски
626	виски	Одиннадцать часов перелета они мне отравили-таки: я волновался, хлебал виски, приобретенное в шереметьевском фри-шопе, добавил на Шпицбергене– и молился.	виски	ви+ски
627	виски	Присутствующие с некоторым недоверием оглядели мой твидовый Дэвид Хантер, приличные и вычищенные в самолетном туалете итальянские штиблеты и цветущий от выпитого в полете виски общий вид лица.	виски	ви+ски
628	виски	Но когда он, знаками выманив мою жену в другую комнату, попросил ее незаметно принести стаканчик виски – я все понял: он «развязал».	виски	ви+ски
629	виски	Я попивал хозяйское виски, сам Василий Павлович чуть отглатывал шампанское.	виски	ви+ски
630	виски	Соответственно, когда оно закончилось, Васиного виски весьма поубавилось, а время шло к двум.	виски	ви+ски
631	виски	Философствовать на тему «Мементо мори» хорошо, уютно устроившись в кресле под клетчатым пледом со стаканом шотландского виски и томиком Уайльда или Шелли в руках.	виски	ви+ски
632	виски	Допив виски, решили попробовать джин.	виски	ви+ски
633	виски	Вместе с экс-президентом (кофе, мороженое и немного виски) эти люди повели долгую и, прямо сказать, трудную беседу о том, как притормозить нависший Суд.	виски	ви+ски
634	виски	Покончив с беседой (с мороженым, с кофе и с виски), верные люди к середине дня разошлись.	виски	ви+ски
635	виски	У экс-президента Р не было больших денег, тающих теперь, как мороженое или как выставленное дармовое виски.	виски	ви+ски
636	виски	Потом, уже на новой квартире, был устроен на скорую руку ужин, на которые она была большая мастерица, и мы за разговорами опустошили бутылку венгерского виски.	виски	ви+ски
637	виски	Он не любил виски, предпочитая ему водку.	виски	ви+ски
638	виски	Футбол – единственное развлечение в этом городе, способное соперничать в популярности с виски и элем.	виски	ви+ски
639	виски	И вот в обеденный перерыв, после съемок какого-нибудь особенно кровопролитного эпизода, наша космополитическая киногруппа собиралась у грузовика жуликоватого неаполитанца Джованни, продававшего нам мукачевскую минеральную воду по цене старого виски, – собиралась и спорила.	виски	ви+ски
640	виски	Тогда давайте выпьем, – улыбнулся он, доставая виски.	виски	ви+ски
641	виски	Трогай, Леня!.. – бодро приказал Гречишников, заглядывая в задний отсек, где лежали кожаные чехлы с ружьями, стояли ящики с пивом, водкой и виски.	виски	ви+ски
642	виски	Достали из ящика водку и виски.	виски	ви+ски
643	виски	Там был французский разведчик Виньяр, с кем сидели в кабульском баре, пили виски, а потом француз лежал мертвый в камере Пули-Чархи.	виски	ви+ски
644	виски	Один доливал в стаканы золотистое виски, другой щипцами кидал оплавленные кубики льда.	виски	ви+ски
645	виски	Мы же позволим себе легкий ужин и немного виски.	виски	ви+ски
646	виски	Водка, виски, вино?	виски	ви+ски
647	виски	У столиков, среди тропических деревьев, словно это были Фиджи или Сейшелы, бармены в белых камзолах наливали из толстых бутылок виски, коньяки, замороженную, с золотой искрой водку.	виски	ви+ски
648	виски	Сегодня утром после совершения акта любви, не говоря о двух вчера вечером, непомерного поглощения гутмановской водки и каматэровского виски и после того, как она мне сказала, что это – в последний раз (хотя я не знаю, что значит «это»?), на пике алкогольно-эротического похмелья я вдруг совершенно ясно увидел, что математически чрезвычайно маловероятные события ПРОИСХОДЯТ.	виски	ви+ски
649	виски	Уж лучше мы будем беседовать о чем-нибудь утешительном, – он беспомощно развел руками, – чем каждому в одиночку напиваться виски».	виски	ви+ски
650	виски	Стюардесса с гербом Города на наколке и с девизом «Лучше умереть здоровым, чем жить больным» – красными буквами на зеленом переднике – принесла виски Тимоти и водки мне.	виски	ви+ски
651	виски	Тимоти отхлебнул виски, удовлетворенно произнес «Дикая утка!» и объяснил, что дело, по которому он едет в Город, довольно глупое, но требует если не дипломатического такта, то какого-то минимума филологических познаний.	виски	ви+ски
652	виски	Я потерял женщину, – объявил Валька, усаживаясь за стол и наливая себе еще виски.–	виски	ви+ски
653	виски	«Вы – виски или водку, как наш общий друг?» – Тимоти передал ему карту напитков.	виски	ви+ски
654	виски	Тимоти был так потрясен этим заявлением, что автоматически налил виски в стакан для минеральной воды, залпом его выпил и, вытерев салфеткой пот со лба, бросил ее на стол и твердо сказал: «Отделенность власти – не более чем одна из сторон Темы Замка.	виски	ви+ски
655	виски	Вместе с деловыми партнерами Шут ходил в сауну и пил виски в «Немо» на Гороховой.	виски	ви+ски
656	виски	Фирма с длинным названием приглашала на дегустацию виски «Chivas Reagal».	виски	ви+ски
657	виски	Специалист по питию виски оказался тощим и суетливым мужчинкой.	виски	ви+ски
658	виски	В каждом на донышко был налит особый сорт виски.	виски	ви+ски
659	виски	Иногда я подливал виски ему в бокал.	виски	ви+ски
660	виски	Кто-то из соседей пил виски прямо из горлышка.	виски	ви+ски
661	виски	Политик гоняет охранников за виски, сгонял уже три раза и все выпил, а ей приходится пить наравне с ним.	виски	ви+ски
662	виски	В понедельник в «tex-mex» в «Невских Мелодиях», во вторник в итальянский «Милано», в среду в канадский «Монреаль Стейк», и там пьяный хозяин выпивал с ними четыре бутылки самого дорогого виски.	виски	ви+ски
663	виски	Он заказал для нее самые дорогие сорта виски, а на десерт им принесли целый ананас, пропитанный изнутри взбитыми сливками.	виски	ви+ски
664	виски	Я докурил сигарету, допил виски.	виски	ви+ски
665	виски	Они точно знали манеру поведения: насколько они по виду выпивши, и чего – молока или виски.	виски	ви+ски
666	виски	Даже когда в Феста стреляет Черный Джек и он бездыханно лежит на полу салуна, где в течение нескольких недель демонстрировал различные киноленты, отвратившие завсегдатаев этого питейного заведения от виски, драк и прочих жизненных грубостей.	виски	ви+ски
667	виски	Вхожу в буфет и вижу: красивый, седой, с бородой, заказывает виски.	виски	ви+ски
668	виски	Богатые покупали из-под полы в дуканах поставляемую в Афганистан из Пакистана безбожно смелыми торговцами болгарскую водку и шотландское виски.	виски	ви+ски
669	виски	Возвратясь к себе в номер, лег на диван и выстрелил себе в виски из двух револьверов».	виски	ви+ски
670	виски	Вернувшись в дом, Марианна выпила виски.	виски	ви+ски
671	виски	Дай мне замолить грех за его виски.	виски	ви+ски
672	виски	Я сказал: «Чистый виски.	виски	ви+ски
673	виски	Я восхищался зданием, отделкой интерьера, обслуживанием, петербургским произношением профессора Нодзаки, видом из окна, тем, что виски в заказанной бутылке можно не допить, на ней напишут твою фамилию и сохранят остаток до следующего визита.	виски	ви+ски
674	виски	Нет, я не хочу виски, – сказал Миядзава.–	виски	ви+ски
675	виски	Мне в Австралии рассказали историю: когда решался вопрос, какое производство развивать – водочное, виски, вина или пива, – провели исследование.	виски	ви+ски
