Index;Homograph;Context;TargetWord;Label
665;чайку;Потом она мне сказала: «Поехали, выпьем чайку, я хочу, чтобы ты со мной играл». ;чайку;чайку+
666;чайку;Вечером нас приглашают попить чайку, здесь же, в доме, то ли Реформатские, то ли Шкловские. ;чайку;чайку+
667;чайку;Ты приходи ко мне обязательно, чайку попьем, ты не бойся, приводи мужа, только позвони сначала, а то ко мне народу много ходит, телефон такой-то». ;чайку;чайку+
668;чайку;Иди, Лидка, чайку поставь, – приказала Тома старшей племяннице и с гордостью заметила: – Кран у нас прям на кухне, на колонку не ходим. ;чайку;чайку+
669;чайку;Попьем чайку с вами, чаек согревает... ;чайку;чайку+
670;чайку;Оттого, что Антонов уже побывал сегодня в зеркале, он ощущал себя до ужаса видимым – как бы слишком плотным, тошнотворно сытым всей этой пищевого цвета реальностью, хотя в желудке не болталось ничего, кроме гниловато-сладкого вчерашнего чайку, – и спешил сойти с каждого занятого места, чтобы не обозначаться на фоне обычных, нейтральных вещей. ;чайку;чайку+
671;чайку;Еще чайку? ;чайку;чайку+
672;чайку;Пообедали, погуляли, попили чайку, а у меня какое-то предчувствие... ;чайку;чайку+
673;чайку;Когда я у них жила, Петя без конца просил: Валентина, не дадите ли мне чайку? ;чайку;чайку+
674;чайку;Можно было забежать между магазинами остыть и попить чайку, чтобы, отметившись за науку, ринуться с инфарктными кошелками на ту же дачу... ;чайку;чайку+
675;чайку;Зайдя как-то раз к Кушелеву выпить чайку, я увидел в его комнате сидящего на пластмассовой табуретке парня с волосами, заплетенными в длинную косичку. ;чайку;чайку+
676;чайку;Ты не сделаешь мне чайку? ;чайку;чайку+
677;чайку;Когда она осталась одна, без Кулибина, то как-то пригласила физкультурника «попить чайку». ;чайку;чайку+
678;чайку;А сам на кухню вышел – чайку попить. ;чайку;чайку+
679;чайку;Мы только и попили чайку с вареньем. ;чайку;чайку+
680;чайку;Ему нравилась Александра Георгиевна и весь ее дом, и казалось, что он как бы из засады, созданной ореховой горкой, наблюдает ее жизнь: хмурую Веру-студентку, которая все по-мышиному шуршала бумагой, и густо-розовую Нику, и старшего ее сына, почти каждый день забегавшего к матери выпить чайку. ;чайку;чайку+
681;чайку;И мне чайку, – подал голос Стасов. ;чайку;чайку+
682;чайку;Садитесь, Ирочка, я вам чайку налью, а вы отдыхайте. ;чайку;чайку+
683;чайку;Сейчас чайку выпью, чтобы согреться, и побегу на работу. ;чайку;чайку+
684;чайку;Мама, давай еще чайку сделаем, этот остыл уже. ;чайку;чайку+
685;чайку;Давайте мы сейчас с вами чайку выпьем, мы же обе без обеда сегодня, а потом пройдем в лабораторию и попробуем сделать что-то типа фоторобота этого армянина. ;чайку;чайку+
686;чайку;Но вместо того чтобы отдохнуть на старости лет, полежать на печи да чайку похлебать из блюдца с сухариком, ей не сиделось на месте. ;чайку;чайку+
687;чайку;Иногда, правда это бывало довольно редко, они ходили друг к другу в гости выпить чашечку душистого чайку с брусничным вареньем или с клюквенным. ;чайку;чайку+
688;чайку;Позвала я вас чайку попить с блинчиками, да дело одно обсудить надобно, – ответила ему, шамкая беззубым ртом, Баба-Яга. ;чайку;чайку+
689;чайку;А еще я клюковки в банку напихала, чтобы чайку можно попить было. ;чайку;чайку+
690;чайку;Покурили, чайку схлебнули, развеяли грусть-тоску, вот и день прошел. ;чайку;чайку+
691;чайку;Ты хоть с дороги чайку попей, путь не ближний. ;чайку;чайку+
692;чайку;Не нужно мне вашего чайку, – сказала я, но он уже метнулся куда-то за маленькую дверцу, где у него, наверное, была кухня. ;чайку;чайку+
693;чайку;Попили чайку, съели желе и только тогда поняли, что сегодня воскресенье. ;чайку;чайку+
694;чайку;Заходил он иногда и по делам, а чаще просто так, поиграть в шахматы или картишки с отцом, поговорить о политике и мироустройстве, попить чайку. ;чайку;чайку+
695;чайку;Вечером, наконец освободившись от майора, мы хотели попить чайку – тут оказалось, что Григорий Семенович у всех увез сахарные пайки. ;чайку;чайку+
696;чайку;Вдруг кому-нибудь станет ночью плохо или чайку горяченького захочется, он нажмет кнопку вызова медсестры, а когда та не прибежит, больной выйдет из палаты и начнет ее искать. ;чайку;чайку+
697;чайку;Я пойду к Светке, чайку попью. ;чайку;чайку+
698;чайку;И надо бы Игорю чайку отнести, он там небось замучился с Саприным. ;чайку;чайку+
699;чайку;Ну, я пойду вам чайку поставлю… ;чайку;чайку+
700;чайку;Попили чайку, поговорили о том о сем. ;чайку;чайку+
701;чайку;Может, вам чайку?» – тихо предлагает хозяйка. ;чайку;чайку+
702;чайку;Ну, призадержались маленько, надо ж чайку попить перед вылетом... ;чайку;чайку+
703;чайку;Поднимемся ко мне, чайку попьем? ;чайку;чайку+
704;чайку;Все у меня здесь под рукой: с утра нарублю сухих сучьев и натоплю печку, попью чайку с домашним вареньем, а если не поленюсь набрать грибков да нарыть картошки в огороде, то и жареха к обеду поспеет. ;чайку;чайку+
705;чайку;Надо было добраться до дому, покормить кошку и собаку, попить чайку и отправиться до этой же платформы обратно, чтобы не опоздать на работу. ;чайку;чайку+
706;чайку;Ну, посидели, попили чайку, Алеша оживился, был говорлив, насмешлив, остроумен – внятно, едко, не то что в стихах. ;чайку;чайку+
707;чайку;Попили чайку и на этом разъехались. ;чайку;чайку+
708;чайку;Только что попили чайку. ;чайку;чайку+
709;чайку;Как раз чайник поспел, попьем с вами чайку, поговорим! ;чайку;чайку+
710;чайку;"Я изорвал кашлем горло; очень надо было бы сделать ингаляцию с эвкалиптом, да попить бы горячего чайку… ну, ладно. ";чайку;чайку+
711;чайку;Сталин доволен остался, говорит: «Молодец, Никита!» – налил мне чайку. ;чайку;чайку+
712;чайку;Полюбовавшись ею, он поправил узел широкого старомодного галстука, застегнул пуговицы темно-синего шерстяного жакета, предложил: – Сейчас чайку выпьем, – и ушел на кухню. ;чайку;чайку+
713;чайку;Прости, сынок, завари мне чайку погорячей..;чайку;чайку+
714;чайку;Прапорщику, как разгрузился, вздумалось попить в караулке чайку. ;чайку;чайку+
715;чайку;Я звала – чайку попить, тебя повспоминать... ;чайку;чайку+
716;чайку;Не хотите ли чайку, Иван Вольфович? ;чайку;чайку+
717;чайку;Людок, может быть, ты принесешь мне чайку?» – «Сейчас, Сашенька заварю свеженького и принесу». ;чайку;чайку+
718;чайку;Давайте-ка еще чайку согреем, а, Степан Игнатьевич? ;чайку;чайку+
719;чайку;"Спрашивали его не раз и обо мне, он им отвечал: да, жила такая в Новой Деревне, но теперь не живет; пользовался ее гостеприимством, заходил чайку попить. ";чайку;чайку+
720;чайку;Давай я чайку тебе налью. ;чайку;чайку+
721;чайку;Часто человека, выступающего на «Орбите», зовут к себе в кабинет попить чайку и в очень доброжелательной, хорошей форме советуют не говорить о чем-то так резко. ;чайку;чайку+
722;чайку;Давай-ка лучше чайку попьем, пока этого не случилось. ;чайку;чайку+
723;чайку;И так все хорошо у них сложилось, что надо бы пригласить ее куда-нибудь, чайку попить в домашней обстановке. ;чайку;чайку+
724;чайку;И добавил погромче: – Поставь нам чайку! ;чайку;чайку+
725;чайку;Ты пока, чем кашлять без толку, чайку попей. ;чайку;чайку+
726;чайку;Заходи, баба Груша, чайку попей. ;чайку;чайку+
727;чайку;Брось, говорю, отстань от нее, иди чайку попей.;чайку;чайку+
728;чайку;Нам бы чайку горячего... ;чайку;чайку+
729;чайку;И вместо этого каждый вечер заходил к Карлу Ивановичу попить чайку в задней •комнате и поговорить о разных делах. ;чайку;чайку+
730;чайку;То чайку, чтобы погорячей, подольет, то сухарь от себя переложит. ;чайку;чайку+
731;чайку;Но когда Петр заявился, впустил его в дом, чайку покрепче налил. ;чайку;чайку+
732;чайку;Я ведь тоже не хотел, сопротивлялся, всякий раз клянясь себе молчать, ни единого слова, чайку попить с тортом, покивать вежливо, со всем соглашаясь, но больше ни-ни, ни в коем случае. ;чайку;чайку+
733;чайку;Как насчет чайку? – раздалось вдруг из-за спины. ;чайку;чайку+
734;чайку;У ветра есть друг – чайник, который свистом зовет его в гости попить чайку. ;чайку;чайку+
735;чайку;Не угодно ли стаканчик чайку?.. ;чайку;чайку+
736;чайку;Пущай он исть этот яблочек господский, а мне не хоцца, я лучше чайку попью с сахаром. ;чайку;чайку+
737;чайку;Посидела, чайку попила и ушла... ;чайку;чайку+
738;чайку;Утром попил чайку. ;чайку;чайку+
739;чайку;Вы чайку попейте с дороги. ;чайку;чайку+
740;чайку;Сейчас чайку попьем: малинки сушеной девочка дала – дай ей Бог деток хороших, – с малинкой-от и попьем. ;чайку;чайку+
741;чайку;Сейчас чайку попьем, мне семейство вареньица домашнего с оказией прислали. ;чайку;чайку+
742;чайку;Брат Сильвестр, распорядись-ка насчет чайку да угощения. ;чайку;чайку+
743;чайку;Вы чайку попейте с дороги. ;чайку;чайку+
744;чайку;Сейчас чайку заварим, голова будет лучше швейцарских часов работать. ;чайку;чайку+
745;чайку;Мы с Сергеем Кузьмичом чайку, может, попьем, а вы там с Машкой – как знаете... ;чайку;чайку+
746;чайку;А сейчас еще чайку. ;чайку;чайку+
747;чайку;Чтобы замять неловкость, она предложила выпить чайку, и он по той же причине принял предложение. ;чайку;чайку+
748;чайку;Сейчас нам чайку... ;чайку;чайку+
749;чайку;Давай-ка чайку. ;чайку;чайку+
750;чайку;Чем выть, пойдем чайку свеженького. ;чайку;чайку+
751;чайку;Тетя Марусь, налей чайку. ;чайку;чайку+
752;чайку;Налей мне чайку...– ;чайку;чайку+
753;чайку;Позови ее, может, чайку желает. ;чайку;чайку+
754;чайку;Теперь можно и чайку попить спокойно, – сказала Липа, проводив нотариуса до лифта.– ;чайку;чайку+
755;чайку;лучше чайку попьем. ;чайку;чайку+
756;чайку;Вы придвигайтесь-ка к столу, со свиданьицем чайку выпьем. ;чайку;чайку+
757;чайку;Когда еще в Союзе вот так запросто забежишь к другу или к соседу чайку попить – и некогда, и стеснишь, и не принято. ;чайку;чайку+
758;чайку;Мадам, принесите-ка нам чайку. ;чайку;чайку+
759;чайку;И там, и там посидели, поболтали, попили чайку. ;чайку;чайку+
760;чайку;У нас печенье, — доносятся слова мамы Армена, — раздевайтесь — горячего чайку. ;чайку;чайку+
761;чайку;Выпили чайку. ;чайку;чайку+
762;чайку;Потом вдвоем с Алей попили чайку, потом пошли на веранду. ;чайку;чайку+
763;чайку;Это было хорошо, что пора выходить, а то Кате с Манечкой даже уже и заблудиться немножко расхотелось, а захотелось попить дома чайку с черносмородинным витамином, вместо того чтобы в метро толкаться в беспокойной обстановке. ;чайку;чайку+
764;чайку;Хорошо бы чайку попить из самовара с крыжовенным вареньем... ;чайку;чайку+
765;чайку;Пока ставилась боевая задача афганским офицерам, командир 70-й бригады подполковник Иван Васильевич Зубко пригласил меня в свою походную машину попить чайку. ;чайку;чайку+
766;чайку;Дал мне чайку или водички попить. ;чайку;чайку+
767;чайку;А можно было чайку попить, в холодильнике всегда стояло варенье, сваренное для нее сестрой Линой на сахарине, мазали его на диабетический хлеб. ;чайку;чайку+
768;чайку;У нее мы решили попить чайку, съесть творожка, немножко поболтать и разъехаться. ;чайку;чайку+
769;чайку;Хотя подумаешь, вина не хватило, ничего страшного, можно еще докупить, а можно и просто чайку попить. ;чайку;чайку+
770;чайку;Несмотря на то, что в доме не жарко, днем было всего +14, я был рад, что наконец-то смогу поговорить с семейством, попить вместе чайку, короче – простые человеческие радости. ;чайку;чайку+
771;чайку;Дома приняли горячий душ, попили самодельного чайку с домашними сухариками, и жить стало веселее. ;чайку;чайку+
772;чайку;Валя, принеси-ка нам чайку на двоих, надо угостить академика. ;чайку;чайку+
773;чайку;Мне, что ли, чайку попить? ;чайку;чайку+
774;чайку;Теперь чайку попей, отдохни. ;чайку;чайку+
775;чайку;Мы пришли очень поздно, сели в каюте, остальные люди уже спали, Русанов сказал: «Как бы чайку попить». ;чайку;чайку+
776;чайку;Прежде чем отправиться в здание, где была объявлена беседа Маринеско с коллективом редакции, мы попили чайку и впервые обстоятельно поговорили: Александр Иванович не только не забыл о своем обещании, но взялся за дело с поразившей меня энергией и деловитостью. ;чайку;чайку+
777;чайку;Они проезжали мимо дворца в ту минуту, когда граф Воронцов-Дашков, кончив игру в винт, переходил с графиней в столовую попить чайку. ;чайку;чайку+
778;чайку;Я сбегаю чайку принесу, угостить больше нечем». ;чайку;чайку+
779;чайку;Ну, садись, горяченького чайку выпьем». ;чайку;чайку+
780;чайку;Господин казак, зайдите ко мне, чайку горячего попьем». ;чайку;чайку+
781;чайку;Я вдовец, – сказал он ей в магазине, – не подскажете, есть на вашей улице старушка без семьи?» Он напросился к ней попить чайку. ;чайку;чайку+
782;чайку;Как всегда, сходили чайку попить. ;чайку;чайку+
783;чайку;Так идите сюда, я сейчас чайку заварю. ;чайку;чайку+
784;чайку;Сей час растопим печку, супчику спроворим, чайку покрепче заварим – Бог с ней, с житухой этой неловкой, с погодой гадкой, с проклятой болью в плече. ;чайку;чайку+
785;чайку;Хотите, говорю, дореволюционного чайку откушать?» Переглянулись. ;чайку;чайку+
786;чайку;Вы лучше чайку налейте. ;чайку;чайку+
787;чайку;С рассветом афганцы пошли на прочесывание, часа через два возвращаются – никого и ничего, как будто в гости сходили чайку попить. ;чайку;чайку+
788;чайку;Еще чайку? – спросил он у Володи. ;чайку;чайку+
789;чайку;Илья предложил еще чайку согреть, но братья заторопились домой. ;чайку;чайку+
790;чайку;Попил чайку с лепешкой, сказал: «Спасибо, за все за это благодарен». ;чайку;чайку+
791;чайку;Попьем чайку и поговорим. ;чайку;чайку+
792;чайку;Куда лучше вскипятить чайку да пообедать домашним бутербродом. ;чайку;чайку+
793;чайку;Тьфу, черт, не дают спокойно чайку попить. ;чайку;чайку+
794;чайку;Попили чайку с остатками кексов и поехали на аэродром. ;чайку;чайку+
795;чайку;А может быть, выпить чайку? ;чайку;чайку+
796;чайку;Ира, поставь чайку. ;чайку;чайку+
797;чайку;А и всего-то стакан чайку выпить надо – вот в нём-то и вся присуха. ;чайку;чайку+
798;чайку;Попила она, значит, чайку с моим узваром, приезжает в Москву и идёт прямо на квартиру к своему суженому. ;чайку;чайку+
799;чайку;Наконец можно выпить чайку. ;чайку;чайку+
800;чайку;Хочешь, чайку поставлю? ;чайку;чайку+
801;чайку;О чем я и сказал Андриянычу, когда он явился с предложением попить чайку, если уж я его поднял. ;чайку;чайку+
802;чайку;Дело шло к утру, ложиться спать смысла не было, и мы неторопливо попили чайку. ;чайку;чайку+
803;чайку;Я сказал Любе, что пора сделать перерыв, и мы все трое вылезли на свет черный из черного трюма, чтобы еще попить чайку с итальянскими лимонами. ;чайку;чайку+
804;чайку;Давайте попьем чайку, – сказал мне Буданов. ;чайку;чайку+
805;чайку;Хотите чайку? ;чайку;чайку+
806;чайку;Ты приходи, ночуй у меня, чайку попьем, — размечталась старушка, провожая Федота до дороги. ;чайку;чайку+
807;чайку;Стас, налей-ка чайку гостям. ;чайку;чайку+
