Index;Homograph;Context;TargetWord;Label
949;чайку;Попил чайку, взял было аральскую эпопею, но что-то ни одна из девяти сестер ко мне не явилась – может, сочли, что я уже не имею никакого отношения к древним богам, раз восславляю социалистический режим в виде газопровода? ;чайку;чайку+
950;чайку;Выпил кружечку чайку, надел китайскую куртку и пошел в Запрудное. ;чайку;чайку+
951;чайку;Потом попил чайку, оделся, завязал галстук, надел пальто и «полуковбойскую» шляпу и пошагал в Запрудное. ;чайку;чайку+
952;чайку;Мама сварила картошки, я поел со старинным аральским лещом, выпил чайку и пошел в бухгалтерию. ;чайку;чайку+
953;чайку;Выпив чайку, я забрал все утолщающуюся пачку с последними стихотворениями и пошел в бухгалтерию. ;чайку;чайку+
954;чайку;Еще поели, выпил чайку и пошел в бухгалтерию писать уже капитально. ;чайку;чайку+
955;чайку;Часов в 8 мы с мамой поели опять мундирной картошечки с сайрой, я выпил кружечку чайку. ;чайку;чайку+
956;чайку;Виктор встал в 20 мин. одиннадцатого, мы с ним выпили по кружке чайку, и он ушел на завод, а я лег. ;чайку;чайку+
957;чайку;Прочел большую статью – 35 мин. – и выпил кружку чайку, чтобы промочить горло. ;чайку;чайку+
958;чайку;Попив чайку, собрал все необходимое, т.е. домовую книгу, паспорта, документы, деньги и пр. ;чайку;чайку+
959;чайку;Я выпил чайку, почитал «Крокодил». ;чайку;чайку+
960;чайку;Потом я попил чайку. ;чайку;чайку+
961;чайку;Мы разложили костер, вскипятили мятного чайку и сварили мамалыгу. ;чайку;чайку+
962;чайку;Потом чайку принесу. ;чайку;чайку+
963;чайку;А я тебе чайку спроворила. ;чайку;чайку+
964;чайку;Налить чайку? ;чайку;чайку+
965;чайку;Тебе, может, еще чайку принесть? ;чайку;чайку+
966;чайку;Из кабинета напротив хрущевской двери вышел человек, поздоровался: “попьете чайку”. ;чайку;чайку+
967;чайку;Попьем чайку – самовар вон уже готов, – так вот побалуемся чайком, и все. ;чайку;чайку+
968;чайку;Выпив холодного чайку, я посидел немного и с наслаждением забрался под покров своего небольшого положка, который, прикрывая лицо и грудь, дает возможность спокойно спать, не опасаясь комариных невзгод. ;чайку;чайку+
969;чайку;Собрались мы вечером всласть попить чайку, затопили печку, которая безотказно работала до сих пор, и вдруг она забастовала: из нее повалили густые клубы дыма. ;чайку;чайку+
970;чайку;Он несколько раз пользовался нашим радушным гостеприимством, но у него не повернулся язык пригласить нас попить чайку. ;чайку;чайку+
971;чайку;Вестовой в белой робе спросил, не хотят ли гости чайку, и чай тотчас же появился, словно ждали их. ;чайку;чайку+
972;чайку;Попили чайку. ;чайку;чайку+
973;чайку;Вечером хочется им неторопливо попить чайку, спокойно поужинать в домашней обстановке, а не идти куда-то в городскую столовую, занимать очередь, глотать еду в шуме, сутолоке. ;чайку;чайку+
974;чайку;Да... наверное, самовар поставит ему жена, чайку горяченького. ;чайку;чайку+
975;чайку;Теперь он сам бы уж уговаривал меня зайти к нему переночевать или просто чайку попить. ;чайку;чайку+
976;чайку;Дорогая, чайку бы мне чашечку, а если найдётся печёньице, то и печёньица... ;чайку;чайку+
977;чайку;Я установил палатку, вскипятил чайку и вот теперь мирно полулежу в своей уютной палаточке, перед тем как отойти ко сну. ;чайку;чайку+
978;чайку;Садитесь, товарищ Карабаш, пошуруйте чайку. ;чайку;чайку+
979;чайку;Спокойным голосом, как будто она его жена и все знают об этом, попросил Леру соорудить что-нибудь вроде ужина и согреть чайку. ;чайку;чайку+
980;чайку;В большой будке, составленной из двух, жили шестеро, и в той же будке собирались иногда все в кучу двенадцать человек: попить чайку вместе, почитать газету, послушать радиоприемник «Турист», который Мартын Егерс повсюду таскал с собой. ;чайку;чайку+
981;чайку;Там я обогрелся, попил чайку и после 6 часов вечера отправился сначала к Боковым, а затем к Зимкину. ;чайку;чайку+
982;чайку;Мы зашли с Бобом в избу одного из его знакомых, подзакусили, выпили чайку. ;чайку;чайку+
983;чайку;На Елениной шивере мы изготовили суп из двух уток, попили чайку и медленно поплыли дальше, время от времени слезая на перекатах. ;чайку;чайку+
984;чайку;Пойдем, на дачах споешь, – говорит он довольным, ласковым голосом и, видя, что девочка не двигается с места, добавляет: – Мороженого куплю, чайку попьем, а? ;чайку;чайку+
985;чайку;А я чай вскипятил, чайку бы попили... ;чайку;чайку+
986;чайку;Давай-ка по этому случаю выпьем за помин души твоего хозяина крепкого чайку! ;чайку;чайку+
987;чайку;Жуть – вечер, Байкал, у подножия прибрежной горы избенка, не сказать, чтобы голые стены, какие-то постели, диванчик у стола в прихожей – и одинокий ненормальный старик (он уже побывал в психиатричке), который с неизбежностью проснется там среди ночи с бьющимся сердцем, мутью в голове, и ни стакана чайку, ничего и никого. ;чайку;чайку+
988;чайку;Хлеб тут в буханках, не в посулах, опять же чайку-сахару подбросят… ;чайку;чайку+
989;чайку;Вот бы ей после бани чайку с малиной попить, — подумал Степан Андреянович. ;чайку;чайку+
990;чайку;Посидели, поговорили на разные темы, посмотрели югославский «сильно психологический» фильм «Когда чувство побеждает рассудок», попили чайку и мирно разошлись. ;чайку;чайку+
991;чайку;Дай нам чайку и закусить что-нибудь! ;чайку;чайку+
992;чайку;Сейчас бы чайку горячего, как думаешь? ;чайку;чайку+
993;чайку;Ну, сыграй что-нибудь к чайку. ;чайку;чайку+
994;чайку;Попьем чайку. ;чайку;чайку+
995;чайку;Дома – переоделся, вытерся одеколоном, выпил теплого чайку. ;чайку;чайку+
996;чайку;Сподобил господь еще раз перед кончиной попить чайку с сахарком. ;чайку;чайку+
997;чайку;Решили мы с Бесчастным часиков в 9 утра сварить картошки и напиться чайку, приняв дальнейший план действий в зависимости от обстоятельств. ;чайку;чайку+
998;чайку;В холодной утренней стыни развели костер, сварили шикарную толченку из картошки с маслом и рыбными консервами, напились чайку и… задумались. ;чайку;чайку+
999;чайку;Исходил бы я эту землю босиком, попил бы чайку в каждой избе. ;чайку;чайку+
1000;чайку;Попейте чайку на дорогу. ;чайку;чайку+
1001;чайку;От приглашения попить чайку отказалась: ;чайку;чайку+
1002;чайку;Сварили чайку, закусили, сфотографировались, и вот сейчас, когда все в порядке и до устья Хомпо остается каких-нибудь 1 300 – 1 400 м., неожиданно появился Еловских. ;чайку;чайку+
1003;чайку;Там попили чайку. ;чайку;чайку+
1004;чайку;А пока она приготовит, давай чайку выпьем, – сказал Борташевич. ;чайку;чайку+
1005;чайку;Спасибо, товарищ Гололобова, чайку я бы выпил. ;чайку;чайку+
1006;чайку;Чикваидзе выпил бы и водки, но – восемь утра в начале дня, посвященного поискам информации – нет, лучше чайку. ;чайку;чайку+
1007;чайку;Вы рюмочку, Валерий Михайлович, выкушайте, поди, проголодались, мы ещё и чайку поставим. ;чайку;чайку+
1008;чайку;Так или иначе, но мы обогрелись, вскипятили чайку, подзакусили и в отсвечивающем фиолетовыми оттенками сумраке двинулись дальше к Илинтасу. ;чайку;чайку+
1009;чайку;Сейчас попьем чайку, купим кое-что в местном магазине и будем трогаться дальше. ;чайку;чайку+
1010;чайку;На берегу вот такого тепловодного болотистого ручейка и остановились мы на часок-полтора отдохнуть, попить чайку, подкормить лошадей. ;чайку;чайку+
1011;чайку;Остановились попить чайку, подкормить коней, малость передохнуть. ;чайку;чайку+
1012;чайку;Перебредя болото, в маленьком ключике я выкупался, прополоскал свои кальсоны, повесил их сушиться, и вот теперь в ожидании этого момента (вернее они дожидают его) мы сидим и собираемся попить чайку. ;чайку;чайку+
1013;чайку;Попили чайку, крепкого таежного чайку, сладкого, но без хлеба. ;чайку;чайку+
1014;чайку;Попили чайку, крепкого таежного чайку, сладкого, но без хлеба. ;чайку;чайку+
1015;чайку;Отсюда до Батыгая километров 30, и мы, передохнув и попив чайку в работающем здесь топоотряде, решили ехать дальше, с расчетом добраться до Батыгая часа в 4 утра. ;чайку;чайку+
1016;чайку;Выпили наливочки, попили чайку. ;чайку;чайку+
1017;чайку;В воскресенье он приходит попить чайку. ;чайку;чайку+
1018;чайку;Бабушка предложила выпить чайку из нового сервиза. ;чайку;чайку+
1019;чайку;Налейте, пожалуйста, мне еще чашечку чайку с лимоном. ;чайку;чайку+
1020;чайку;Но уж не будет там чайку с лимоном. ;чайку;чайку+
1021;чайку;Спросим, не дадут ли нам чайку. ;чайку;чайку+
1022;чайку;Надо оговориться, что и в ту пору Александр Яковлевич вовсе не страдал излишней наивностью... но вдруг он представил себя в медном виде, на пьедестале ближайшего тысячелетия, в чем-нибудь нищем и простреленном, развевающемся по ветру истории, размягчился, доверился и покричал Аксюше принести чайку, чтоб собраться с мыслями, пока горе народное займется угощеньем. ;чайку;чайку+
1023;чайку;Для начала младший осведомился, успела ли поужинать перед отъездом, не озябла ли, не хочет ли чайку с дороги. ;чайку;чайку+
1024;чайку;Прошло несколько дней, и Бородулин, который после «холерной истории» иногда заходил ко мне выпить чайку, очень расстроил меня, сказав, что Данила Степаныч пропал и что Дорстрой разыскивает его по всему совхозу. ;чайку;чайку+
1025;чайку;Правда, раза два в неделю он поднимался наверх, чтобы попить чайку со своим приятелем, служителем из лаборатории Андрея. ;чайку;чайку+
1026;чайку;Чем бы посидеть, чайку попить не спеша, побеседовать, повспоминать... ;чайку;чайку+
1027;чайку;После завтрака мы попили чайку и мама стала мыть в избе и прибираться, а я принес воды и караулил клушку. ;чайку;чайку+
1028;чайку;Приходи-ка завтра в семь часов утра ко мне на квартиру попить чайку, – сказал я Хлебникову. ;чайку;чайку+
1029;чайку;Являясь по службе к Жоффру, Фош неизменно заходил ко мне «попить русского чайку», как он сам выражался. ;чайку;чайку+
1030;чайку;Колесов взглянул в паспорт, с улыбкой вернул мне его и предложил пойти в дом попить чайку. ;чайку;чайку+
1031;чайку;Все стали звать летчика к себе домой – отдохнуть, полежать, выпить чайку. ;чайку;чайку+
1032;чайку;А пока что давай горячего чайку, и я прилягу... ;чайку;чайку+
1033;чайку;Когда она заняла приготовленное ей место во главе стола, полковник Канониров потребовал, чтобы она сама всем разлила чай, и выпил стаканов восемь, не уставая восторгаться тем, что наконец-то довелось попить чайку в настоящей «домашней обстановке». ;чайку;чайку+
1034;чайку;Или просто чайку на ночь выпью». ;чайку;чайку+
1035;чайку;Приведи, – говорил он актеру Сахарову, – ты ко мне этого Иванова-Козельского*, ну, чайку попить, что ли. ;чайку;чайку+
1036;чайку;Как больно слышать неуверенное приглашение к обеду с тайной надеждой, что я откажусь, как стыдно чайку стакан попросить. ;чайку;чайку+
1037;чайку;С утра из Кавказа прибыла на базар целая гирлянда дам, посидела, посудачила, попила чайку и часам к 11 отправилась обратно. ;чайку;чайку+
1038;чайку;Пойдемте чайку напьемся. ;чайку;чайку+
1039;чайку;А ты заходи, не сумлевайся, чайку выпьем. ;чайку;чайку+
1040;чайку;Мы, разумеется, не любили Антипку, но теперь, задним числом, думаешь, что человек работал добросовестно, старался привить нам полезные навыки и держал в узде квартирохозяев по части обслуживания и питания, так как в любой день можно было ждать: «зайдет пообедать», «поужинать», «попить чайку». ;чайку;чайку+
1041;чайку;Выпьешь чайку, – и отдохнешь, – продолжала Ивушка скороговоркой, – завтра рано к службе. ;чайку;чайку+
1042;чайку;Вот, батенька выйдет, попьешь вместях  чайку. ;чайку;чайку+
1043;чайку;Садись, чайку выпьешь с баранком, за кампанию с Егор Ивановичем. ;чайку;чайку+
1044;чайку;Сейчас попьем чайку, укроемся и уснем глубоким сном усталости до завтрашнего дня. ;чайку;чайку+
1045;чайку;Они пришли к хлебосольным, зажиточным разведчикам покурить хорошего табачку и попить чайку внакладку из знаменитого чайника. ;чайку;чайку+
1046;чайку;Ведь каждый наш человек хочет хорошо одеться, поесть да еще чайку с сахарком попить. ;чайку;чайку+
1047;чайку;Попили чайку (мятного), поговорили. ;чайку;чайку+
1048;чайку;А то, дай чайку, многолюбимая, – перебил он ее, – я выпил бы второй стаканчик. ;чайку;чайку+
1049;чайку;Сейчас выпьем чайку, согреетесь. ;чайку;чайку+
1050;чайку;Петр Филиппович хорошо попарился, напился чайку и лег спать. ;чайку;чайку+
1051;чайку;Садись, Корнилыч, чайку нам Настасья Ивановна даст, а конфет хороших мне с Егорьевского привезли», – говорил я, зная пристрастие старика к сладостям. ;чайку;чайку+
1052;чайку;Вот бы стаканчик чайку, такого горячего, крепкого, духовитого! ;чайку;чайку+
1053;чайку;В увлекательной беседе попили бы чайку, позвякивая ложечками в стаканах... ;чайку;чайку+
1054;чайку;Где бы чайку попить? ;чайку;чайку+
1055;чайку;Здесь мы, с наслаждением попив чайку, предались заслуженному отдыху. ;чайку;чайку+
1056;чайку;Развели костер, натянули свою маленькую уютную палаточку, попили чайку и мирно уснули, подогреваемые теплом нагретых камней. ;чайку;чайку+
1057;чайку;Другие продолжали уговаривать девушку снять шаль, попить еще теплого чайку. ;чайку;чайку+
1058;чайку;Вот, попей чайку и закуси рыбкой, что я тебе на палочке по-лопски зажарила, а потом, пока не заснешь, я тебе буду рассказывать наши лопские сказки. ;чайку;чайку+
1059;чайку;Сели, закусили, выпили чайку, аккуратненько уложили все снова в мешок и только потом пошли на жилу. ;чайку;чайку+
1060;чайку;Власьевна, плесни ему травки-то этой... барского чайку-то. ;чайку;чайку+
1061;чайку;После консилиума Федор Иванович привозил его домой, попить чайку, посидеть. ;чайку;чайку+
1062;чайку;Пришли бы когда-нибудь чайку выпить! ;чайку;чайку+
1063;чайку;Мне пить хочется, нельзя ли раздобыть чайку, да чтобы покрепче. ;чайку;чайку+
1064;чайку;Нам бы чайку, красавица! ;чайку;чайку+
1065;чайку;Отнес покупку Железновым, попил у них чайку, задумчивый сижу, молчу, смутно у меня на душе. ;чайку;чайку+
1066;чайку;От чайку он отказался, объяснив, что сейчас появится заказанный на вокзале автомобиль, что туда уже погружены его чемоданы (эта подробность, как бывает во сне, имела какой-то мелькающий смысл) и что «Покатим с тобой к морю!» – почти выкрикнул он по направлению к девочке, которая, оборотясь на ходу, чуть не упала с треском через табурет, но мгновенно выправила молодое равновесие, повернулась и села, покрыв табурет опавшей юбкой. ;чайку;чайку+
1067;чайку;Позавтракать, чайку выпить не желаете? ;чайку;чайку+
1068;чайку;К вечеру буду дома, вот тогда чайку вместе и напьемся... ;чайку;чайку+
1069;чайку;Старуха попросила себе в кружку чайку. ;чайку;чайку+
1070;чайку;Ну что ж, пожалте чайку, с морозу великолепно! ;чайку;чайку+
1071;чайку;Раздевайтесь, поиграйте, попьем чайку. ;чайку;чайку+
1072;чайку;Да и чайку нужно попить. ;чайку;чайку+
1073;чайку;Марья Петровна и Травка попили чайку, а потом уже и пошли. ;чайку;чайку+
1074;чайку;И чайку выпить не мешало бы... ;чайку;чайку+
1075;чайку;Вернулся на яхту, сел чайку попить. ;чайку;чайку+
