Index	Homograph	Context	TargetWord	Label
74	доктора	Стол терапевта был накрыт стеклом в размер столешницы, под стеклом лежали несколько открыток, грамота и черно-белая фотография, но только непонятно чья (женская, мужская, детская) -- солнечный свет, падавший на окно откуда-то сбоку, превратил верхнюю половину окна в сплошное сияние, похожее на сияние ядерного взрыва, так что казалось, будто за окном не улица, а еще один кабинет с софитами, нижнюю закрывала белая шторка из того же материала, из какого был сделан халат терапевта, солнечный свет давал блик через плечо доктора, и поэтому у фотографии под стеклом было видно только нижнюю половину -- вязаный свитер, который мог принадлежать кому угодно.	доктора	1
75	доктора	Так, например, появился нейрон доктора Зойдберга из «Футурамы».	доктора	1
76	доктора	Экологический мониторинг осуществляется на основе методических рекомендаций доктора биологических наук А.С. Пчелкина в режиме занятий по программам дополнительного образования.	доктора	1
77	доктора	Порядок действия расписан в инструкции к полису -- как правило, нужно будет позвонить в диспетчерскую и ждать звонка аккредитованного компанией доктора.	доктора	1
78	доктора	В картотеке доктора Ортеса полные данные.	доктора	1
79	доктора	Тот как раз только что получил степень доктора медицины.	доктора	1
80	доктора	Следом -- признание другого одноклассника, Юрия Кочеврина, доктора экономических наук, до самой пенсии служившего в Российской академии наук: «Такое бывает редко -- чтобы учитель и внутренне содержателен, и умел так себя поставить, что на занятиях все как шелковые.	доктора	1
81	доктора	А сыну императрица выбирала друзей из числа детей дворцовых слуг, воспитателей, доктора.	доктора	1
82	доктора	Лампа доктора освещает шевелящуюся гору тряпья у дальней стенки.	доктора	1
83	доктора	Она ещё помнила вечеринку в доме доктора Ходжинса.	доктора	1
84	доктора	Что касается российских авторов, то в этот номер журнала включены работы доктора наук, философа из Москвы Георгия Смоляна о ключевых понятиях информатизации, кандидата наук из Казани Риммы Елизаровой о Национальной библиотеке Татарстана, кандидатов наук из Екатеринбурга Елены Дьяковой и Анны Трахтенберг о проблеме организационного сопротивления в сфере информатизации здравоохранения, а также специалистов из Уфы Тагира Якубова, Алмаза Исхакова и Альберта Маннапова о доверенных сетях связи.	доктора	1
85	доктора	В Японии можно было получить степень доктора философии после публикации пяти статей в научных журналах без защиты диссертации в университете.	доктора	1
86	доктора	Кстати, один из таких моментов как раз запечатлён на знаменитой картине кисти доктора Грошикова.	доктора	1
87	доктора	Не случайно М.А. Булгаков вложил в уста Полиграфа Полиграфовича Шарикова следующие слова, произнесенные во время обеда в адрес доктора Борменталя и профессора Преображенского: «Вот все у вас, как на параде... салфетку -- туда, галстук -- сюда... а так, чтобы понастоящему, -- это нет.	доктора	1
88	доктора	Лицо доктора исказила гримаса презрения.	доктора	1
89	доктора	По мнению многих токсикологов, например, профессора, доктора медицинских наук Владимира Нужного, сивушное масло -- в разумных, разумеется, дозах -- не усиливает воздействие этилового спирта на организм, а, напротив, ослабляет, действуя как антидот.	доктора	1
90	доктора	У доктора Драхе, с которым я жил до десяти лет, были собаки, и суки довольно часто щенились.	доктора	1
91	доктора	Отметим, к примеру, наблюдения доктора филологии Александра Сорочана «Тверская поэзия как перформанс».	доктора	1
92	доктора	И мы тут не очередную книжку доктора Спока обсуждаем.	доктора	1
93	доктора	Изобретение доктора Хэнка Пима позволяет бывшему заключенному Скотту Лэнгу уменьшаться в размерах и при этом получать нечеловеческую силу.	доктора	1
94	доктора	Доктора разве дождёшься из посёлка.	Доктора	1
95	доктора	Мы ему, конечно, с радостью присудили степень доктора теологии.	доктора	1
96	доктора	Только к середине 1970-х годов, после выступления в «Коммунисте» доктора педагогических наук и писателя Юрия Азарова и известного композитора Дмитрия Кабалевского.	доктора	1
97	доктора	В 1961 г., согласно данным доктора геолого-минералогических наук Алексея Портнова, обследовавшего объект и опубликовавшего его схематический профиль, внешний склон был заметно ниже нагорного.	доктора	1
98	доктора	Рядом -- более скромные надгробия поэта и драматурга, «амстердамского Шекспира», Йоста ван ден Вондела, поэта и историка Питера Корнелиса Хофта, имя которого в Амстердаме носит улица фешенебельных бутиков и дизайнерских салонов, и Николаса Тюлпа -- бизнесмена, ученого, хирурга, друга Рембрандта и героя его картины «Анатомия доктора Тюлпа» (1632).	доктора	1
99	доктора	Геологический музей, носящий имя первооткрывателя Печорского угольного бассейна доктора геолого-минералогических наук Александра Чернова, был создан 46 лет назад как одно из подразделений Института геологии Коми научного центра УрО РАН.	доктора	1
100	доктора	На середину XX в. в Прикамье, по сводке ведущего научного сотрудника Института археологии РАН доктора исторических наук Владислава Даркевича, учтено более 100 кладов.	доктора	1
101	доктора	Константин Константинович Флёров родился в Москве 4 февраля 1904 г. в семье доктора медицины, профессора Московского университета.	доктора	1
102	доктора	Поликлинику уже закрыли: оба старых доктора еле живы, молодые на такое жалованье не пойдут...	доктора	1
103	доктора	Если вы у них спросите: «Откуда вы пришли?», у второго режиссера например, у ассистентов бесконечных, у скрипт-доктора, у супервайзера, то поймете: это просто люди, которые по случайности оказались в таких обстоятельствах и вдруг стали этим заниматься.	доктора	1
104	доктора	По мнению доктора технических наук, профессора Леонарда Федоровича Смирнова из Одесской государственной академии холода, в результате различных приливных течений либо небольшого повышения температуры этот газогидратный грунт начинает медленно всплывать.	доктора	1
105	доктора	Здесь, на стене нашего отдела, висит объявление о состоявшейся у нас в 2009 году конференции, посвященной Государственной академии художественных наук, -- мы проводили ее вместе с Центром по исследованию русской философии Бохумского университета в лице одного из создателей этого Центра, доктора Н. Плотникова.	доктора	1
106	доктора	Эти направления развиваются под руководством доктора биологических наук Владимира Новикова и заведующего отделом систематики и географии растений доктора биологических наук Михаила Пименова.	доктора	1
107	доктора	Вот и являются неизбалованной публике новоявленные клоны обитателей острова доктора Моро: «поэты-библиотекари», -медработники», -педагоги», -компьютерщики» (!)	доктора	1
108	доктора	Да, да, сегодня… -- внезапно подбородок доктора задрожал.	доктора	1
109	доктора	В 2014 г. в архангельском издательстве «Правда Севера» вышла монография доктора исторических наук, профессора Мурманского государственного гуманитарного университета Павла Федорова «Культурные ландшафты Кольского Севера: структура и историческая динамика».	доктора	1
110	доктора	Крупным обобщением геоботанических и флористических исследований двух соседних регионов стал аналитический обзор флоры Мурманской области и Карелии доктора биологических наук Марианны Раменской, работавшей в Полярно-альпийском ботаническом саду Кольского филиала АН СССР с 1964 по 1976 год.	доктора	1
111	доктора	Сеть медицинских центров доктора Бубновского более 20 лет успешно работает по авторской методике кинезитерапии, предлагающей альтернативный -- безмедикаментозный и безоперационный -- способ лечения многих заболеваний.	доктора	1
112	доктора	У истоков создания фитотрона стояли один из ведущих физиологов растений страны доктор биологических наук Аркадий Коровин (1959–1961 гг.) и Владимир Курец — инженер по образованию, впоследствии получивший степень доктора биологических наук.	доктора	1
113	доктора	По данным доктора медицинских наук В.А. Виссарионова, в 1937 году в соответствии с приказом народного комиссариата пищевой промышленности СССР было утверждено «Положение об Институте косметики и гигиены».	доктора	1
114	доктора	В. Скобельцына этой тематикой активно занимаются специалисты под руководством доктора физико-математических наук Ленара Тагирова в Казанском (Приволжском) федеральном университете, получившем отличное технологическое оборудование.	доктора	1
115	доктора	Экспериментальная реализация этой задачи началась в те же годы в группе доктора физико-математических наук Виктора Мощалкова в Лёвенском католическом университете (Бельгия), и в сравнительно короткое время ее сотрудники получили весьма обнадеживающие результаты.	доктора	1
116	доктора	В 2007 г. исполнилось 100 лет со дня рождения выдающегося советского антрополога, археолога и скульптора, доктора исторических наук Михаила Герасимова (1907–1970), автора метода портретной реконструкции внешности по черепу человека и на основе скелетных останков (так называемого «метода Герасимова»).	доктора	1
117	доктора	Отметим также доклад доктора исторических наук профессора Московского государственного университета (МГУ) им. М.В. Ломоносова Ирины Купцовой, проанализировавшей отношение представителей отечественной художественной интеллигенции к «великому противостоянию» народов.	доктора	1
118	доктора	Среди пяти сотен экспонатов -- костюмы, раскадровки, подлинный реквизит, включая серебристый Aston Martin DB5 и подбитый вертолет, из всех фильмов от «Доктора Ноу» (1962) до «Координаты «Скайфолл»» (2012).	Доктора	1
119	доктора	Это был рискованный выпад, настолько отличный от многодневного вальсирования доктора Азари вокруг этих мужланов, что даже Леопольд изменился в лице, а в комнате повисла ледяная пауза.	доктора	1
120	доктора	Но более поздние исследования показали правоту доктора Хауса: «Врут все».	доктора	1
121	доктора	На нашей кафедре под руководством доктора физико-математических наук Александра Львовича Рахманова активно работает группа теории конденсированного состояния.	доктора	1
122	доктора	Не-ет, тебя надо обследовать, -- голос доктора звучал гулко в этой почти пустой каменной комнате.	доктора	1
123	доктора	В 1910 году получил в Мюнхене звание доктора политэкономии, по возвращении в Москву преподавал экономическую науку в ведущих вузах.	доктора	1
124	доктора	В этом смысле интересны наблюдения работавшего рядом с ним доктора физико-математических наук Юрия Днестровского, которыми он поделился на одном из институтских ученых советов.	доктора	1
125	доктора	Три года назад группа ученых ФИАНа под руководством доктора физико-математических наук Евгения Демихова решила заполнить пустующую на нашем медицинском рынке нишу и сделала первый отечественный томограф ортопедического типа с гелиевой системой охлаждения для визуализации и диагностики состояния конечностей и суставов.	доктора	1
126	доктора	Сообщил я им, что можно выступить перед публикой, показать, какие они умные, и получить диплом участника конференции, — и добрая дюжина друзей (от шестнадцатилетней школьницы до доктора наук) села за столы, навострила перья и начала писать очерки о моей неустанной деятельности на благо российской культуры.	доктора	1
127	доктора	4 декабря (вчера) состоялась премьера мюзикла «Джекилл и Хайд» по мотивам повести Роберта Льюиса Стивенсона «Странная история доктора Джекилла и мистера Хайда».	доктора	1
128	доктора	Биолог, краевед из Архангельска Ксения Гемп подарила «Дневные записки путешествия доктора и Академии наук адъюнкта Ивана Лепёхина по разным провинциям Российского государства в 1768 и 1769 году» (1771 г.).	доктора	1
129	доктора	Важно подчеркнуть, что извлекаемая вода должна быть безвредна для человека (работы по обеспечению медико-биологических аспектов регенерации воды проводились в ИМБП под руководством доктора технических наук Юрия Синяка).	доктора	1
130	доктора	Центр образовательной статистики при департаменте образования США сообщает, что Pacific Christian University в американском городе Глендейл, который, по утверждению министра авиации Нигерии Стеллы Одуах, присвоил ей звание доктора наук, не существует.	доктора	1
131	доктора	По мнению директора Института экологии растений и животных Уральского отделения РАН, профессора, доктора биологических наук Владимира Богданова, на это повлияло не промышленное освоение Ямала или экологическое состояние водоемов округа, а непомерный вылов рыбы в середине 90-х годов прошлого века, от которого популяция сиговых никак не может восстановиться.	доктора	1
132	доктора	Так, на базе Всероссийского научно-исследовательского и технологического института биологической промышленности (Московская область, г. Щелково) под руководством академика Анатолия Самуйленко и доктора биологических наук Алексея Албулова организовано производство этих биополимеров, ряда их производных и композитов, пригодных для пищевого и сельскохозяйственного применения.	доктора	1
133	доктора	Единственным зрителем, кроме Эдика и женского доктора, оказался пожилой, весьма обрюзгший человек с еврейской фамилией и прозвищем Нос, с невероятно живым, колючим, молодым взглядом.	доктора	1
134	доктора	Имея художественное образование, Рейсдал также окончил университет, а в 1676 получил степень доктора медицины и стал практикующим хирургом.	доктора	1
135	доктора	Яркий пример промежуточной двойственности -- «Трагическая история доктора Фауста» Марло (1604).	доктора	1
136	доктора	По мнению известного реставратора, доктора архитектуры Александра Ополовникова — первого исследователя водлозерского сокровища (1947 г.), она замыкает многовековой путь развития русского деревянного зодчества.	доктора	1
137	доктора	Прежние требования доктора неукоснительно им выполнялись, правда, вместе с достойной зарплатой на смену демократической беготне за мячом явился вальяжный гольф.	доктора	1
138	доктора	Когда ее спрашивали, знала ли она о тайной жизни доктора Елизарова, замечала ли что-нибудь необычное, что-нибудь подозрительное в его поведении, она твердо отвечала: «Нет».	доктора	1
139	доктора	Люк Бессон делает сериал по мотивам «Перевозчика», NBC запускает первый сезон «Ганнибала» -- про зрелые годы доктора Лектера, а MGM в ответ готовит сериал «Кларисса» про жизнь главного героя «Молчания ягнят» агента Клариссы Старлинг.	доктора	1
140	доктора	Самое интересное и необъяснимое: выполнялся последний рецепт доктора.	доктора	1
