Index	Homograph	Context	TargetWord	Label
279	доктора	В университете, где я работаю, был инженер, к которому шли за советом самые титулованные наши доктора с кандидатами, — его мнение было весомым, авторитетным, доказательным.	доктора	2
280	доктора	Пусть думает, что у нас доктора банки ставят.	доктора	2
281	доктора	Выходящие доктора возбужденно комментировали вчерашние события.	доктора	2
282	доктора	А кроме всего прочего, доктора в урологии сильно пьют.	доктора	2
283	доктора	Все доктора себе заначку сделали, на всякий пожарный.	доктора	2
284	доктора	Ферсман воспитал плеяду талантливых учеников, среди них — профессор Владимир Крыжановский (1881–1947), доктора геолого-минералогических наук Георгий Леммлейн (1901–1962) и Георгий Барсанов (1907–1991).	доктора	2
285	доктора	Первые лауреаты Ленинской премии, награжденные за научное обоснование нефтегазоносности Западной Сибири новосибирские ученые доктора геолого-минералогических наук Николай Ростовцев и Владимир Казаринов еще задолго до первых открытий предсказали: на Севере в достаточно молодых осадках будут найдены гигантские месторождения газа.	доктора	2
286	доктора	А мог ли я представить во времена юности, что сумею когда-то добыть заоблачный, недосягаемый, зеленее драгоценных изумрудов, чеховский тридцатитомник, который имели в советское время только короли жизни: академики и доктора наук, секретари обкомов и директора мясокомбинатов!	доктора	2
287	доктора	В начале 1990-х годов доктора сельскохозяйственных наук Наталья Сорокина и Борис Когут из Почвенного института им. В.В. Докучаева провели детальный мониторинг динамики гумусного состояния черноземов с учетом пространственного варьирования и выявили: за 20 лет содержание в них органического углерода статистически достоверно уменьшилось на 0,3–0,6%.	доктора	2
288	доктора	Черниговский князь Владимир Мономах почти год страдал от какого-то недуга, который не могли вылечить самые знаменитые доктора того времени.	доктора	2
289	доктора	Все участники -- солидные люди, доктора наук, и по привычке они тут же начали обсуждать какие-то свои научные проблемы.	доктора	2
290	доктора	Когда доктора боролись за наши жизни, мы были молоды, хотели жить...	доктора	2
291	доктора	Среди исполнителей действующие вузовские преподаватели, кандидаты и доктора наук.	доктора	2
292	доктора	А может быть, доктора обманывают.	доктора	2
293	доктора	MYCIN -- одна из ранних экспертных систем, которая могла диагностировать небольшой набор заболеваний, причём часто так же точно, как и доктора.	доктора	2
294	доктора	Я и не ожидал, что сразу же после защиты меня вызовут на всеобщее обозрение (а в зале находились четырнадцать членов Совета, по преимуществу, доктора наук, профессора, академики) и объявят дату моей защиты -- 6 декабря 2012 года.	доктора	2
295	доктора	Полагаю, что наш автор написал бы примерно так: доктора посоветовали N вести здоровый образ жизни, N пару дней попитался овсянкой на воде, а на третий день махнул рукой и выпил вечером водочки, закусив для верности соленым огурцом и сальцем.	доктора	2
296	доктора	Доктора требовали от своих пациентов в первую очередь покаяния.	Доктора	2
297	доктора	Это чумные доктора.	доктора	2
298	доктора	В клювах тлели благовония, через их дым чумные доктора дышали.	доктора	2
299	доктора	Доктора крючьями стаскивали в телеги трупы умерших, чтобы не разлагались на улицах, отравляя тех, кто ещё жив.	Доктора	2
300	доктора	А живых чумные доктора под угрозой оружия и под конвоем сгоняли в карантины, где несчастные всё равно заражались друг от друга и умирали.	доктора	2
301	доктора	И сами чумные доктора тоже умирали, так что под маской было не понять: это идёт живой человек, чтобы спасти живых, или это мертвец сгоняет обречённых разделить его же участь.	доктора	2
302	доктора	Век Интернета и гаджетов, зябкий декабрь, огненная от рекламы Москва, Калитниковское кладбище -- и средневековые чумные доктора с факелами, баграми и гробами?..	доктора	2
303	доктора	Клюворылые доктора шагали на Глеба по дорожкам, поперечным аллее, перелезали через ограды могил, их факелы мелькали справа и слева за крестами и деревьями.	доктора	2
304	доктора	Доктора знали, как убить всех людей на Земле, но работали они ради спасения народов.	Доктора	2
305	доктора	В их числе академики Кузьма Андрианов, Андрей Бочвар, уже упоминавшиеся Сергей Кишкин и Иосиф Фридляндер, члены-корреспонденты АН СССР Георгий Акимов, Рубен Амбарцумян, Владимир Добаткин, Алексей Туманов, член-корреспондент РАН Радий Шалин, академик АН УССР Николай Давиденков, академик АН БССР Борис Ерофеев, доктора технических наук Иван Сидорин, Николай Скляров, Сергей Глазунов, Яков Аврасин, Иван Колобнев, Софья Кишкина и другие выдающиеся ученые.	доктора	2
306	доктора	Так как я всё ещё хвораю, доктора запрещают мне выезжать, то прошу Вас -- приезжайте ко мне на пирог до четырёх часов.	доктора	2
307	доктора	Я как будто чувствую себя лучше; со дня приезда лежу в кровати, жизнь моя сплошное лечение: утром и вечером мне ставят по 24 банки, чтобы отвлечь кровь от сердца, впрыскивают мышьяк, ставят клистиры, дают всевозможные лекарства -- словом я не человек, а какой-то бескровный мешок, которым распоряжаются доктора и фельдшерица.	доктора	2
308	доктора	Лечат доктора: Зевакин, Дьяконов, Левитский.	доктора	2
309	доктора	Доктора… месяцев 8 тому предсказали, что его жизнь следует исчислять днями -- и иное исключено!	Доктора	2
310	доктора	Уничтоженное крестьянство, лавочники, священники, земские доктора, учителя, ученые — всех ведь убили, и господ, и слуг, и служилый люд.	доктора	2
311	доктора	Лучшие доктора страны, участвовавшие в клинических испытаниях, дали высокую оценку аппарату. «С помощью «Яхрома-Мед» мы вылечили более 2000 детей, – пишет в отзывах заведующий лазерным центром Российской детской клинической больницы (Москва) Николай Поспелов, – и пришли к выводу, что лазер на парах меди – идеальный инструмент для лечения сосудистых заболеваний кожи, особенно «винных пятен» и телеангиэктазий.	доктора	2
312	доктора	Доктора говорят, от цирроза печени.	Доктора	2
313	доктора	Открытие синхротронного излучения (СИ) предсказали весной 1944 г. доктора физико-математических наук Дмитрий Иваненко и Исаак Померанчук (академик с 1964 г.).	доктора	2
314	доктора	Они внедрены в системы дальней космической связи, радиоастрономию и получили высокую оценку: члены авторского коллектива — сотрудники НИИЯФа (в их числе доктора физико-математических наук Георгий Зверев и Леонид Корниенко), ФИАНа и других организаций были отмечены Государственной премией СССР в области науки и техники 1976 г.	доктора	2
315	доктора	Ряд ученых (американский геолог Кент Конди, профессор Альфред Кронер из Университета Майнца, доктора геолого-минералогических наук Александр Слабунов из Института геологии Карельского научного центра РАН и Андрей Щипанский из Института геологии РАН) обобщили геологические данные о времени зарождения тектоники плит и показали: возраст древнейших структур, трактуемых как следствие этого процесса, превышает 4 млрд лет.	доктора	2
316	доктора	Крошечные доктора	доктора	2
317	доктора	Большой вклад в его развитие внесли доктора технических наук Борис Предеин, Константин Даниленко, кандидат физико-математических наук Сергей Семенов, кандидаты технических наук Леонид Горшунов, Юрий Стрельников, Борис Воронов и др.	доктора	2
318	доктора	А стационарные доктора не спешили разувать клиентов.	доктора	2
319	доктора	Ну и доктора кушают.	доктора	2
320	доктора	Он сказал, что доктора и сестры совершают преступление, обворовывают больницу.	доктора	2
321	доктора	По этому коридору ходили всякие -- здоровые и доктора.	доктора	2
322	доктора	Основоположниками казанской хирургической школы, возникшей в середине XIX в., стали доктора медицины Василий Разумовский, Виктор Боголюбов, академик Александр Вишневский.	доктора	2
323	доктора	Доктора известили их обо всем с точностью до недель, но и без врачей достаточно было посмотреть, сколько от всей Линн занимают глаза, чтобы понять.	Доктора	2
324	доктора	Его авторами стали член-корреспондент РАН Юрий Котов и доктора технических наук Сергей Рукин и Александр Филатов.	доктора	2
325	доктора	У меня одни доктора кругом.	доктора	2
326	доктора	На страницах «Земли и Вселенной» постоянно выступают академики, члены-корреспонденты РАН, доктора и кандидаты наук.	доктора	2
327	доктора	Круглощекие «вольто», лукавые «коты», клювоносые «доктора чумы», безликие домино, прекрасные венецианки, коломбины, арлекины, демоны и ангелы; наконец, самые распространенные: зловещие, с подбородками лопатой, с выразительным именем «ларва» -- белые маски к черному костюму «баута» … и прочие традиционные персонажи карнавала вперемешку с изумительно сшитыми, действительно штучными изысканными нарядами.	доктора	2
328	доктора	Депутаты Государственной думы, известные доктора, представители религиозных конфессий и зрители в студии выражали различные мнения – от социального одобрения до полного отрицания.	доктора	2
329	доктора	Это доктора, бизнесмены, фармацевты, инженеры, производственные рабочие, строители, сборщики мусора и уличные дворники, психологи, владельцы бакалейных лавок, портные, сельхозработники.	доктора	2
330	доктора	Тут были строевые командиры и преподаватели -- кандидаты и доктора наук, доценты и один профессор.	доктора	2
331	доктора	Среди них были полицейские, доктора и священники -- и все они глядели на Грыма так, словно он миг назад сделал что-то очень нехорошее.	доктора	2
332	доктора	И другая проблема – «экологическая паспортизация» малых водоемов и водотоков (руководители работ – доктора биологических наук Давид Гелашвили, заведующий кафедрой Нижегородского государственного университета им. Н.И. Лобачевского и Татьяна Зинченко, заведующая лабораторией нашего института).	доктора	2
333	доктора	Но доктора-то сказали -- три месяца.	доктора	2
334	доктора	доктора наук проникновенно рассказывают, что у них в НИИ слесарь самый незаменимый, он науку делает…	доктора	2
335	доктора	Взять хотя бы пикник на лужайке, где доктора наук проникновенно рассказывают, что у них в НИИ слесарь самый незаменимый, он науку делает, а без научных кадров они вполне обойдутся.	доктора	2
336	доктора	Мне непонятны комментарии, которые оставили доктора после моего сообщения.	доктора	2
337	доктора	Ну это Вы преувеличили (про ВСЕХ), 40% -- квалифицированные и уважаемые доктора.	доктора	2
338	доктора	Все доктора без исключения для вас -- «плохие», но вы все равно приходите, или вас привозят.	доктора	2
339	доктора	12 сотрудников -- доктора наук, 45 сотрудников имеют степень кандидата.	доктора	2
340	доктора	Доктора выползают из своих носилок, собираются, перешучиваются.	Доктора	2
341	доктора	Например, доктора велят есть икру, рыбу, бульон, а он вегетарианец и этим губит себя».	доктора	2
342	доктора	Чеховский Серебряков, персонаж «Дяди Вани», постоянно повторяющий: «Но отчего мне так тяжело дышать?», «Невыносимая боль!», «Проснулся от мучительной боли», -- из той же породы вечных жалобщиков, с которыми ничего не могут поделать доктора.	доктора	2
343	доктора	Доктора сказали, что это очень плохой признак.	Доктора	2
344	доктора	Доктора, когда видят снимки, говорят что это фальсификация», -- добавляет Татьяна Боровикова.	Доктора	2
345	доктора	Пугачев убедительно доказывал, что Тургенев и его друзья не были повинны в разрыве с «Современником», как единогласно уверяли все советские кандидаты и доктора разных наук; на самом же деле знаменитых писателей без церемоний грубыми приемами изгоняли из редакции некрасовского журнала Чернышевский и Добролюбов.	доктора	2
346	доктора	Может, пишут они, эти доктора наук, не о племени бонда?	доктора	2
347	доктора	Доктора презрительно попереглядывались -- те ещё снобы.	Доктора	2
348	доктора	Доктора имеют возможность также болеть, я более тем простой фельдшер! -- обернулся из-под собственной процедуры Николай Августович.	Доктора	2
349	доктора	Одни доктора с полковниками да чернь презренная.	доктора	2
350	доктора	Она самостоятельно провела опросы студентов, выявив, что доктора наук оцениваются на два балла, а она сама -- на десять.	доктора	2
351	доктора	Уважаемые доктора, выскажите, пожалуйста, мнение вот об этих курсах:	доктора	2
352	доктора	В то время как придворные доктора решительно отговаривали монарха от сей пагубной привычки.	доктора	2
353	доктора	Ксения взглянула внимательно, как смотрят доктора на больных, и добавила так, словно была вдвое старше Александры: -- Жизнь на то и жизнь, что ее не закажешь себе на вырост и с гарантией, не предусмотришь ничего, даже на пять минуток вперед.	доктора	2
354	доктора	Я надеюсь, что специалисты высокой квалификации -- кандидаты и доктора наук -- способны вырастить молодое поколение атомщиков, и эта работа в Республике разворачивается с новой силой.	доктора	2
355	доктора	Доктора придерживаются мнения, что со временем тик пройдет…	Доктора	2
356	доктора	А утро вечера мудренее, в понедельник вернутся офицеры и доктора, приедет полковник Вильченко.	доктора	2
357	доктора	Точно! -- подхватил Витя, -- А доктора пользуются.	доктора	2
358	доктора	В конце концов, каждый делал что мог: Татарников болел, доктора его резали, а жена говорила по телефону.	доктора	2
359	доктора	То ли произошла ошибка в выборе докторов, то ли болезнь и впрямь нельзя было остановить, но только после операции доктора избегали встреч с родными.	доктора	2
360	доктора	Одно дело помереть от болезни -- на то есть доктора, чтобы болезнь остановить, а другое дело -- погибнуть на войне.	доктора	2
361	доктора	Но здешние доктора несомненно трудятся -- вот сколько всего отрезали.	доктора	2
362	доктора	Вы же доктора!	доктора	2
363	доктора	Сейчас доктора чудеса творят.	доктора	2
364	доктора	На следующий день в палату к Татарникову пришли его лечащие доктора -- Лурье и Колбасов, пришли подтвердить свое решение.	доктора	2
365	доктора	Доктора Антон Чехов и Михаил Булгаков не дадут соврать, что литература исследует человеческую душу, а не гениталии.	Доктора	2
366	доктора	Тогда опасность миновала, но когда в начале января 1730-го Пётр II снова простудился на церемонии водосвятия на Москве-реке, доктора решили, что наступила очередная лихорадка, от которой и стали пользовать императора.	доктора	2
367	доктора	Конечно, есть положительная динамика, как доктора говорят.	доктора	2
368	доктора	Доктора повторили: «Во всем здорова, и помешки чадородию они не чают».	Доктора	2
369	доктора	Среди них есть доктора, профессора, лауреаты Государственной премии в области науки.	доктора	2
