Index	Homograph	Context	TargetWord	Label
141	доктора	В частности, получили предложение на проведение совместных экспериментов на научной базе в районе поселка Большие Коты в Иркутской области на Байкале заместителя директора по научному направлению, заведующего лабораторией Томского института оптики атмосферы доктора физико-математических наук Михаила Панченко.	доктора	1
142	доктора	В рубрике «Социально-экономические проблемы информационного общества это статья нашего постоянного автора, доктора наук Ольги Вершинской, о необходимости «направляемого» электронного развития и разработки социальных технологий вовлечения граждан в информационное общество и статья доктора наук Сергея Дятлова о новых явлениях и процессах, требующих научного осмысления в условиях глобальной информационно-сетевой экономики.	доктора	1
143	доктора	Чтобы у больного два доктора было: оперирующий хирург и лечащий врач.	доктора	1
144	доктора	У доктора был довольный вид.	доктора	1
145	доктора	Перепрыгнув через Бригиту, я пошел обратно к себе, решив дожидаться нового доктора во сне, где относительное время ускоряло свой бег и отпускало от себя сопричастных его течению, предоставляя им короткую передышку.	доктора	1
146	доктора	А две недели спустя -- не без помощи хромого доктора -- в пристройке, за домом, посреди пыльных фолиантов, тяжелых кожаных переплетов, окруженный мудростью веков, родится на свет младенец мужского полу.	доктора	1
147	доктора	По данным доктора географических наук Дмитрия Фащука (Институт географии РАН), последние посредством сложного, пока до конца не исследованного комплекса биохимических процессов заставляют коралл интенсивнее выделять известняк, формируя их скелет.	доктора	1
148	доктора	У этого доктора был счастливый дар: она не только прекрасно оперировала, но и умела выхаживать больных.	доктора	1
149	доктора	Кстати, используя именно это сравнение, ему и была предложена помощь от добродушного вида доктора с чеховской бородкой, постепенно оформившегося во Владимира Павловича, с плавно изогнутой курительной трубкой в руках, на костяном мундштуке которой отпечатались следы все еще крепких зубов.	доктора	1
150	доктора	Эта модель широко представлена в культуре 1930—1980-х годов -- в диапазоне от романа Ильи Эренбурга «День второй» (1934) до «Доктора Живаго» (1957) Бориса Пастернака, от «Реквиема» (1935—1940) А. Ахматовой и мемуаров Н.Я. Мандельштам (1970, 1972, 1978) до «Жизни и судьбы» (1961, опубл. в 1980-м) Вас.	Доктора	1
151	доктора	Когда шла, думала: болеют сейчас простудными заболеваниями немало новгородцев, а телефон для вызова доктора в поликлинике всего один, поэтому-то и занят постоянно.	доктора	1
152	доктора	Фитобар, где каждый день мальчишки и девчонки по предписанию доктора, который, к слову сказать, постоянно в школе находится, пьют полезные чаи и кислородный коктейль.	доктора	1
153	доктора	Она ведет блог в «Фейсбуке» или «Живом журнале», она гражданский активист, и, поскольку она же дочь доктора-революционера и племянница мэра-реакционера, в ее блоге постоянно появляется «эксклюзив».	доктора	1
154	доктора	Преступление доктора Паровозова	доктора	1
155	доктора	Верочка, -- тоном доброго доктора спросил Сергей, -- а Юрка перед тобой на коленях стоял?	доктора	1
156	доктора	Сперанский почувствовал себя свидетелем какого-то виртуального соития с невидимым партнером, которому пациентка доктора Гольдштейна отдавалась со всевозможной страстью.	доктора	1
157	доктора	Разработку методов изготовления ДОЭ начали в Институте автоматики и электрометрии СО РАН в 1970-е годы под руководством доктора технических наук Вольдемара Коронкевича.	доктора	1
158	доктора	Исходными данными служат геномы термофильных архей (коллекция доктора биологических наук Елизаветы Бонч-Осмоловской, Институт микробиологии им. С.Н. Виноградского РАН), секвенированные в Геномном центре НБИКС-центра, возглавляемом академиком Константином Скрябиным, и Центре «Биоинженерия» РАН.	доктора	1
159	доктора	Спустя 6 лет после окончания МЭИ Борис Николаевич защитил диссертацию на тему «Анализ автоматических копировальных систем», за которую ему сразу присвоили ученую степень доктора технических наук.	доктора	1
160	доктора	Среди 13 залов музея -- отдельные экспозиции, посвященные фильмам «Метрополис» и «Кабинет доктора Калигари», нацистскому кино (и отдельно «Олимпии» Лени Рифеншталь), анимации, спецэффектам и Марлен Дитрих, которая Берлин ненавидела до такой степени, что даже не хотела вспоминать о месте своего рождения -- и упокоения.	доктора	1
161	доктора	С радостью! — пенсне Доктора похотливо заблестело.	Доктора	1
162	доктора	В выступлении доктора Кит Ковакс из Норвежского полярного института (Тромсе, Норвегия) прозвучало: задержка в установлении ледового покрова в последнем десятилетии, уменьшение мощности ледяной платформы, являющейся местообитанием ластоногих, пагубно сказывается на здоровье и численности их популяций, на жизни белого медведя, стоящего на вершине пищевой пирамиды.	доктора	1
163	доктора	Как рассказывает далее официальная биография доктора Вольфа, «гуманистические ценности, привитые ему уже в детстве, побудили его оказать моральную и финансовую поддержку» вождю кубинской революции Фиделю Кастро, и в благодарность за эту постоянную поддержку, а также в знак признания личных качеств д-ра Вольфа вождь назначил его полномочным послом Республики Куба в Республике Израиль.	доктора	1
164	доктора	По мнению известного новгородского историка, члена Союза писателей РФ, писателя-пушкиниста доктора филологических наук Вячеслава Кошелева, период его жизни в Вологде «был одним из самых продуктивных.	доктора	1
165	доктора	Американский психолог, профессор Калифорнийского университета в Сан-Франциско, специалист в области психологии эмоций, межличностного общения, а также психологии и распознавания лжи, был вдохновителем и консультантом телесериала «Обмани меня», а также стал прототипом его главного героя доктора Кэла Лайтмана.	доктора	1
166	доктора	Начну с самого уважаемого – мы считаем его патриархом информационного общества – Дмитрия Семеновича Черешкина, вице-президента Российской академии естественных наук, доктора технических наук, заведующего лабораторией Института системного анализа Российской академии наук, человека, который начал работать в этом направлении с конца 1980-х годов.	доктора	1
167	доктора	Если бы я имел такой массив данных, допустим, о нейтронах или о тахарском языке, то мог вполне претендовать на степень доктора наук.	доктора	1
168	доктора	В недавно опубликованной работе доктора геолого-минералогических наук Анатолия Чипизубова (Институт земной коры СО РАН) о прежних землетрясениях в Прибайкалье они рассматриваются с 1734 г. (событие на юго-западе Байкальской рифтовой системы).	доктора	1
169	доктора	Причем оба блока прибора, которым управляет группа московских специалистов под руководством заведующего лабораторией космической гамма-спектроскопии ИКИ РАН доктора физико-математических наук Игоря Митрофанова, работают штатно без замечаний.	доктора	1
170	доктора	По воспоминаниям одного из ведущих специалистов в области УТС доктора физико-математических наук Николая Семашко, работа требовала привлечения больших научных, проектных и производственных коллективов, в первую очередь Опытного конструкторского бюро крупнейшего предприятия отечественного машиностроения завода «Электросила» (г. Ленинград).	доктора	1
171	доктора	Недавно группа доктора Стивена Коллинза провела раскопки на месте предполагаемого нахождения этих библейских городов, в Баб-эль-Дахра.	доктора	1
172	доктора	Лучшего доктора, чем время, не найти.	доктора	1
173	доктора	Портрет Фрейда был, конечно же, уместнее в кабинете светила психиатрии, доктора наук и профессора.	доктора	1
174	доктора	Доктора нет.	Доктора	1
175	доктора	Предвидя трудные роды, придворные медики настояли на приглашении из Берлина знаменитого доктора Менеля, и, когда младенец все-таки родился, а мать осталась жива, консилиум врачей категорически объявил: еще одних родов императрице не перенести и лучше всего для нее будет переменить образ жизни, поселившись где-нибудь на покое.	доктора	1
176	доктора	Для исследований в области реакторной технологии и радиационного материаловедения в апреле 1952 г. в Лаборатории под руководством доктора технических наук Владимира Гончарова создали первую в СССР комплексную экспериментальную базу, состоящую из установки РФТ (реактор для физических и технических исследований) мощностью 10 МВт, реакторных петель с различными видами теплоносителей и режимами испытаний и «горячей» материаловедческой лаборатории.	доктора	1
177	доктора	В настоящее время на кафедре работают 15 штатных преподавателей и 20 совместителей, в числе которых 2 доктора наук и 14 кандидатов наук.	доктора	1
178	доктора	Книжка доктора Мольца «Я – это я, или как стать счастливым».	доктора	1
179	доктора	Мариарти  из Шерлока Холмса и доктора Ватсона -- канонический злодей Дракон в исполнении Янковского по кинопьесе Захарова – однозначно внушает, Озимандиас – нестандартный злодей, и У.Деффо в любой роли – маньячище.	доктора	1
180	доктора	И перспективы нынешней английской технологии, по словам Бориса Рыженко, доктора химических наук, заведующего лабораторией моделирования гидрохимических и гидротермальных процессов Института геохимии и аналитической химии им. В.И. Вернадского, тоже весьма призрачны.	доктора	1
181	доктора	Женщина не требовала восполнить ей материальные затраты, которые пошли на ненужную и убийственную терапию, а просто хотела услышать от доктора слова извинения.	доктора	1
182	доктора	Образ гениального, но не проявляющего ни к кому сочувствия и язвительного доктора-наркомана, расследующего вместе со своей командой самые сложные медицинские случаи, стал культовым в России.	доктора	1
183	доктора	По словам доктора де ла Фуэнте Маркоса, «он представляет собой большую груду камешков, причем очень хрупкую».	доктора	1
184	доктора	Под руководством директора Института биофизики академика Андрея Дегерменджи и исполнительного директора Международного центра замкнутых экологических систем, доктора биологических наук Александра Тихомирова создается система нового поколения с глубоким замыканием массообменных процессов и автоматизацией систем измерения контроля с учетом международных стандартов.	доктора	1
185	доктора	По словам доктора биологических наук Светланы Загировой, заведующей отделом лесобиологических проблем Севера из Института биологии Коми научного центра Уральского отделения РАН, проблема углерода сегодня не столько научная, сколько политическая.	доктора	1
186	доктора	Литературное пьянство, гуманитарный запой всесоюзного братства имени доктора Равика, дальнейшие бродские коннотации вроде «налить вам этой мерзости? налейте» -- вот откуда, на самом деле, происходит эта проза, настоянная на позднейшем открытии Кузмина и Газданова.	доктора	1
187	доктора	Один из необычных экспонатов музея – рукописи 1870-1880-х годов члена «Могучей кучки» Александра Бородина, совмещавшего научную деятельность со служением искусству (доктора медицины и одного из основателей отечественной классической симфонии): на их страницах наброски арий перемежаются с химическими формулами.	доктора	1
188	доктора	С утверждением Багрова, что «Хорографическая книга» принадлежала данной комиссии, согласуются слова ученого секретаря Постоянной историко-археографической комиссии АН СССР Александра Андреева (позднее доктора исторических наук) о том, что в 1926–1927 гг. он вел усиленные поиски пропавшего атласа.	доктора	1
189	доктора	Но технологически без «Огры» и титанического труда верного помощника Игоря Васильевича доктора физико-математических наук Игоря Головина по созданию инженерной базы термоядерных исследований не было бы и успеха знаменитых теперь токамаков.	доктора	1
190	доктора	У доктора Черняховского есть больная-портниха, которая поправляет ему одежду, больной-банкир, который советует, где лучше хранить деньги, и даже больной-читатель, который в восторге от всех его произведений.	доктора	1
191	доктора	Так что не только дети, но и, как минимум, все известные нам 4 внука И. И. Вавилова принадлежали к советской интеллектуальной элите (три доктора и один молодой кандидат наук).	доктора	1
192	доктора	Впоследствии полотно стало называться «Анатомия доктора Тульпа» (1632, Маурицхейс, Гаага), оно принесло мастеру широчайшую известность.	доктора	1
193	доктора	Мужчина, словно почувствовав смущение доктора, отвернулся, насколько позволяла шея, покорно и шумно втягивая и выдыхая воздух.	доктора	1
194	доктора	Елена Зейферт -- поэт университетский, о чем свидетельствуют многие признаки, наложившие отпечаток на творчество: степень доктора филологических наук, преподавание в университете и знание языков -- как следствие, доля филологии в поэзии, установка на эмоциональную рефлексию, усложненная строфика, игра с иностранными словами, построенная на ассоциациях или созвучиях, и словотворчество.	доктора	1
195	доктора	Начало моей научной работы на кафедре химической энзимологии химического факультета МГУ им. М.В. Ломоносова под руководством доктора химических наук (ныне профессора Гарвардского университета) Анатолия Клесова пришлось на 1980-е годы.	доктора	1
196	доктора	Как любая коммерческая организация, страховое общество «Саламандра» было заинтересовано в получении прибыли, и в обязанности доктора Бетлингка входило определение того, как долго сможет клиент финансировать общество, пребывая «на этом свете».	доктора	1
197	доктора	Я говорю о работах философов Екатерины Петровой, кандидата наук из Москвы, и Людмилы Баевой, доктора наук из Астрахани, ставшей нашим постоянным автором.	доктора	1
198	доктора	А в работе доктора наук Михаила Карманова и кандидата наук Павла Смелова из МЭСИ освещается тема сотрудничества органов власти и граждан в процессах интернет-переписей населения — совершенно новая для нашего журнала и, как мы надеемся, интересная для его читателей.	доктора	1
199	доктора	Но не менее значима для борьбы с чумой была деятельность военного доктора Данилы Самойловича.	доктора	1
200	доктора	История России создается противоестественным путем -- походом алкоголика в Петушки, походом на дырявом корабле в Баренцево море, отчаянной смелостью доктора философии, который решает стать Гомером.	доктора	1
201	доктора	Однако на такое выступление ему не дали разрешения доктора.	доктора	2
