Index	Homograph	Context	TargetWord	Label
1	доктора	"Доклад доктора юридических наук, профессора Государственного университета-Высшей школы экономики Л. Сюкияйнена был посвящен теме ""Правовые средства борьбы с исламским экстремизмом и основные направления государственной политики в отношении ислама "". С начала 1990-х гг. в России наблюдается заметная активизация ислама, усиливается его роль в различных областях жизни страны."	доктора	1
2	доктора	Три ошибки Доктора	Доктора	1
3	доктора	"Она привыкла говорить резко, не улыбаться, не плакать, слышать от людей: ""некрасива "" и ждать Астрова; в глубине души, за своей любовью она тоже знает: ""для деревенского доктора, в его годы, это была бы прекрасная жена ""."	доктора	1
4	доктора	А что вы думаете о методике доктора Бобыря, эта методика обещает за 2 сеансы выправить позвоночник, но так, чтобы его не просто разболтать и нанести вред, а устранить причины.	доктора	1
5	доктора	Так что Сережа потом в одночасье из доктора тоже превратился в пациента.	доктора	1
6	доктора	И ведь что любопытно и симптоматично: идеи доктора Чезаре Ломброзо, который впервые заговорил о биологических основах криминала, никуда не делись.	доктора	1
7	доктора	Мои родители были вовсе не модные магнаты, а физики и альпинисты, и я Анне рассказываю, как мы ехали в очередной раз на Кавказ на альпинистские сборы -- мне было двенадцать, -- и с нами отчего-то поехала Сан Санна, жена доктора.	доктора	1
8	доктора	"Собственноручная, писанная в 1959-м синими чернилами записка Пастернака, в которой он отказывается от издания ""Доктора Живаго ""."	Доктора	1
9	доктора	"В статье доктора исторических наук B. С. Шардакова ""Атомный гриб "" утверждается, что Пхеньян в те годы мог стать новой Хиросимой."	доктора	1
10	доктора	Предисловие, комментарии, редакция и приложение доктора филологических наук Дожоокийн Цэдэва.	доктора	1
11	доктора	"Сказать, что ""инженерный разум Бенца, смекалка Форда и сумрачный гений доктора Дизеля уравняли шансы паралитика и марафонца "", -- значит сказать неправду."	доктора	1
12	доктора	Ни одного неосторожного слова доктора или самих корреспондентов, ни одного экстремистского заявления зловещих людей в камуфляже не попало в кадр -- уникальные кадры все сказали сами за себя.	доктора	1
13	доктора	Ничего другого из жизни доктора фельдшеру не было известно, да он и не интересовался им, занятый собственными интересами -- начавшимся ухаживанием за дочерьми Лейбы Когана, в квартире которого недавно поселился.	доктора	1
14	доктора	"Колюня был безудержно самонадеян и глуп, в минуты трагической молодости он читал тети Верино Евангелие с сигаретой во рту, перемежая чтение стихами из "" Доктора Живаго "", на Страстной неделе ходил, как на службу, на концерты органной музыки в исполнении Гарри Гродберга и обожал слушать на стареньком магнитофоне рок-оперу "" Иисус Христос-суперзвезда "", которая заменяла ему акафисты и стихиры и поставляла сведения о земной жизни Спасителя."	Доктора	1
15	доктора	"Один из Кукоцких упоминался в списках слушателей доктора Иоханна Эразмуса из Страсбурга, первого западного врача, читавшего в России среди прочих медицинских дисциплин ""бабичье искусство ""."	доктора	1
16	доктора	"Президент преподнес ресторану ""Тандур "" фотографию, на которой во время визита в Индию ему вручают диплом почетного доктора Университета имени Джавахарлала Неру."	доктора	1
17	доктора	"Васькянин не один день целенаправленно искал друга, он уже изъял из редакции ""Комсомолки "" пылкую статью доктора технических наук."	доктора	1
18	доктора	Вернувшись в Москву после своих первых миланских гастролей, я вскоре получила от доктора Антонио Гирингелли очень теплое письмо:	доктора	1
19	доктора	Она нашла одну Барби, которая жила в доме доктора по глазным болезням, и эта докторская Барби как-то так сумела обставить дело, что глазному доктору приснился слепой старик, ходящий по помойкам с палочкой.	доктора	1
20	доктора	Возможно. двойственное это чувство перешло к нему от отца -- математика и почетного доктора ботаники.	доктора	1
21	доктора	Еще письма: от Нины Константиновны, от Главного, от доктора Чагина.	доктора	1
22	доктора	"Эдик, глядя на усы и бороду доктора Абрамова, думал что-то приблизительно соответствующее: "" Ну что ты мне, Айболит, заливаешь, а?"	доктора	1
23	доктора	Два доктора с сестрицей	доктора	1
24	доктора	"Впрочем, методы менялись, и ""гуманная "" казнь по способу доктора Гильотена чередовалась с бесформенным пиршеством народа, когда к задушенной французской революционной толпой женщине бросался ""икс "", распарывал ей грудь и впивался зубами в сердце."	доктора	1
25	доктора	"За самой верхней балкой была проволокой примотана к потолку холстина, а в ней бельгийский браунинг и две коробки патронов к нему, офицерская сумка с биноклем, компас, карта-трехверстка, зажигалка, морской кортик и записная книжка "" Врач "" (издание доктора Окса)."	доктора	1
26	доктора	Люди пожилые стремились получить медицинский совет и у доктора Волынцева и у Володи, о котором было известно, что он светило, и все, конечно, мечтали хотя бы словом обмолвиться с летчиками.	доктора	1
27	доктора	Это портрет моего любимого человека доктора Блиндермана.	доктора	1
28	доктора	Носик у доктора пуговкой, а лоб крутой.	доктора	1
29	доктора	Парализованного отца доктора Маргулиса несли на одеяле.	доктора	1
30	доктора	В стареньком пальто, с головой, повязанной шерстяным платком, она, жена доктора наук и профессора, казалась воплощением военной эвакуационной бедности.	доктора	1
31	доктора	Бессмысленны слова доктора Штокмана, -- силен тот, кто одинок...	доктора	1
32	доктора	Вырвался у доктора из рук, утащил щетку и разгрыз ее на мелкие кусочки.	доктора	1
33	доктора	"И вот в следующем же номере журнала появилась целая серия снимков с ""Коллекции доктора Кенига ""."	доктора	1
34	доктора	При экспериментальной лаборатории доктора Курцера или при концентрационном лагере, доверенном мне приказом самого военного министра?	доктора	1
35	доктора	В сорок четвертом году его превосходительство действительно в течение двух месяцев месил грязь, и его подгоняли плеткой в лагере ведомства доктора Лея.	доктора	1
36	доктора	Но я только засмеялся, мальчишески радуясь недоумению доктора, и сбежал с лестницы.	доктора	1
37	доктора	"Лицо моего сослуживца из ""Пароходства "" я помню, а лицо доктора расплылось."	доктора	1
38	доктора	В конце сентября, -- читал Кукольник, -- Орест Кипренский занемог жестокой горячкой, от которой усердием доктора начал было оправляться и стал выходить, как простудился снова, и горячка возвратилась.	доктора	1
39	доктора	Она жена доктора, Сергея Ивановича.	доктора	1
40	доктора	Как ваш адрес? -- шепотом спросил Бездомный у доктора, прикрывая трубку ладонью, -- а потом опять закричал в трубку: -- Вы слушаете?	доктора	1
41	доктора	Ничто лучше струи табачного дыма не приближает моей душе этот реальный и изменчивый образ существа с нежной, но лукавой душой, существа, созданного порывом ветра и фразой доктора-акушера.	доктора	1
42	доктора	Функции доктора и адвоката так родственны друг другу, что часто смешиваются между собой.	доктора	1
43	доктора	Глаза доктора, по обыкновению, двигались из стороны в сторону, и правый глаз он прищуривал самым странным образом.	доктора	1
44	доктора	Мы сели верхом; Вернер уцепился за поводья обеими руками, и мы пустились, -- мигом проскакали мимо крепости через слободку и въехали в ущелье, по которому вилась дорога, полузаросшая высокой травой и ежеминутно пересекаемая шумным ручьем, через который нужно было переправляться вброд, к великому отчаянию доктора, потому что лошадь его каждый раз в воде останавливалась.	доктора	1
45	доктора	Эти слухи расхоложали усердие родственников, и с некоторого времени уже никто не прибегал к нему с просьбою; к тому же замечали, что когда просившие не соглашались на предложение доктора, то больной умирал уже непременно; та же участь постигала всякого, кто или заводил тяжбу с доктором, или сказал про него что-нибудь дурное, или просто не понравился ему.	доктора	1
46	доктора	Все другие утром заняты были сплетнями, вечером зевательными пирушками и посещениями, которых ждали, словно доктора, и рады были, как лихорадке.	доктора	1
47	доктора	Они накормили нас яичницею, которую я принужден был есть, невзирая на запрещение доктора Гениша.	доктора	1
48	доктора	В совокупности за свои труды он получил степень доктора церковной истории.	доктора	1
49	доктора	И. М. Скворцова, кафедрального протоиерея Киево-Софийского собора, заслуженного ординарного профессора университета святого Владимира, доктора богословия, первого профессора философии Киевской духовной академии, одного из основателей Киевской религиозно-философской школы, представлены разнообразные темы -- от догматики православного богословия до вопросов христианской жизни, личности, культуры, общества.	доктора	1
50	доктора	Так, по словам главного специалиста Научно-технического центра ПАО «ММК» доктора технических наук Сергея Денисова, на комбинате сейчас работают над новым поколением стали, то есть в соответствии с мировой тенденцией переходят в область нанотехнологий, а это новые микродобавки, в том числе редкоземельных металлов, многое другое, что позволит кардинально улучшить качество продукции.	доктора	1
51	доктора	Юрист по образованию, получил степень доктора философии в 1894 году в Университете г. Лейдена.	доктора	1
52	доктора	Отстоял очередь, захожу в кабинет, вижу, у доктора на халате написано — «Валентина Васильевна», то есть моя полная тезка!	доктора	1
53	доктора	Чудом спасенный от смерти умелыми руками доктора Иван медленно открыл глаза, зевнул и сел на кровати.	доктора	1
54	доктора	Газетные злости Доктора Финке.	Доктора	1
55	доктора	После ухода доктора сосед по палате, уже почти выздоровевший больной, несмотря на то что его никто не спрашивал, доложил Глебу Николаевичу:	доктора	1
56	доктора	В рассказе Михаила Булгакова (1891–1940) «Морфий» показана жизнь и гибель доктора Сергея Полякова, в конечном итоге покончившего с собой.	доктора	1
57	доктора	Мысли мои путались, строились бутербродом в три яруса, перекрывая одна другую, и вот я уже не читал, а бессмысленно смотрел на строчки и представлял себе шприц доктора Менгеле.	доктора	1
58	доктора	Не где-нибудь, а в кабинете у доктора решил он поумничать: цитировал из Байрона и из Пушкина, и даже из философа Ницше.	доктора	1
59	доктора	Еще одна тетя Иустинии Преображенской -- Александра Евфимовна Флерова, в замужестве Янышева (1832-1901) -- супруга Иоанна Леонтьевича Янышева (182613.06.1910) -- ректора СПбДА, духовника императорской фамилии (с 1883 до своей смерти в 1910), протопресвитера придворного духовенства (до 4.10.1906); члена Святейшего Правительствующего Синода (с 1905), доктора богословия (1899).	доктора	1
60	доктора	Ну а в центре этой замысловатой композиции находится диван, покрытый восточным ковром с подушками, точь-в-точь такой, какой стоял в кабинете доктора Зигмунда Фрейда в Вене.	доктора	1
61	доктора	С 1 сентября 1912 г. он также работал законоучителем Петербургской частной гимназии и реального училища доктора Н. П. Шеповальникова, а с 8 марта 1913 г. -- штатным учителем ряда средних учебных заведений Министерства народного просвещения.	доктора	1
62	доктора	Вскоре она получила степень доктора (в 1909 г. в возрасте 27 лет) за диссертацию на тему: «Женщина в творчестве Кретьена де Труа» (после издана отдельной книгой).	доктора	1
63	доктора	Познакомились они еще на Комаровской (жили в одном дворе), но теперь, зимой 1915/16 года, когда гимназистка Ася жила отдельно от мамы в семье доктора Ланковского -- революционера, покинувшего Россию в 1905 году, -- Саша посмотрел на эту девочку другими глазами.	доктора	1
64	доктора	Весной 1901 года болгарские партнеры достали Ульянову паспорт на имя доктора юридических наук Иордана Иорданова -- большая удача, ведь теперь можно было передвигаться по Германии и не юркать в первую же подворотню при встрече с полицейскими; лысоватому человеку «калмыцкой наружности» пришлось отпустить предположительно «болгарские» усы -- и, как бы странно он при этом ни выглядел, по-видимому, они шли ему; во всяком случае, у него получалось долгое время выдавать себя за человека 1878 года рождения, то есть на восемь лет младше.	доктора	1
65	доктора	Александр Шморель родился в сентябре 1917 года в Оренбурге в семье немецкого доктора Гуго Шмореля и дочери русского священника Натальи Введенской.	доктора	1
66	доктора	Однажды я брал интервью у очень сурового доктора биологических наук с окладистой седой бородой.	доктора	1
67	доктора	Это не только в книгах, по себе помню, что после «Доктора Хауса» было сложно смотреть «17 мгновений весны».	Доктора	1
68	доктора	Например, после «Шерлока Холмса» и «Доктора Хауса» невозможно смотреть «Семнадцать мгновений весны», где Штирлиц пять минут идет…	Доктора	1
69	доктора	Ну что, будешь задавать вопросы на манер доктора Ватсона?	доктора	1
70	доктора	Я спросил у доктора Вахаба Дарвиша (моего постоянного курдского комментатора) о реакции на задержание прокурдских депутатов.	доктора	1
71	доктора	Давно прошли времена, когда можно было выдать за открытие тот факт, что Бонд -- такая же пропаганда (британского империализма), как силуэты фараонов на пилонах египетских храмов и мозаики с Лениным -- на советских домах культуры, причем, парадоксальным образом, степень убедительности этой пропаганды может соперничать лишь со степенью ее абсурдности, потому что никакой Британии-над-которой-никогда-не-заходит-солнце не существовало уже в момент премьеры «Доктора Но», и никакие баснословные суммы, потраченные на съемки, не в состоянии скрыть тот факт, что Бондиана -- последние судороги Британской империи.	Доктора	1
72	доктора	Еще бы: днем сочинять надписи в настенные календари про полуфабрикаты и приусадебное хозяйство, ночью -- свои версии «Защиты Лужина» и «Доктора Фаустуса».	Доктора	1
73	доктора	Которое, оказывается, создало настоящую эпидемию потребления опиоидов (болеутоляющих препаратов; не знаете, что они часто «утоляют». --спросите у доктора Хауса).	доктора	1
