Index	Homograph	Context	TargetWord	Label
789	пропасть	Это – крах семьи, путь в пропасть барахла, страха, подлостей.	пропасть	про+пасть
790	пропасть	Дальнейшую жизнь этому астральному телу дает только дух, если он оказывается в наличии, дух, который только один может после смерти перешагнуть пропасть, разделяющую космосы и их сущности...	пропасть	про+пасть
791	пропасть	Туда нельзя было не попасть, такой он огромный, с отверстием, похожим на пещеру, и, подобно пещере, темный и глубокий, как пропасть.	пропасть	про+пасть
792	пропасть	На самом деле – мне не стоило горячиться; я должен был объяснить ей, что для советской молодежи семидесятых любая левая идея была тем же, чем для нее – программа партии Ле Пена; впрочем, тогда мне было неясно самому, что она была там тем же, чем я – здесь, и мы оба были жертвами расхожего нонконформизма: я возмущался поруганием светлой идеи западной демократии, она утверждала, что, не будь советские оппортунистами, они давно бы построили справедливое общество, как Фидель на своем отдельно взятом острове; я ненавидел большевиков со всей страстью человека, вчера ночью дочитавшего «Архипелаг ГУЛАГ», ее же воротило от богатого Запада – двоедушного, эгоистичного, буржуазного и катящегося в пропасть.	пропасть	про+пасть
793	пропасть	Скрипучее, как доска, перекинутая через пропасть.	пропасть	про+пасть
794	пропасть	Одному из них показалось, что перед трактором внезапно разверзлась пропасть, и он остановил машину.	пропасть	про+пасть
795	пропасть	И вот наступает миг, когда уже и не осознаешь, что между далекими городишками, где бывал, между российскими общими вагонами, которые переносили тебя в пространстве, между миром теплого хлеба, горьких трав и вечных очередей; между тем прежним миром, который окружал тебя, и теперешнею государственной службой – провал, пропасть, в которую лучше и не заглядывать.	пропасть	про+пасть
796	пропасть	Тот, напротив, был убежден, что вся русская история исключает демократический путь развития, все идет к смуте, под уклон, в пропасть, страна уже покатилась, и остановить не сможет никто.	пропасть	про+пасть
797	пропасть	Пропасть чуял?	Пропасть	про+пасть
798	пропасть	Но все же, как бы ни скрывали ошибки и взрывы, как бы ни были наивны и доверчивы радостные манифестации оттепели и какая бы безмерная пропасть ни разверзлась между временами теперь, все равно – Гагарин был первым.	пропасть	про+пасть
799	пропасть	Пропасть недоверия, вражды и ненависти растет с каждым днем...	Пропасть	про+пасть
800	пропасть	Я словно человек, идущий через пропасть по гнилой веревке.	пропасть	про+пасть
801	пропасть	Над этим кратером (о таком мечтают все геологи, исследующие земную кору!) видно голубое небо, лазурное небо летнего пляжа, напоминающее о радости и отдыхе, и животворное солнце, бросающее свои лучи почти вертикально в пропасть.	пропасть	про+пасть
802	пропасть	Однако, прекрасно понимая, насколько велика пропасть между познаниями (с фантазиями) древних и нашим знанием, нельзя, как нам кажется, перечеркивать все то, что донесли до нас прошедшие эпохи.	пропасть	про+пасть
803	пропасть	Так бывает, когда в пропасть заглядываешь: и посмотреть хочется, и страшно смотреть.	пропасть	про+пасть
804	пропасть	Усидеть между двумя стульями не удастся, и пропасть бюджетного дефицита будет углубляться.	пропасть	про+пасть
805	пропасть	Он подтянулся и вылез на незнакомый каменный пятачок, обрывающийся в пропасть, противоположный край которой скрывался за левой границей монитора (там еле слышно что-то жужжало).	пропасть	про+пасть
806	пропасть	За последние два дня ухряб из маленькой щелочки внутри превратился в бездонную и безграничную пропасть, над которой Маралов висел, цепляясь за крохи уже не здравого смысла или, скажем, разума, а просто некоторой остаточной неухрябности.	пропасть	про+пасть
807	пропасть	Мир, который изобразил Подниекс, катится в пропасть.	пропасть	про+пасть
808	пропасть	Нас предупреждали: нельзя перепрыгнуть пропасть двумя прыжками.	пропасть	про+пасть
809	пропасть	Но мир, кажется, уже необратимо катится в пропасть.	пропасть	про+пасть
810	пропасть	Клубов, настоящих и теневых, расплодилось пропасть.	пропасть	про+пасть
811	пропасть	А разве мы сами не остановим человека, готовящегося ступить на мостик через пропасть, зная, что тот не выдержит его веса?	пропасть	про+пасть
812	пропасть	Даже если общество будет катиться в пропасть, что, по сути, и происходит, оно едва ли отложит все пустое в сторону и займется серьезными делами.	пропасть	про+пасть
813	пропасть	Нет – тогда страна сорвется в пропасть, и всем действующим лицам драмы, которая разыгрывается на наших глазах, не будет прощения.	пропасть	про+пасть
814	пропасть	Не кажется ли вам, что постепенная приватизация похожа на пресловутую попытку преодолеть пропасть в два прыжка?	пропасть	про+пасть
815	пропасть	Как важно не впасть в амбиции, не противопоставить себя обществу, не рваться грубо к власти, иначе – обрыв, пропасть, падение.	пропасть	про+пасть
816	пропасть	Но другой путь, товарищи, это – путь в пропасть.	пропасть	про+пасть
817	пропасть	Россия катится в пропасть, а мы торгуемся как на рынке.	пропасть	про+пасть
818	пропасть	Это своего рода старый МХАТ, но не тот МХАТ, подражавший живой жизни, которую давно покинул, а чудом в одном случае выживший и затерянный в современной жизни... пропасть, отделяющая, однако, этот сценарий от подмостков, – живая натура....	пропасть	про+пасть
819	пропасть	Иногда это был мощный поток взахлеб рвущихся эмоций со злыми беспомощными слезами, иногда ожесточенный мазохистский протест, иногда – слабые детские угрозы той жестокой темной силе, которая ввергла Тоню в черную пропасть отчаянья.	пропасть	про+пасть
820	пропасть	Зияющая пропасть подъезда разделила нас с Сережей.	пропасть	про+пасть
821	пропасть	Между нами лежал порог моего дома длиной в один шаг – непреодолимый, как бездонная пропасть.	пропасть	про+пасть
822	пропасть	И хотя нет не только никакого обрыва, но вообще пейзажа, ты чувствуешь за их спиной истинную пропасть.	пропасть	про+пасть
823	пропасть	Тарелок за рейс разобьется – пропасть, попробуй на берегу списать...	пропасть	про+пасть
824	пропасть	Не так давно, преодолевая его, свалился в пропасть известный футболист.	пропасть	про+пасть
825	пропасть	Не может он!» – вскринул сержнат и бросился куда-то, как в пропасть.	пропасть	про+пасть
826	пропасть	Бывает, заглянешь – словно в пропасть, до головокружения, до замирания внутри.	пропасть	про+пасть
827	пропасть	Посмотри, сказала Таня, уже вполне определенно обращаясь ко мне, посмотри на их лица, – она имела в виду присутствовавших, чьи черты расплывались в густых облаках дыма, губы ее презрительно скривились, – разве можно их сравнить со всеми этими, по телевизору, толстомордыми, сытыми, самодовольными, они уже довели страну до ручки, им наплевать на все, кроме собственного процветания, они и столкнут ее в пропасть, но только нас здесь уже никого не останется, завершится исход.	пропасть	про+пасть
828	пропасть	Будто не было томительных, душных, изматывающих, тревожных снов, где одно прикосновение – все равно что прыжок через пропасть.	пропасть	про+пасть
829	пропасть	Аверинцев говорил, давно, что в своей статье об инцесте, Эдипе и его матери заглянул в пропасть, от которой сам отшатнулся.	пропасть	про+пасть
830	пропасть	Он разбежался и легко перелетел через пропасть.	пропасть	про+пасть
831	пропасть	Но опять-таки, с другой стороны, явление Христа, воплощение Сына Божия – событие решающее, потому что то разделение, та пропасть, которая прежде существовала между Богом и человечеством, уже как бы закрыта.	пропасть	про+пасть
832	пропасть	Свою раздвоенность Солоухин всегда ощущал очень остро («Между мной и моей дочерью пропасть – я сын крестьянина, а она дочка писателя»), но теперь это приобрело черты гипертрофированные: классовая ненависть к «мальчикам из тёплых сортиров» у него патологическая.	пропасть	про+пасть
833	пропасть	Экономическая борьба, конкуренция, противоположность интересов, – все то, что сопутствует существованию рода человеческого, работало на полную катушку Но это неуклонно смягчались развитием амортизирующих социальных механизмов, сокращая пропасть между богатыми и бедными.	пропасть	про+пасть
834	пропасть	Тьфу ты, пропасть нечистая», – клял он телевизор.	пропасть	про+пасть
835	пропасть	Она не додумала до конца, сон мгновенно обрушился на нее, и она провалилась в темную, глубокую пропасть.	пропасть	про+пасть
836	пропасть	Так вот, при всем этом я, конечно, понимал, какая бездонная пропасть отделяет наши инструменты от настоящих.	пропасть	про+пасть
837	пропасть	Хотелось бы, чтоб это произошло не силовым выжиманием и вышибанием ее – но ее собственным публичным раскаянием: что цепью преступлений, жестокостей и бессмыслия она завела страну в пропасть и не знает путей выхода.	пропасть	про+пасть
838	пропасть	Сумеют ли демократы подхватить падающую в пропасть страну?	пропасть	про+пасть
839	пропасть	Как завораживающе страшен темный зал, этакая горизонтальная пропасть без конца и без края...	пропасть	про+пасть
840	пропасть	И еще четче обозначилась пропасть меж вчерашними соплеменниками, меж теми и этими, «нашими» и «чужими».	пропасть	про+пасть
841	пропасть	И в эту пропасть он только что столкнул доверившегося ему человека!	пропасть	про+пасть
842	пропасть	Жажда современности и мирового состояния с легкостью преодолевали эту пропасть.	пропасть	про+пасть
843	пропасть	Вы представляете, какая пропасть разделяет человек и энергетический сгусток?	пропасть	про+пасть
844	пропасть	Но, чтобы работать, надо было преодолеть пропасть длиною в десять лет...	пропасть	про+пасть
845	пропасть	Страна не дошла до стагнации, а катится в пропасть.	пропасть	про+пасть
846	пропасть	Случайное провалилось в пропасть «забвения».	пропасть	про+пасть
847	пропасть	Но явился Роден и низверг его идеал в пропасть, в грязь...	пропасть	про+пасть
848	пропасть	Армянская трагедия, – размышляла она, – клубок трех стихий: природной, принесшей массовую гибель и страдания, социальной – расширяющей пропасть между богатыми и бедными, и – рожденной ею – межнациональной, истощающей народы.	пропасть	про+пасть
849	пропасть	Кагановича»; тем, между которыми лежит мировоззренческая и нравственная пропасть?	пропасть	про+пасть
850	пропасть	Первое сообщение: лавиной накрыло 59-ю заставу, снесло в пропасть БТР.	пропасть	про+пасть
851	пропасть	Человек летит в пропасть и не понимает причины.	пропасть	про+пасть
852	пропасть	И не важно, что между их правильными словами и поступками будет лежать пропасть.	пропасть	про+пасть
853	пропасть	Безусловно, необходимы срочные меры для предотвращения непосредственной опасности скатывания в пропасть термоядерной войны – урегулирование региональных конфликтов путем компромиссов, движение к глубокому разоружению, к достижению равновесия и оборонительного характера обычных вооружений.	пропасть	про+пасть
854	пропасть	В поезде, сошедшем с рельсов, это дополнительное «благополучное» время исчисляется, вероятно, секундами; если же сходит с рельсов огромное государство, то его инерционный полет в пропасть может длиться, я думаю, годы, если не десятилетия.	пропасть	про+пасть
855	пропасть	Какую же пропасть надо иметь под ногами, чтобы так суетиться перед незнакомой бывшей балериной.	пропасть	про+пасть
856	пропасть	Крутой, травянистый склон, куда выпрыгнула лошадь, метров через двадцать обрывался в пропасть.	пропасть	про+пасть
857	пропасть	Они паслись в таком месте, где с одной стороны была пропасть, а с другой стороны он перегородил единственный выход.	пропасть	про+пасть
858	пропасть	Страна продолжает катиться в пропасть.	пропасть	про+пасть
859	пропасть	А когда мы ринулись в пропасть, эти кретины рванулись за нами, по-прежнему важничая и подводя под каждую глупость политически корректный фундамент...	пропасть	про+пасть
860	пропасть	Подчинение объективному потоку истории в нашу эпоху тянет человечество в пропасть, к катастрофе, к деградации.	пропасть	про+пасть
861	пропасть	Последний раз мы виделись шесть лет назад во время нашей экспедиции в Улучурскую пропасть под Чимкентом.	пропасть	про+пасть
862	пропасть	Но я чувствую что-то, какой-то зов крови меня будто толкает на самоуничтожение, в пропасть, в дыру черную.	пропасть	про+пасть
863	пропасть	Во все время путешествия племянник не расставался с фотоаппаратом, на всю жизнь удовлетворив наивный фотографический туристский зуд, нащелкал пропасть пленок, которые осенью и проявлял самостоятельно в фотоуголке дядюшкиной коммуналки...	пропасть	про+пасть
864	пропасть	Иногда камни осыпаются и падают в пропасть, а мы ползем по этим камням над пропастью, где течет бешеная река.	пропасть	про+пасть
865	пропасть	Незнакомая, но отнюдь не пугающая апатия уже целиком завладела его духом и телом, и он не хотел ей противиться, хотя понимал, в какую пропасть ведет его безволие, растущее в душе, будто поганый гриб.	пропасть	про+пасть
866	пропасть	У меня, помимо латыни, была пропасть своих забот и интересов.	пропасть	про+пасть
867	пропасть	И ведь всякий раз они увлекают за собой в пропасть и ближних, и дальних.	пропасть	про+пасть
868	пропасть	В первый раз сбросили ему теплую одежду и продукты, все улетело в пропасть.	пропасть	про+пасть
869	пропасть	Нас часто упрекают в том, что между модой и продукцией, выпускаемой промышленностью, лежит глубокая пропасть.	пропасть	про+пасть
870	пропасть	Конечно, государство не даст детям пропасть, в случае чего поддержит.	пропасть	про+пасть
871	пропасть	С трех сторон скала, с четвертой – пропасть...	пропасть	про+пасть
872	пропасть	Дней, – несущихся в пропасть коней...	пропасть	про+пасть
873	пропасть	Там, за спиной – пропасть, разруха и безнадёжное нищенство.	пропасть	про+пасть
874	пропасть	Открытие – это всегда скачок, когда между известным и вновь, открывшимся остается еще довольно-таки глубокая пропасть непознанного.	пропасть	про+пасть
875	пропасть	В последнее время на нее напал такой кур – муж канул в командировку, как в пропасть.	пропасть	про+пасть
876	пропасть	Куда такая пропасть? – спросил Юрка, убирая в тумбочку кефир.	пропасть	про+пасть
877	пропасть	Вместе с изваяниями Будд и каменными бабами, упавшими с неба, не помню где, мне всегда приходят на ум танки, которые тут пропали – по одной легенде, Лес их спалил (в нашем музее висит картина: ствол пушки рассыпался искрами, как бенгальская свеча), – по другой, они упали в провал, «в пропасть забвения» – возникшую от выгоревшего торфа пустоту.	пропасть	про+пасть
878	пропасть	Пропасть сколько следов.	Пропасть	про+пасть
