Index	Homograph	Context	TargetWord	Label
1319	пропасть	С этими словами Бурнашова словно острогой пронзило: он вдруг понял, что ему хочется спрятаться, затаиться, чтобы до скончания века пропасть с чужих глаз.	пропасть	пропа+сть
1320	пропасть	Товарищи Семена писали: мертвым его никто не видел, да и не такой он человек, чтоб пропасть, надейтесь, Женя!	пропасть	пропа+сть
1321	пропасть	Всегда ведь как-то нечаянно полагаешься на некую опеку, дескать твоя звезда не даст тебе пропасть.	пропасть	пропа+сть
1322	пропасть	Работа и успех, и деньги, и положение, и вещи, и еще вещи, и новая небрежность к ним, вместе с новой свободой денежных обращений, с укреплением положения и боязливостью, как бы не пошатнулось оно, наслаждение непривычным и страх перед быстрым привыканием, чтобы не увязнуть, не пропасть, когда почему-либо лишишься того, о чем прежде понятия не имел.	пропасть	пропа+сть
1323	пропасть	Господи, помоги ему вырасти, не дай пропасть тем огромным задаткам, которыми он обладает.	пропасть	пропа+сть
1324	пропасть	Очень трудное ощущение – естественное физическое удовольствие – и тоска, что все то может пропасть».	пропасть	пропа+сть
1325	пропасть	Лучше пропасть как собаке…	пропасть	пропа+сть
1326	пропасть	Студент прощается со своими ангелами-хранителями, вдыхает полной грудью морозный воздух и тихо шепчет, имея в виду вообще чиновников: чтобы им всем пропасть!..	пропасть	пропа+сть
1327	пропасть	Блеск чистой её шерсти долго стоит в солнечном воздухе над забором, перед тем как пропасть из глаз навсегда.	пропасть	пропа+сть
1328	пропасть	Потом в спектакле мы показываем, как все это отразилось и видоизменялось в различных формациях исторического процесса – рабовладельческой, феодальной, капиталистической; в мюзикле фоном пойдут сцены из Великой французской революции и картины нашего времени, когда от «ядерного ножа» может пропасть не какой-то отдельный человек, а весь мир целиком, как будто бы трагический смысл, правда?	пропасть	пропа+сть
1329	пропасть	Если дело стоящее, то пропасть не должно, что бы там ни случилось.	пропасть	пропа+сть
1330	пропасть	У него портфель оттягивал руку, но заскочить домой значило уже там пропасть.	пропасть	пропа+сть
1331	пропасть	Как же он может пропасть, если – ЦСУ, всесоюзные конференции, десятки докторских и сотни кандидатских, если сессии ВАСХНИЛ, если даже из космоса снимают площади зерновых?!	пропасть	пропа+сть
1332	пропасть	Напяливаю шапку на голову, застегиваюсь, надеваю перчатки и выхожу (о, радостный миг!) из дверей родного учреждения, которое меня кормит, которое не дает мне пропасть.	пропасть	пропа+сть
1333	пропасть	Ежесекундно дрожать от мысли, что все это может кончиться, что все это может пропасть в один миг, может быть украденным каким-то проходящим поездом, зверь, который и стоит-то на нашей станции всего одну минуту, – это мука!	пропасть	пропа+сть
1334	пропасть	В ту не хочется, эта занята, в третьей можно со скуки пропасть...	пропасть	пропа+сть
1335	пропасть	Не раз и не сто, вдруг среди дня, среди смеха или среди ночкой темноты я, обмирая всем телом, думал об отце и молил, молил все силы, какие лишь есть на белом свете и там, за пределами белого света, в звездной, торжественно-тихой тьме, – молил старушечьими, от бабушки услышанными словами: «Сохрани и оборони, не дай потеряться, истаять, пропасть!	пропасть	пропа+сть
1336	пропасть	Теперь поздно каяться, но можно пропасть ни за что.	пропасть	пропа+сть
1337	пропасть	Нельзя пропасть на родине, Дементий Павлович.	пропасть	пропа+сть
1338	пропасть	Когда чужие кругом, легко пропасть».	пропасть	пропа+сть
1339	пропасть	Я разговору не даю пропасть да на Лизу мою не надивлюсь: и расторопная, и культурная, совсем городская, будто через час на ферму к коровам другой Лизе идти, – каждый бы день, думаю, с генералов начинался.	пропасть	пропа+сть
1340	пропасть	Если еврей обнаруживает готовность рьяно обслуживать власть, ему не дают пропасть.	пропасть	пропа+сть
1341	пропасть	А почему вы должны пропасть, Илья Григорьевич?	пропасть	пропа+сть
1342	пропасть	Иона Овсеич не захотел гадать: если угадаешь, будет еще приятнее, а если не угадаешь – может пропасть все удовольствие.	пропасть	пропа+сть
1343	пропасть	Цены [закупочные] будут повышены, урожай не должен пропасть, уголь подорожает, компенсация для малооплачиваемых будет полная, для высокооплачиваемых – малая, все это будет согласовано с профсоюзом.	пропасть	пропа+сть
1344	пропасть	Родственников у нас за границей нет, и она, не имея специальности, может там среди чужих людей пропасть.	пропасть	пропа+сть
1345	пропасть	Извещение может пропасть.	пропасть	пропа+сть
1346	пропасть	Старое должно было пропасть навек, а с каждым днем яснело и близилось новое.	пропасть	пропа+сть
1347	пропасть	Но, видя, как она занимается, я почему-то был уверен: такие адские усилия не могут пропасть даром!	пропасть	пропа+сть
1348	пропасть	возьмемся за руки, друзья, чтоб не пропасть поодиночке Булат Окуджава	пропасть	пропа+сть
1349	пропасть	Заступаться, защитить, не дать пропасть, чтобы все живое могло жить, а поломанное починилось.	пропасть	пропа+сть
1350	пропасть	Никогда не забываю: коготок увяз, всей птичке пропасть.	пропасть	пропа+сть
1351	пропасть	Там пусть пропадают – у нас никому пропасть не дадут.	пропасть	пропа+сть
1352	пропасть	Думаю, что такое не может пропасть втуне.	пропасть	пропа+сть
1353	пропасть	Все поснимали с себя снаряжение, так что искушению Шефа послать кого-нибудь на разведку суждено было пропасть втуне.	пропасть	пропа+сть
1354	пропасть	Промедление было подобно поражению, так как могли пропасть многие резоны, украшавшие эту задачу.	пропасть	пропа+сть
1355	пропасть	Ибо эта часть Нам всем в потемках не дает пропасть – Она ночной фонарик незадутый.	пропасть	пропа+сть
1356	пропасть	Ведь атомы или молекулы, из которого оно построено, не могут пропасть бесследно?	пропасть	пропа+сть
1357	пропасть	Ах, как хочется верить, что пропасть он может лишь случайно,	пропасть	пропа+сть
1358	пропасть	но ведь случайно пропасть всякий может, так что это не считается...	пропасть	пропа+сть
1359	пропасть	Она смахнула со стола плотненькие, будто бы поляроидные снимки, и они голубиной стайкой взлетели в черноморскую черноту, прежде чем опасть на пляжную гальку или улететь в тартарары, в казарму нечистой силы, где им место, прежде, чем пропасть, растаять в черной сладкой ночи капиталистических джунглей, где и воздух сам – сплошная порнография.	пропасть	пропа+сть
1360	пропасть	Я столько лет отдал этому чуду натуры и истории, и неужели все это может пропасть по велению какого-нибудь «Пренеприятнейшего», вопреки всем смыслам и против выгоды всей нашей страны, даже без определенного мнения руководства?	пропасть	пропа+сть
1361	пропасть	Поневоле шли предки наши в леса-липняки – раздевали красавицу липу: холода заставляли самих одеться, чтоб не пропасть, выжить в месте суровом.	пропасть	пропа+сть
1362	пропасть	А то ведь пропасть можно на этой теперешней планетке.	пропасть	пропа+сть
1363	пропасть	Вот о чем мы говорим: «Господи, все знают, что у него были те или другие недостатки, но я свидетельствую, что не только недостатки были, он был искрой света для меня; и это не может пропасть».	пропасть	пропа+сть
1364	пропасть	У нас, конечно, специальность хорошая, так что нигде не пропасть…	пропасть	пропа+сть
1365	пропасть	Если температура на узле кущения действительно была смертной, пропасть должно было все!	пропасть	пропа+сть
1366	пропасть	Остаться не напасть, да кабы, оставшись, не пропасть.	пропасть	пропа+сть
1367	пропасть	Тетя Оля не даст пропасть.	пропасть	пропа+сть
1368	пропасть	В сутки 23 000, в месяц более полумиллиона – неужели суждено пропасть даром такой вулканической работе?	пропасть	пропа+сть
1369	пропасть	Ее заметили, ей не дадут пропасть.	пропасть	пропа+сть
1370	пропасть	Дак я как немая, только руками к себе прижимаю: с тобой, Фелька, с тобой, не даст матерь тебе пропасть.	пропасть	пропа+сть
1371	пропасть	Тут все разом пропасть могли, со всеми потрохами, и потому Харитина, ушат воды мужу в сараюшку затащив, вновь заперла его там и опять кинулась к родне единственной: к сестрице Марьице да Федору Ипатычу:	пропасть	пропа+сть
1372	пропасть	Понимаю, может пропасть квартира?	пропасть	пропа+сть
1373	пропасть	И, уже вернувшись, не то чтобы понял – понимал и раньше, а шкурой чувствовал, что смертен и мог пропасть ни за понюшку табаку.	пропасть	пропа+сть
1374	пропасть	Главное, чтоб не зря пропасть.	пропасть	пропа+сть
1375	пропасть	Вообще он мне часто говорил, как важны воспоминания очевидцев, пускай в рукописях, без надежды напечатать: это та правда времени, которая не должна пропасть.	пропасть	пропа+сть
1376	пропасть	Что бы ни произошло, как бы ни повернулись события, это всегда богатство, это не должно пропасть.	пропасть	пропа+сть
1377	пропасть	Надо обязательно переписать папины письма, иначе они могут пропасть.	пропасть	пропа+сть
1378	пропасть	И когда я начала окончательную печать результатов, он мне сделал остановку машины, а я сразу не сообразила, куда надо передать управление, дабы осуществить печать важных для меня функций в неискаженном виде – мог пропасть результат 2,5 часового непрерывного счета, я была настолько взвинчена, что со мною случился нервный припадок – я стояла скорчившись возле этой машины и беззвучно рыдая – и в эту-то секунду вошел Алексанян – вот стыд-то!	пропасть	пропа+сть
1379	пропасть	Этот Пленум дал народу надежду, что кончится дикий произвол, царивший в стране и создававший у всех неуверенность: то ли будет человек жить, то ли может быть уничтожен либо просто бесследно пропасть.	пропасть	пропа+сть
1380	пропасть	Но путь человека, если он должен оставаться человеком, поэзия, пожирающий огонь, в котором человеку всего проще пропасть, обезумев среди зеркал вечного оборотничества.	пропасть	пропа+сть
1381	пропасть	На строительство павильона концерн израсходовал более 1 миллиарда иен, но, будучи организацией чисто коммерческой, он не может, видимо, позволить этому миллиарду «пропасть».	пропасть	пропа+сть
1382	пропасть	Возьмемся за руки, друзья, Чтоб не пропасть поодиночке…	пропасть	пропа+сть
1383	пропасть	Оказалось, что от долгого употребления, от дорожной тряски или других причин слои расклеились, окись урана осыпалась, и эффект, естественно, не мог не пропасть.	пропасть	пропа+сть
1384	пропасть	А у него вся чародейская сила пропасть может, если он человеческую жизнь погубит.	пропасть	пропа+сть
1385	пропасть	Некий то ли Кузяков, то ли Пузяков, не желая пропасть бесследно, неразборчиво намазал свою фамилию дерьмом, впоследствии окаменевшим.	пропасть	пропа+сть
1386	пропасть	Вы уже много сделали, у вас имя есть, как же так вы можете пропасть?	пропасть	пропа+сть
1387	пропасть	Колодец должен пропасть, исчезнуть с лица земли!	пропасть	пропа+сть
1388	пропасть	Не позволяй остынуть и пропасть огню его любви осенней.	пропасть	пропа+сть
1389	пропасть	Ничего Не может пропасть.	пропасть	пропа+сть
1390	пропасть	И зачем она парню, который одержим идеей жить и пропасть на воде?!	пропасть	пропа+сть
1391	пропасть	Хорошо, дров много и топор с собой смекнул захватить, а то взопрелому человеку и пропасть – раз плюнуть.	пропасть	пропа+сть
1392	пропасть	Не дадим мы имя и Васене пропасть, последнюю крошку разделим.	пропасть	пропа+сть
1393	пропасть	В войну больные никому не нужны – пропасть можно.	пропасть	пропа+сть
1394	пропасть	Если одному, то и пропасть можно, а тут еще голодный и в дорожной котомке только шесть вареных картошин.	пропасть	пропа+сть
1395	пропасть	А без всякой помощи можно совсем пропасть.	пропасть	пропа+сть
1396	пропасть	Коготок увяз – всей птичке пропасть.	пропасть	пропа+сть
1397	пропасть	Снова начала уплывать из-под него табуретка, но он прихватил ее руками, сжав, не дал пропасть.	пропасть	пропа+сть
1398	пропасть	И вот пришлось это делать сейчас, в самое хмурое время, потому что нельзя откладывать до тепла – запросто может все пропасть.	пропасть	пропа+сть
1399	пропасть	Коготок увяз – всей птичке пропасть».	пропасть	пропа+сть
1400	пропасть	Задержанный тяжело поднялся и пошел за Трофимовым; в штабной землянке он сразу сел; он ждал, пока Трофимов осмотрит его имущество, и с трудом удерживался от дремоты, и все-таки временами дремал; в полусне он думал о том, как это здорово, что его нашли наконец, в проклятых лесах можно было вообще пропасть.	пропасть	пропа+сть
1401	пропасть	Я говорю: мы не пропадем, а человек может пропасть.	пропасть	пропа+сть
1402	пропасть	А то им и пропасть недолго.	пропасть	пропа+сть
1403	пропасть	Конечно, оно могло и пропасть, и еще не дойти; но первое-то ноябрьское ты ведь получил, а телеграммы так и не было.	пропасть	пропа+сть
1404	пропасть	Не успела она пропасть, как ты ее нашел!	пропасть	пропа+сть
1405	пропасть	А мог пропасть.	пропасть	пропа+сть
1406	пропасть	У него теперь было только одно желание: исчезнуть куда-нибудь, пропасть, чтобы навсегда все забыли, что есть на свете Сократик.	пропасть	пропа+сть
1407	пропасть	Я уезжала из Ялты нищая, голодная, но ведь у меня была надежда добраться до Парижа, с головой уйти в живопись, доказать себе, на что я способна, – словом, не пропасть постыдно, задаром.	пропасть	пропа+сть
1408	пропасть	Стоило одним перчаткам пропасть – завтра же все позамкнулись!	пропасть	пропа+сть
1409	пропасть	Мне хочется сбежать куда-нибудь и пропасть навсегда.	пропасть	пропа+сть
1410	пропасть	Мы с нею знаем и помним, что она убита, но говорить об этом нам нельзя, чтоб ей не пропасть от меня совсем.	пропасть	пропа+сть
1411	пропасть	Ты можешь пропасть… как камень, брошенный в море.	пропасть	пропа+сть
1412	пропасть	Тут, на этой грани, важно одно: не пропасть, не раствориться в бороздах поля, не породниться с хлопком, не отождествить себя с долларовой бумажкой, полученной за труды.	пропасть	пропа+сть
1413	пропасть	И все это время Борис изводился еще и потому, между прочим, что могло что-нибудь пропасть, а вся полнота материальной ответственности лежала на нем лично.	пропасть	пропа+сть
1414	пропасть	Как может пропасть так бесследно такая напряженная и так много значившая человеческая жизнь?	пропасть	пропа+сть
1415	пропасть	Но в нем, десятилетнем человеке, Щербатов чувствовал жизнеспособность и силу, которые не дадут ему пропасть.	пропасть	пропа+сть
1416	пропасть	Вот уж чему не пропасть...	пропасть	пропа+сть
1417	пропасть	Мне чертовски хотелось стать мышью и, незамеченной, юркнуть куда-нибудь, забиться и пропасть, потому что, улыбаясь глупо, я понял по голосам людей, по нескрываемой женской нежности и открытости души, что идут ко мне, в мохнатые эти шалаши, влюбленные.	пропасть	пропа+сть
1418	пропасть	Одной с ребенком и пропасть недолго...	пропасть	пропа+сть
