Index	Homograph	Context	TargetWord	Label
400	пропасть	Собственно, они и в «свой» театр ходили отнюдь не каждый день, главным образом на премьеры и представления особого рода, к дате возникновения труппы, трехсотый там «Час пик» или пятисотые «Антимиры» и тому подобное, Ира, посещавшая рядовые спектакли да еще по многу раз, была исключением, и что больше всего ее отличало, она ходила и в другие театры, не все, конечно, самые одиозные пропускала, но бывала даже во МХАТе, который любимовские поклонники дружно презирали за исключением одного или двух спектаклей со Смоктуновским, и в Вахтанговском, который на Таганке, а вернее, около нее просто игнорировали, естественно, в вошедшем не так давно в моду Ленкоме, не говоря уже о «Современнике» или Малой Бронной, где тогда работал Эфрос, ведь надо было иметь возможность сравнивать, более того, она посещала Большой театр, в основном, балет, поскольку не признавала иную оперу, кроме итальянской, но и тем потрясала до основания души обретенных на Таганке приятелей и приятельниц, которым воображаемая пропасть между драматическим и музыкальным театром виделась чем-то вроде Большого каньона.	пропасть	про+пасть
401	пропасть	Сейчас же ситуация оставляет желать лучшего: все телеканалы находятся под цензурным прессом – отсюда пропасть между картинкой на голубом экране и реальной жизнью.	пропасть	про+пасть
402	пропасть	Тьфу, пропасть! – в сердцах воскликнула Галя.	пропасть	про+пасть
403	пропасть	Сквозь неустранимый шип и треск, щелчки, сквозь какую-то странную акустическую пропасть до нас доносятся звуки сонаты, как лунный свет через рваные тучи, как свет, но не от лампочки, затуманенной сигаретным дымом, а свет и звук космические из какого-то невообразимого далёка, как вечное «прости прощай», как знаменитый «дольный луг» из томасманновского «Доктора Фаустуса».	пропасть	про+пасть
404	пропасть	Какая бездонная пропасть: «оплодотворил и ушел» и «выносить, родить, вскормить, вырастить».	пропасть	про+пасть
405	пропасть	Не забегаем ли мы слишком вперед в неизменном стремлении заглянуть в пропасть?	пропасть	про+пасть
406	пропасть	Одним словом, историческое сознание – это духовный мост, переброшенный через пропасть времен, – мост, ведущий человека из прошлого в грядущее» (Барг 1987: 24).	пропасть	про+пасть
407	пропасть	Очень часто они страдают от ночных кошмаров, преследуемые чудовищами (нередко – в запутанных лабиринтах) или падая в пропасть.	пропасть	про+пасть
408	пропасть	Насколько большая пропасть между первым и последним проектом?	пропасть	про+пасть
409	пропасть	В Перу автобус с пассажирами падает в пропасть – это есть безусловный повод создать «событие» для жителей страны, быть может, – для жителей Латинской Америки, иногда – для американского или европейского потребителя новостей.	пропасть	про+пасть
410	пропасть	Причем, как бы я ни объявил своего героя, передо мной тотчас образуется пропасть, – ведь любой в состоянии примерить эти данные кому угодно!	пропасть	про+пасть
411	пропасть	Не теряйте отчаяния, уже давно говорю я, для того, кто потеряет отчаяние, только один путь: пропасть.	пропасть	про+пасть
412	пропасть	Тем самым своими действиями «партия власти» сталкивает всё общество в пропасть.	пропасть	про+пасть
413	пропасть	Вульгаризируя мысли Ницше и его верного (единственного подлинного) ученика, можно сказать, что «философы жизни» возрастание и угасание непобедимого человеческого духа, его свершения и падения делили на две стадии (между которыми – гибельная пропасть): от зарождения до расцвета – культура, от расцвета до гибели – цивилизация.	пропасть	про+пасть
414	пропасть	Пропасть, разделяющая солдата из крепостных и офицера из феодалов, в Испании не ощущалась так остро, как в других европейских странах.	Пропасть	про+пасть
415	пропасть	А финансовая пропасть, как верно заметил Остап Бендер, самая глубокая мире, ибо в нее можно падать всю жизнь.	пропасть	про+пасть
416	пропасть	После того как в 1998 году пост премьер-министра ненадолго занял 68-летний бывший советский шпион Евгений Примаков, Ходорковский быстро установил с ним хорошие рабочие отношения несмотря на то, что их разделяла пропасть возраста и жизненного опыта.	пропасть	про+пасть
417	пропасть	И далее Тарле пишет о: «спасительной мысли (Кутузова) о грозном контрнаступлении, которое низринет агрессора с его армией в пропасть».	пропасть	про+пасть
418	пропасть	И в том, и в другом случае пропасть между властью и обществом будет только расширяться.	пропасть	про+пасть
419	пропасть	Однако между этикой провозглашенной и этикой, воплощаемой в жизнь, может лежать целая пропасть.	пропасть	про+пасть
420	пропасть	Один из примеров такого вмешательства, предусмотренного законопроектами, когда муниципалитет или субъект Федерации явно катится в финансовую пропасть.	пропасть	про+пасть
421	пропасть	Примите от нашей газеты пожелания в адрес компартии, ее союзников и избирателей: наконец остановить падение России в пропасть горбачевско-ельцинско-путинских «реформ».	пропасть	про+пасть
422	пропасть	Однажды я проделала нечто подобное со своим новорожденным сыном и увидела панику на его лице, увидела, как быстро и беспорядочно задвигались его крохотные конечности – он летел в пропасть.	пропасть	про+пасть
423	пропасть	П.П. почувствовал, что сердце упало куда-то в пропасть.	пропасть	про+пасть
424	пропасть	На глазах у своих товарищей он свалился в пропасть глубиной в тысячу футов.	пропасть	про+пасть
425	пропасть	Вот и нашлось, за что зацепиться, чтоб не ухнуть в пропасть.	пропасть	про+пасть
426	пропасть	За год в Израиле выходит на русском языке уйма альманахов, три толстых литературных журнала и несколько потоньше, чертова пропасть газет и сотни, сотни книг…	пропасть	про+пасть
427	пропасть	Но нельзя перепрыгнуть пропасть в два приема.	пропасть	про+пасть
428	пропасть	Сосед справа, удерживая панамой длинные седые волосы, громко кричит что-то про раскроенные трещинами диабазы, а она всякий раз, как машина подъезжает к внешнему краю дороги, закрывает глаза и сжимает пальцы в кулак, чтобы не дать кольцам соскользнуть в пропасть.	пропасть	про+пасть
429	пропасть	Формировался этот субэтнос со времен Петровской реформы, отделившей европейски образованный слой от простонародья, и в лагере эта пропасть сохранилась.	пропасть	про+пасть
430	пропасть	Солженицын присоединился к тем, кто «патриотически» заталкивает Россию глубже в пропасть, из которой она и без того не делает достаточных усилий выбраться.	пропасть	про+пасть
431	пропасть	Короче, между городом и деревней разверзлась огромная пропасть.	пропасть	про+пасть
432	пропасть	В обмен на выход из войны, передачу Советскому Союзу никелевых рудников под Печенгой и удар в спину германским «братьям по оружию» Финляндия относительно удачно соскочила с несущегося в пропасть гитлеровского поезда.	пропасть	про+пасть
433	пропасть	Начиная с непосредственного преемника – князя Ярополка I Окаянного, погубившего своих братьев Бориса и Глеба, – все без исключения вожди нашей нации совершили за свою жизнь такую пропасть недоброкачественных поступков и прямых преступлений, что невольно приходишь к выводу: отправление высшей власти отрицает обыкновенную порядочность и мораль.	пропасть	про+пасть
434	пропасть	И я стоял и смотрел на вас, как высший жених, ощущая трепетную победоносность в своих членах и истинную прекрасную жизнь во всем, что есть собственно «я», и я напрягся, и готов был перелететь через пропасть перед собой и через берег, и покрыть вас, и быть с вами,	пропасть	про+пасть
435	пропасть	Ибо преподала Европе, готовой ринуться в ту же пропасть, как бы урок от противного:	пропасть	про+пасть
436	пропасть	Мы последовательно меняли слова-паразиты от резкого «значит» через «на самом деле» до «как бы», каждый раз подчеркивая, что между означаемым и означающим лежит пропасть.	пропасть	про+пасть
437	пропасть	Между языками разных возрастных, профессиональных и социальных групп иногда пролегает настоящая пропасть, и в связи с этим вспоминается ситуация из романа В. Пелевина «Чапаев и Пустота» (о Ницше): «Там, сука, витиевато написано, чтоб нормальный человек не понял, но все по уму.	пропасть	про+пасть
438	пропасть	Последние экономические начинания правительства ударили почти по всем слоям общества – от учителей и врачей до бизнесменов, – а постоянный поток информации, свидетельствующий о росте коррупционного беспредела на фоне разрушения остатков советской системы образования и здравоохранения, а также науки, армии и проч., позволяет некоторым впечатлительным комментаторам говорить о том, что «Россия катится в пропасть».	пропасть	про+пасть
439	пропасть	Это та пропасть, которая заставляет большинство россиян, выслушав речи о якобы их положении, пожав плечами, возвращаться к реальности».	пропасть	про+пасть
440	пропасть	Никогда, пожалуй, в истории России пропасть между сверхбогатыми олигархами и обитателями социального дна, в которых превратились, по сути, педагоги и врачи, студенты и пенсионеры, подавляющее число тружеников в промышленности и сельском хозяйстве, не была столь глубокой, как сегодня.	пропасть	про+пасть
441	пропасть	Но тогда Вы постигли бы пропасть, в которую я вот-вот упаду.	пропасть	про+пасть
442	пропасть	На сцене были и Альпы, и пропасть, на краю которой стояла деревянная избушка.	пропасть	про+пасть
443	пропасть	По мере того как расстояние от стенки к стенке в сотнях, тысячах пройденных шагов все нарастало, в душе Полушкиной Иры образовывалась пропасть.	пропасть	про+пасть
444	пропасть	Далекий край этого пространства внезапно отделяется глубокой трещиной и бесшумно падает в пропасть, увлекая за собой все, что на нем находилось.	пропасть	про+пасть
445	пропасть	Лейтмотивом публичных споров 1990-х годов – еще начиная с периода перестройки – стал вопрос, как лучше «перешагивать пропасть»: в один или в два «прыжка».	пропасть	про+пасть
446	пропасть	Расширяющаяся пропасть между представителями высшего менеджмента и остальными имеющими работу американцами, – пишет Рифкин, – создает глубоко поляризированную Америку, в которой небольшая космополитическая элита живет среди беднеющих трудящихся и безработных.	пропасть	про+пасть
447	пропасть	И пропасть в качестве обучения и количестве преподаваемых знаний!	пропасть	про+пасть
448	пропасть	Он долго падал в бездонную пропасть, и в ушах у него звенело, и шумело в голове, и было как-то знобко, как будто в жарком здании гуляет свирепая метель.	пропасть	про+пасть
449	пропасть	Тем не менее в последнее десятилетие социально-политическая доктрина РПЦ сумела срезонировать на постсоветское состояние массового сознания, хотя между ними пролегает пропасть принципиальных различий.	пропасть	про+пасть
450	пропасть	Коммунистические методы хозяйствования завели село в пропасть.	пропасть	про+пасть
451	пропасть	Это не только зияющая на карте азиатская свобода, но и лирический всплеск, окошко счастья, ласковая пропасть, отзывчивая бездна, сияющее дно волшебной шахты.	пропасть	про+пасть
452	пропасть	Но достаточно легкой размолвки, и каждый видит пропасть под ногами, каждый чувствует глубокое одиночество.	пропасть	про+пасть
453	пропасть	И он будет абсолютно прав, ибо «Дорожная карта» не даёт ни единого намёка на то, как эти вопросы, подлежащие рассмотрению на заключительном этапе, могут быть разрешены, потому что её авторы прекрасно понимают, что в этих вопросах арабов и евреев разделяет пропасть.	пропасть	про+пасть
454	пропасть	Театр катится в пропасть по коммерческим рельсам.	пропасть	про+пасть
455	пропасть	Его погоня за красавицей Дуней была именно последней надеждой на возврат к сладострастию – но Дунин отказ окончательно толкает его в пропасть разврата, о чем он узнает из своих последних сновидений о пятилетней девочке – жертве и совратительнице; тогда остается самоубийство.	пропасть	про+пасть
456	пропасть	А что делать – не хватает в обыденном языке определений, способных убедительно выразить пропасть, разверзшуюся внутри еще недавно единого в своей бедности общества.	пропасть	про+пасть
457	пропасть	В юродстве мыслящих воплотился голозадый камаринский мужик, бегущий по улице в никуда, в пропасть зла и отрицания.	пропасть	про+пасть
458	пропасть	Подчас комментарии руководителей районов показывают всю пропасть между отчетно-прогнозными цифрами и реальной жизнью глубинки.	пропасть	про+пасть
459	пропасть	Между старыми и новыми временами – пропасть, мостов возводить мы не собираемся.	пропасть	про+пасть
460	пропасть	Экономика страны бурно развивалась, но вместе с ней росла и пропасть между наживавшими огромные состояния «новыми аргентинцами» и широкими слоями бедного населения.	пропасть	про+пасть
461	пропасть	Какой Горбачев перестройщик, если он сознательно сталкивал страну в пропасть.	пропасть	про+пасть
462	пропасть	НАСКОЛЬКО, по вашему мнению, морально оправданна такая гигантская пропасть, которая разделяет в нашей стране бедных и богатых?	пропасть	про+пасть
463	пропасть	Кто-то жил похуже, кто-то получше, но дело было не в жидком супе и мелком жемчуге, а в общем ощущении дискомфорта: казалось, что все это (политическая система, экономика, страна вообще) кое-как сшито на скорую руку, ненадежно и недееспособно, а потому в любой момент и от любого толчка может ухнуть в пропасть.	пропасть	про+пасть
464	пропасть	Начиная с Возрождения человечество все более последовательно падало в пропасть.	пропасть	про+пасть
465	пропасть	Во-первых, несмотря на подписание очень громкого заявления Германии, Франции и России по поводу Ирака, между Германией и Францией, а тем более между Германией и Россией лежит пропасть.	пропасть	про+пасть
466	пропасть	Не питайте иллюзий – эта власть, безусловно, пытается раздавить всех без исключения несогласных, не слившихся с ней в едином смертельном прыжке в пропасть, название которой – разломанная Россия.	пропасть	про+пасть
467	пропасть	В пропасть его!	пропасть	про+пасть
468	пропасть	В-третьих, мировые соглашения очень часто становятся первым шагом к окончательному примирению сторон, в то время как судебное решение нередко увеличивает пропасть между спорящими сторонами.	пропасть	про+пасть
469	пропасть	Господи, как же далеко нам до маленькой Эстонии, какая пропасть пролегла между нами...	пропасть	про+пасть
470	пропасть	Вы не представляете, какую пропасть в сознании олицетворяет собой Уральский хребет!	пропасть	про+пасть
471	пропасть	Его и на девок хватало – летом их тут пропасть, табуном за ним ходили.	пропасть	про+пасть
