Index	Homograph	Context	TargetWord	Label
183	места	Кроме того, что видимо ещё сложнее, за всю историю существования списка только два места были позднее исключены за разрушение природной или культурной ценности.	места	1
184	места	Два места пустуют.	места	1
185	места	Я же и виновата в том, что у непутехи руки не из того места растут.	места	1
186	места	В целом же в 15 боях, что продолжались три часа, четыре первых места заняли новгородцы.	места	1
187	места	Девушка без затей поведала ему, что ее бабушка уже давно лежит на этом отделении, а теперь ее оформляют в интернат, места ждали полгода.	места	1
188	места	Но особенности места решают не больше половины дела.	места	1
189	места	Отчего для питейного места взяли название единственного штата США, где ещё действует сухой закон, про то знают Бог и Великий князь, но это неважно.	места	1
190	места	И в тот момент, когда кто-то успел залезть в кузов, а кто-то ещё лез по лесенке, машина почему-то тронулась с места, оставшихся двух-трёх человек буквально закинули внутрь.	места	1
191	места	В ландтаге северного региона Шлезвиг-Гольштейн три места приходятся на этническую фракцию датского языкового меньшинства Союз южносилезских избирателей.	места	1
192	места	Вскоре недалеко от нашего места увидели Роберта Рождественского.	места	1
193	места	Несколько баб сорвались с места, бросились к Никифору Фёдоровичу, убивать.	места	1
194	места	Пилоты, занявшие первые три места, поднимаются на подиум.	места	1
195	места	Впрочем, совсем без денег обойтись не удастся и глубокой ночью: вокруг любого пригодного места пасутся личности в кепках, которые на добровольных началах руководят процессом парковки и получают за это небольшую мзду (как правило, около €1).	места	1
196	места	Ежемесячное пособие в 25 рублей от бывшего мужа на болезненную с детства девочку при отсутствии приличного места делали жизнь обоих лишь подобием человеческого существования…	места	1
197	места	В один день гости приносили сладости, которые за неимением места ставили повсюду, даже на пол, отмахиваясь от насекомых, и невозможно было пройти по дому, не вступив в блюдо с лакомством.	места	1
198	места	С другой стороны налегал мужчина с наголо стриженной головой, похожей на литой снаряд, – так мало места занимали на его длинном лице мелкие черты.	места	1
199	места	Вдоль берегов виднелись белые корпуса пансионатов, куда отличившиеся на производстве коштыры получали путёвки, по словам Касымова, за четверть цены, но с той точки, где находилась дача певицы, бросалось в глаза, как мало места занимают люди на водной поверхности, кажется, вовсе не для них предназначенной.	места	1
200	места	По степени строгости присяжных три первые места занимали: а) религиозные преступления, б) кражи, в) убийства и грабежи.	места	1
201	места	В Госдуме тоже пытаются бороться с курением, отвели для этого специальные места, однако сами же депутаты Госдумы, которые должны подавать всем пример (и я в этом полностью согласен с губернатором Пензенской области), постоянно нарушают правила и продолжают курить везде, как и курили.	места	2
202	места	Форумы, блоги, встречи ветеранов семнадцатого загона, легенды о Неуловимой и байки о Неуловимом, памятные места.	места	2
203	места	и где они такие места находят?	места	2
204	места	Всеми способами вернуть все на свои места, вернуть их материальное благосостояние, вернуть после этого их семью.	места	2
205	места	Отлично подобраны места для съемок, выбран хороший реквизит.	места	2
206	места	И в одну долю секунды вы ощутите отсутствие зонтика, прокрутите в голове все места, где побывали – работа, кафе, одно место, у приятелей, такси, – и не сможете вспомнить, где оставили зонтик, и успеете расстроиться, потому что именно этот зонтик вам особенно дорог, и все в одну долю секунды.	места	2
207	места	Впрочем, если вы устали и хотите отдохнуть, у нас тут есть такие места, ну вроде кафе, ресторанчиков.	места	2
208	места	Сознайтесь, что занимаетесь доставкой грузов в труднодоступные места и деньгу за это заколачиваете!	места	2
209	места	Соответствующие земельные участки зачастую превращаются в места отдыха, пребывания на природе, а для наиболее обеспеченных слоев – в способ вложения средств за счет их превращения в недвижимость посредством строительства дач и загородных коттеджей.	места	2
210	места	Оба медалисты, поступили на бюджетные места в хорошем ВУЗе, сейчас оба катятся в аспирантуру.	места	2
211	места	"Природа – носитель всех тайн бытия, ей почти всегда отведено самостоятельное место в картинах режиссера, или пушкинские места из фильма ""Храни меня, мой талисман "" – не то ландшафт, не то классическая литература в живом воплощении; или бессловесная животина Каштанка из принадлежащей ему экранизации чеховского рассказа, – все это большие и малые ""иные величины "", сопряженные с вечностью, в соприкосновении с которыми проявляются разные грани изменчивой человеческой природы."	места	2
212	места	Места за столом, сначала занятые родственниками невесты, выкупались дружкой, предварительно рядившимся с невестиной родней.	Места	2
213	места	Действительно, демографическое развитие России без значительной миграции в будущем может означать незаполненные рабочие места, сокращение предоставляемых услуг, снижение производства и, возможно, стагнацию общества.	места	2
214	места	Если такую крошку насыпать на фон будущей картины в необходимые места и прогладить через кальку, то крошка, которая окажется клеевой стороной на фоне, приклеится к нему, не запачкав фон клеем.	места	2
215	места	Предусмотрены места под установку магнитолы и четырех динамиков, а вот одежду повесить некуда – крючков на задней стенке нет.	места	2
216	места	"Но она пересекается с другими идеями, которые занимают в отечественной иерархии понятий более почетные места: литература рассматривается как ""учебник жизни "", как источник моральных ценностей, как способ передачи из поколения в поколение некоего ""национального мироощущения ""."	места	2
217	места	Бизнес-слой создает рабочие места для представителей других социальноэкономических групп, однако среди них в наиболее выгодном положении оказываются управленцы и работники преимущественно умственного труда.	места	2
218	места	Таким образом, наше государство поддерживает своего производителя, обеспечивает ему выход на внешние рынки, создает рабочие места...	места	2
219	места	Малый бизнес развивается, кормит себя и создает рабочие места.	места	2
220	места	Почему тогда громадная армия российских и легальных чеченских силовых структур не могут эту кучку отловить, уже десять лет зная этих отморозков в лицо, зная их повадки, места обитания, бизнесинтересы, размещение семей?	места	2
221	места	Чтобы привлечь интерес зрителей к Евротуру, который пока остается без должного внимания со стороны спонсоров и телевидения, решено со следующего сезона после окончания четырех этапов проводить суперфинал между сборными, занявшими первое и второе места, победитель которого становится чемпионом Европы и получает золотые медали, третья и четвертая команда тем временем поспорят за бронзовые награды.	места	2
222	места	Впрочем, возможно, власть (и в первую очередь Кремль) предложит генералу и иные места работы.	места	2
223	места	После «боя» специалисты на вертолете облетели места попаданий, замеряя точность и выставляя оценки.	места	2
224	места	Практически все очитки любят хорошо дренированную почву и открытые солнечные места.	места	2
225	места	В саду эта полынь предпочитает открытые места, но высаживать ее желательно подальше от гвоздик, георгинов, бобовых.	места	2
226	места	Темные места	места	2
227	места	От того, как будут соотноситься между собой места перевязки отдельных пучков (будут ли они располагаться строго друг над другом, в шахматном порядке, случайным образом или как-нибудь еще), во многом зависит вид готового изделия, его текстура (рис. 1).	места	2
228	места	Понятно, что и первого января можно пойти в гости, и могут позвать в разные места, и опять же необходимо выбрать, но и этот выбор оказывается лишен той предновогодней привлекательности.	места	2
229	места	Доходная часть бюджета фонда складывается от арендной оплаты за торговые места на рынках.	места	2
230	места	"В итоге самый титулованный клуб России со скандалом расстался со своим многолетним наставником Олегом Романцевым, а в турнирной таблице делит места с провинциальными "" Ростовом "", "" Ураланом ""и "" Ротором ""."	места	2
231	места	Менялись названия полков и места службы, шло продвижение вперед по карьерной лестнице примерного офицера, который не имел возможности отличиться в боевых действиях.	места	2
232	места	Зарезервировать места в правительстве	места	2
233	места	"Будет ли поражение ""Единой России "" в борьбе с коммунистами за места в Думе означать закрытие проекта?"	места	2
234	места	"Сегодня многое указывает на то, что дела у партии власти пойдут плохо, и, возможно, к осени станет ясно, что с коммунистами за места в Думе "" Единая Россия ""соперничать не сможет."	места	2
235	места	Ученый называет венедов среди «больших народов» Сарматии и определенно связывает места их поселений с бассейном Вислы.	места	2
236	места	В скобках отмечу, что есть другие исследования, по которым здоровье и социальные проблемы занимают высокие места, но их опережает юмор, а близкий рейтинг имеют политика и экономика)	места	2
237	места	Мы ездили на международные чемпионаты в Прибалтику, где занимали первые места.	места	2
238	места	Какие у вас самые любимые места в Санкт-Петербурге?	места	2
239	места	Так, шаг за шагом, проводится нелегкая работа по созданию нормальных условий по возвращению беженцев на прежние места проживания.	места	2
240	места	В силу особо высокой жесткости пород данной провинции землетрясения в этой области не происходили и отступали на периферию, например в нынешние Калифорнию, Мексику, Никарагуа и в другие места сейсмического пояса.	места	2
241	места	"Двое пятиклассников из средней школы N 7 станицы Орджоникидзевской – Арби Гудиев и Алексей Антоненко заняли первые места в номинации ""Юные Кулибины ""."	места	2
242	места	Вместо того, чтобы обновлять производственные мощности, создавать рабочие места, помогать бедным, мы из скудного бюджета России платим Чечне.	места	2
243	места	Третьи места заняли и Елена Сташкевич из Волжска у девушек, Светлана Бочкарева (МарГУ) – среди юниорок.	места	2
244	места	Чтобы грязь не набивалась в эти места, я опробовал на разных автомобилях следующий рецепт.	места	2
245	места	Если на участке есть естественные возвышенности или склоны, то именно эти места наиболее подходящие для возведения альпинария.	места	2
246	места	МЕСТА ЕЩЕ ЕСТЬ!	МЕСТА	2
247	места	Анаэробы (бактерии, живущие при отсутствии кислорода), проникают в места повреждения, раны, распадающиеся опухоли – возникают гнойно-воспалительные очаги.	места	2
248	места	Справа: часы-браслет из белого золота, корпус и места соединения с браслетом щедро декорированы бриллиантами.	места	2
249	места	Суперклубы, которые все считали фаворитами, уступили свои законные места в плей-офф солидным, но куда менее звездным соперникам.	места	2
250	места	А в какой-то момент просто все встало на свои места.	места	2
251	места	Первый раз призовые места нижегородские зодчие заняли в 1995 году, не уступили звания лучших и теперь...	места	2
252	места	Миниатюрные спиреи и барбарис, можжевельник казацкий, папоротники, астильба, барвинок, живучка ползучая, камнеломки и седумы, быстро разрастаясь, заполнили свободные места, частично маскируя валуны и пни.	места	2
253	места	Конечно, есть в Европе места с более интересной архитектурой и с каналами почище, но сюда приезжают за особенным ощущением свободы и раскрепощенности.	места	2
254	места	Не очень удобные места в ложе для прессы не позволили разглядеть очередность касания.	места	2
255	места	Их усилиями в активе российской сборной оказались места: третье, два четвертых, пятое и два шестых.	места	2
256	места	Зато было любопытно, проиграет ли наша сборная хотя бы один матч, а также – кто займет в Бледе второе и третье места.	места	2
257	места	Матч Россия-Португалия решал, какие места эти команды займут в своей группе.	места	2
258	места	На этапах Кубка мира вы стабильно занимаете места в десятке сильнейших.	места	2
259	места	Под занавес сезона Грин и вовсе стал занимать четвертые-шестые места и предпочел не позориться, приехав в Париж только в качестве зрителя.	места	2
260	места	В то же время появляются претенденты на эти места.	места	2
261	места	Они прошли на свои места и сели рядом.	места	2
262	места	Места в своих отделах Аверину по старой дружбе предложили знакомые по институту Борисевич и Багаев.	Места	2
263	места	Теперь в ее шести обновленных комнатах заняли свои места документы и вещи пушкинской эпохи.	места	2
264	места	При этом спальные места обрастают столиками, светильниками, спинками, полками – причем все двигается, регулируется и может существовать отдельно.	места	2
265	места	Что же касается легкомыслия – неопытные сноубордисты частенько лезут в самые неподходящие места, осложняя жизнь и себе, и другим.	места	2
266	места	"А сразу после захвата ДК в прямом эфире первого канала продюсер мюзикла ""Норд-Ост "" Александр Цекало (возможно, пребывая в состоянии шока, а возможно, просто не подумав о последствиях) в подробностях описал схему здания и места, откуда группы захвата могут проникнуть в осажденный ДК не замеченными террористами."	места	2
267	места	Занял соответственно третье и первое места.	места	2
268	места	Памятные места Китая.	места	2
269	места	Она создает высококвалифицированные рабочие места, люди платят налоги, получают возможность образования, появляются хорошие менеджеры.	места	2
270	места	Но попасть им следовало именно в эти нанесенные на карту места.	места	2
271	места	А в эпоху Возрождения эти места открыл для себя королевский двор – и по обоим берегам Луары стали расти как грибы королевские резиденции.	места	2
272	места	Эти же места породили ценности другого толка: кто не слыхал о легендарных мозельском и рейнском!	места	2
273	места	У меня, правда, было желание изъять из писем места, в которых Лидия Корнеевна непомерно хвалит мое редакторское участие в создании книги, но я все же не сделал этого, не по нескромности и желанию выпятить свой вклад в книгу, а потому, что сегодня, когда роль редактора во многих издательствах сведена на нет или низведена до мелочной опеки автора, пример удачного сотрудничества редактора и автора, причем автора требовательного, приобретает поучительный смысл.	места	2
274	места	Он пришел в суетливое муравьиное движение, вынуждая охранников занять свои места у цинковой ложбины, а Алешку с Пал Палычем – отправиться за телом.	места	2
