Index	Homograph	Context	TargetWord	Label
84	слова	Нет, Дима не умеет читать мыслей, но чувствует их, поэтому, хотя и не сказала Эльвира ни слова на протяжении всего пути, ему кажется, что они много и хорошо говорили, он ведь, как и она, беспрерывно менял мысли, хотя и не понимал, о чем думает, свое дыхание он тоже ведь чувствует -- и не только дыхание, он с точностью до удара в минуту знает всегда, какое у него сердцебиенье, он видит, какими становятся его глаза от того, на синее он смотрит, на желтое или вообще на коричневое, -- и понимает, что эта сверхчувствительность самоощущения, приятная сейчас, может стать для него источником многих тягостных переживаний в старости, -- но старость далеко -- или, скорее всего, -- никогда.	слова	1
85	слова	По утрам они надевали до блеска выглаженные старомодные костюмы, повязывали провинциальные яркие галстуки и уезжали на весь день в низкорослое здание московского ОВИРа, где просиживали бесконечно долгие очереди к самому главному, от слова которого зависело, увидят они или нет троюродного дядю, проживающего в настоящее время в государстве Израиль.	слова	1
86	слова	"Рискуя жизнью, он приютил в своем медпункте старика мусульманина ""лучшего певца Старой Бухары "", совершенно беззащитного, ни слова не знавшего по-русски и уже по одному этому обреченного на гибель."	слова	1
87	слова	Не то чтоб тяжело или больно, а неприятно плотно -- другого слова не скажешь.	слова	1
88	слова	"Есть у нас и другие предки, думал я, вот, например, трипольцы -- не от слова ""Триполи "", а от ""Триполье "", -- которые четыре, что ли, тысячи лет назад занимались земледелием и скотоводством, а в свободное время вырезали из камня маленьких голых баб с очень толстым задом, -- этих баб ""Венер "", как их сейчас называют, осталось очень много -- видно, они были в красном углу каждого дома."	слова	1
89	слова	"В русском словаре Даля слова ""гафт "" нет."	слова	1
90	слова	За все это время он только один раз попросил у меня закурить и больше не сказал ни слова.	слова	1
91	слова	"Слово ""послушание "" от слова ""слушать ""."	слова	1
92	слова	Два слова начертал Петр в последнем своем земном напряжении	слова	1
93	слова	Похоже, что он знал весомость своего слова.	слова	1
94	слова	В общепринятом, житейском смысле слова я еще не стара, но кажется, что жила долго-долго.	слова	1
95	слова	"Если военное "" обмундирование "", как официально именовались одежды отца (от нижнего белья до портянок), все поступало с армейских складов, то гражданские одежды прибывали не из "" домов "" (скажем, с рю Франсуа Премьер или Кузнецкого моста в Москве), но с обширного пыльного поля за городом, называемого "" барахолкой "" (от слова "" барахло "") или "" толкучкой "" (от слова "" толкаться "")."	слова	1
96	слова	Это ленинградское предместье -- со всеми особенностями определяемого и определяющего слова.	слова	1
97	слова	Чурилин без единого слова вышел наружу.	слова	1
98	слова	Помню, как я протягивал к ней деревянные ладони и не мог вымолвить ни слова, и не слышал, о чем, жалко улыбаясь, говорил ей Сысоев.	слова	1
99	слова	Он ничего, решительно ничего не мог сказать, ни одного слова.	слова	1
100	слова	Что хотел сказать мальчик, выписывая без конца эти два слова?	слова	1
101	слова	Значения этого слова мать так и не уяснила.	слова	1
102	слова	Если говорить об особенностях толстовского слова, проявившихся в этом отрывке, то придется отметить его полную конвенциональность: отношение между выражением и содержанием условно.	слова	1
103	слова	А то местные горло дерут, да и нервы горло давят, так что ни слова не скажу.	слова	1
104	слова	Вернувшись в Москву, Юрий, конечно, первым делом отослал деньги телеграфом, в ответ на что получил следующее письмо [письмо -- подлинное, в нем не изменено ни слова, кроме обращения; имя и фамилия шофера Ираклия Пимениди -- подлинные]:	слова	1
105	слова	Тот, что гоняет зайцев, кричит и трубит собаке, а этот не говорит ни слова.	слова	1
106	слова	Слова сказать нельзя.	Слова	1
107	слова	И потом мы видим распятие, видим, как Его убивали медленной смертью и как Он без одного слова упрека отдался на муку.	слова	1
108	слова	То есть он был, конечно, аполитичен в том специальном готтентотском смысле этого слова, когда человек считает справедливым только такой строй, который нуждается в таких людях, как он, выделяет их, пригревает и хорошо оплачивает.	слова	1
109	слова	Впрочем, я уж давно отказался от этого слова.	слова	1
110	слова	У нее было такое лицо, и она так тяжело дышала и так запыхалась, что несколько секунд не могла выговорить ни слова.	слова	1
111	слова	Она лукаво и ласково говорит им на дорожку еще два слова:	слова	1
112	слова	"Американцы не знали русского смысла слова ""рок "", а если бы знали, быть может, это прибавило бы этой музыке не только грохочущих камней, качающихся скал, но и неожиданных провалов в тишину, в беззвучие."	слова	1
113	слова	Я не могу вымолвить ни слова, смотрю на бледное, немного веснушчатое лицо, вижу, как оно улыбается добрыми губами, добрым взглядом близоруких глаз, в которых нет ничего, кроме веселого спокойствия, сочувствия, теплоты -- для всех...	слова	1
114	слова	Наверное, ради этого слова было написано все стихотворение.	слова	1
115	слова	Мать была женщина в полном смысле слова, умела притягивать к себе и в то же время держать на расстоянии -- самое коварное женское качество.	слова	1
116	слова	Дайте мне сказать ему два слова!	слова	1
117	слова	Ты же мне слова не даешь воткнуть!	слова	1
118	слова	Никак нельзя Достоевского сделать модным, интересным в более плоском, вульгарном смысле этого слова.	слова	1
119	слова	Он прибежал к машине, запыхавшись, без удочек, перепуганный, и долго не мог произнести ни одного слова.	слова	1
120	слова	Он не пьет, не буянит, сроду никогда грубого слова не сказал.	слова	1
121	слова	Ну, я... мне вас только на два слова.	слова	1
122	слова	Это важный медлительный пятилетний человек, от которого не добьешься лишнего слова.	слова	1
123	слова	Но он так продрог, что не мог вымолвить ни слова.	слова	1
124	слова	Дмитриев рывком вскочил со стула, схватил пижаму и полотенце и, ни слова не говоря, почти выбежал из комнаты.	слова	1
125	слова	Он продолжал что-то говорить, но я ни одного слова не понимал.	слова	1
126	слова	О нем в рассказе ни слова не говорится, -- возразил я.	слова	1
127	слова	Только помнить: ни слова по-английски.	слова	1
128	слова	Если поедешь на свидание, постарайся попросить Надю, чтоб она разыскала Ниночку и обо мне передала ей только три слова, -- (он взглянул на небо): -- любит! преклоняется! боготворит!	слова	1
129	слова	Они слова не могут сказать без преувеличения.	слова	1
130	слова	Встреча случилась в глубинах сердца, ожившего от этого слова животворного.	слова	1
131	слова	Если вас эти условия не устраивают, скажите только два слова, и я вас немедленно освобожу.	слова	1
132	слова	Но слова не сказал и милости не просил.	слова	1
133	слова	Ни в одном из английских словарей еще не было этого слова.	слова	1
134	слова	"Ну, так вот, Юра, в общем довольно хорошо говоривший по-русски, никак не мог научиться отличать слово ""понос "" от слова ""насморк ""."	слова	1
135	слова	Слова из нее не вышибешь.	Слова	1
136	слова	По-русски она... вот два слова... два слова!	слова	1
137	слова	А как проговоришь с ним десяток минут -- видишь, что он полный Профан и Невежда -- (оба слова с большой буквы).	слова	1
138	слова	Мадам Смерть молчала, за все время обыска она не произнесла ни слова.	слова	1
139	слова	А внизу, под моим окном, бреется лицо свободной профессии -- мастер художественного слова Филипп Громкий.	слова	1
140	слова	Вся 104-я бригада видела, как уводили Шухова, но никто слова не сказал: ни к чему, да и что скажешь?	слова	1
141	слова	Ни слова он не сказал об этом Чуйкову.	слова	1
142	слова	Сами себе внушили, что от каждого смелого слова государство рухнет.	слова	1
143	слова	Повернется на весну, на победу, он слова критики не скажет.	слова	1
144	слова	В эти приходы он не показался мне тем опирающимся о посох старцем, который вот развалится от толчка или грубого слова.	слова	1
145	слова	Мне, конечно, очень неприятно вспоминать, что говорили о нас с Костей Зинка Фокина и остальные наши товарищи на том собрании, и, несмотря на это, я расскажу все так, как было на самом деле, не искажая ни одного слова и ничего не прибавляя от себя...	слова	1
146	слова	"Иногда даже обитатели уголовной лагерной ""Индии "" просили его слова."	слова	1
147	слова	И значение этого слова впервые открылось ему во всей полноте.	слова	1
148	слова	Ни слова не говоря друг другу, мы побежали к обрыву.	слова	1
149	слова	Катя заволновалась, боясь, что полковник станет подшучивать над ее чувствами к Травкину, но он не проронил об этом ни слова.	слова	1
150	слова	"Таковы три значения слова ""сатира ""."	слова	1
151	слова	Вот Травка, собака гончая, с одного слова все понимает, а вы, глупенькие, спрашиваете, где правда живет.	слова	1
152	слова	И его можно было, пожалуй, назвать даже красивым, если бы не одна неприятная особенность: когда он волновался, его лицо передергивалось быстрой, косой и какой-то молниеподобной -- право, не знаю другого слова -- судорогой; тогда же он начинал заикаться, перескакивать через слова и, зная за собой эту особенность, старался говорить медленно и плавно, нараспев.	слова	1
153	слова	Поэтому по существу вопроса только два слова.	слова	1
154	слова	Весь лист был исписан какими-то цифрами, через каждые два слова шла запятая или восклицательный знак.	слова	1
155	слова	Но только два слова на прощание вам, дорогой господин Мезонье.	слова	1
156	слова	Но, к великому моему огорчению, я понадеялся на свою память и не расшифровал этой записи, а теперь не могу вспомнить ни единого слова.	слова	1
157	слова	"Черкните мне, пожалуйста, два слова о получении сего ""послания "" (а то как-то раз мое письмо у вас в редакции затерялось)."	слова	1
158	слова	Переписка на ваш счет, -- продолжал Рудольфи, а я только кивал головой, как фигурка, -- затем: надо будет вычеркнуть три слова -- на странице первой, семьдесят первой и триста второй.	слова	1
159	слова	Читая самые лестные отзывы об издаваемых книгах, их авторам ни разу он не сказал доброго слова.	слова	1
160	слова	Два слова	слова	1
161	слова	Подражая пастуху, Илья Ефимович блаженно и сладко растягивал эти два слова и зажмуривал от удовольствия глаза.	слова	1
162	слова	Пильщики увидели меня; они остановились, подняв головы и глядя вверх, но не произнося ни слова.	слова	1
163	слова	"Все еще скалясь, прокуратор поглядел на арестованного, затем на солнце, неуклонно подымающееся вверх над конными статуями гипподрома, лежащего далеко внизу направо, и вдруг в какой-то тошной муке подумал о том, что проще всего было бы изгнать с балкона этого странного разбойника, произнеся только два слова: ""Повесить его ""."	слова	1
164	слова	Маргарита слушала Коровьева, стараясь не проронить ни слова, под сердцем у нее было холодно, надежда на счастье кружила ее голову.	слова	1
165	слова	Написано на пакете было не по-нашему, но три слова -- по-русски:	слова	1
166	слова	Оказалось, что в статье Зиновьева нет ни одного, буквально ни одного слова о том, что война стала неизбежной.	слова	1
167	слова	"Называть кино по соседним искусствам столь же бесплодно, как эти искусства называть по кино: живопись -- ""неподвижное кино "", музыка -- ""кино звуков "", литература -- ""кино слова ""."	слова	1
168	слова	Головами люди качают, языками цокают, а про корабль -- ни слова.	слова	1
169	слова	В этой шубе, в шапке с наушниками, в больших тупоносых сапогах, полученных из Кубу (Комиссии по улучшению быта ученых), важный и приветливый Гумилев, обыкновенно окруженный учениками, шел на очередную лекцию в Институт Живого Слова, Дом Искусств, Пролеткульт, Балтфлот и тому подобные учреждения.	Слова	1
170	слова	Я жадно слушал ее, стараясь не проронить ни слова.	слова	1
171	слова	"И это совсем не в смысле ""мрака средневековья "", выдуманного просветителями новой истории, а в более глубоком и онтологическом смысле слова."	слова	1
172	слова	Никогда Розанов не сказал об этой своей жене слова с горечью, с осуждением или возмущением.	слова	1
173	слова	Не сказала больше ни слова, тонкие пальцы перебирали страницы, -- читала стоя, склонив голову.	слова	1
174	слова	Но того слова, которого хотел услышать генерал Краснов, я по совести сказать не мог.	слова	1
175	слова	Спустя глядим: не говоря худого слова, раскрываются ворота и выскакивают лютые сани, в санях барыня Тарантаева с девчонкой, плачет, а уж из ворот и этот выезжает на черной лошади конный, который на барыню, как на собаку, просто кричит:	слова	1
176	слова	Попытки формально определить организованность, как гармонию или соответствие частей между собою и с целым, также не решают вопроса; это просто замена слова «организованность» его синонимами.	слова	1
177	слова	На коленях -- протянула Марею руки, глаза закрыла, губы дрожат, а ни слова.	слова	1
178	слова	Я никогда не чувствовал себя политиком в точном смысле слова.	слова	1
179	слова	Несомненно, в Одессе много безукоризненно-порядочных, даже в северном смысле слова, людей.	слова	1
180	слова	Я дал слово королю быть на месте казни рано утром, а если ты умертвишь меня, то я не в силах буду сдержать моего солдатского слова.	слова	1
181	слова	Но как они ни старались, им не удалось разобрать ни одного слова, несмотря на яркий свет фонаря: они были неграмотны и не умели читать.	слова	1
182	слова	Достаточно бывает иногда неосторожно произнесенного при ребенке слова о совершенном убийстве или каком-либо другом тяжелом происшествии, и ребенок будет уже тревожно спать ночь или даже подвергнется ночному испугу или кошмару.	слова	1
183	слова	Но сегодня наша мысль переносится от этой могилы к колыбели Гончарова, и мы благодарим судьбу, зажегшую на небе русского слова и русской мысли светоч его великого.	слова	1
184	слова	А он, ни слова не ответив, бегом -- и под поезд.	слова	1
185	слова	До Рюмина донеслись четыре слова:	слова	1
186	слова	Понятия и чувства греха, его мучительной тяжести, всесторонности и глубины его влияния на всю человеческую жизнь для русского интеллигента не существует, равно как нет слова более непопулярного в интеллигентской среде, чем смирение, по свидетельству церкви, первой и основной христианской добродетели.	слова	1
187	слова	Пускай Раскольников возбуждает себя злобой и красноречием, но реальный факт после этого слова уже тает.	слова	1
188	слова	Корецкий от своей раны выздоровел и с того времени сделался у Нерягиных, в лучшем смысле слова, «другом дома» и поверенным всех тайн Анны, даже тайн ее любви.	слова	1
189	слова	История этого слова в русской обиходной и литературной речи могла бы составить предмет интересного специального этюда.	слова	1
190	слова	Подходила Агафья к Зайчику Иванычу, щекотала ему малиновый ус, а Зайчик и в ус не дует: мяучит себе по-заячиному, ни слова путного.	слова	1
