Index	Homograph	Context	TargetWord	Label
1	слова	Они тоже люди, некоторые, не побоюсь этого слова, рыцари своей державы.	слова	1
2	слова	"Название ""жиро "" происходит от греческого слова ""guros "" -- круг, кругооборот."	слова	1
3	слова	Они напряженно глядели туда, где стоял сантехник-телепузик, так, словно старались не пропустить ни одного слова.	слова	1
4	слова	Попытаемся не только ответить на эти вопросы, но и выразить свое понимание широко применяемого, хотя и далеко не всегда к месту, слова «информация».	слова	1
5	слова	В лучшем смысле слова -- элита общества.	слова	1
6	слова	На наших глазах происходит коллапс мира печатного слова.	слова	1
7	слова	Значение слова неизвестно.	слова	1
8	слова	Вот смеху-то будет, если за всей игрой стоит Рома, и прокурорские в который раз за него потеют, а думают, что за Родину (в хорошем смысле этого слова).	слова	1
9	слова	Скорее всего для самой известной японки на свете у них не найдется ни единого теплого слова: так велика сила убеждения, только окрепшего со временем, что именно эта женщина стала причиной развала лучшей группы всех времен и народов.	слова	1
10	слова	"Часть проектов направлены на совершенствование внутринаучной психологической культуры, на приращение специальных знаний, на приложение знаний, методов, разработок не к практике в обычном значении слова, а к науке (смежным ее областям, специализациям, т. е. к ""научной практике "")."	слова	1
11	слова	А по небу прокатите нас, облака, -- аккуратно так, почти про себя, спел Волк, но не успел вымолвить последнего слова, как камень, на котором он сидел, вдруг выдернулся из земли -- и поплыл ввысь.	слова	1
12	слова	"Началось с названия POP: оно создавалось как подражание звуку вылетающей пробки, и в то же время это начало слова "" популярность ""."	слова	1
13	слова	Комиссия признала их сырыми, кроме того, не сказала своего слова экологическая экспертиза.	слова	1
14	слова	Ни слова об ответственности и обязанностях.	слова	1
15	слова	Основное отличие амфиболии от рассмотренных приемов двойного истолкования состоит в том, что строятся аналогии между двумя значениями одного и того же слова.	слова	1
16	слова	"Отсюда напрашивается вывод: Интернет, отменив цензуру государственную и ""рыночную "", сам стал своеобразной формой глушения свободного слова."	слова	1
17	слова	Про соответствие федеральным законам там не говорится ни слова.	слова	1
18	слова	В это время происходят серьезные изменения в его фонетике (палатализация согласных, устранение некоторых дифтонгов, изменения в сочетаниях согласных, отпадения согласных в конце слова), эволюционирует грамматический строй.	слова	1
19	слова	Данный стандарт должен определить формат представления данных, независимый от архитектуры, операционной системы или разрядности машинного слова.	слова	1
20	слова	Знаете, когда мы недавно поехали отдыхать, то перед путешествием дали себе твердое слово: во время поездки ни слова о работе -- ни о музыке, ни о медицине.	слова	1
21	слова	Первый номер газеты, который вышел в далеком 1923-м, в подлинном смысле слова был светом для народа, в массе своей неграмотного.	слова	1
22	слова	Процесс над ореховской братвой формально длится, считай, уже полтора года с 6 февраля 2002-го, а киллеры за все это время и слова в суде не промолвили.	слова	1
23	слова	Говорят еще, что Пчельников может в любого зверя оборотиться, что ночью не хуже кошки видит или может невидимым для каждого, кто волшебного слова не знает, стать.	слова	1
24	слова	Хотя справедливости ради следует отметить, что и в странах романо-германской системы права, традиционно ориентированной на внутригосударственное законодательство в широком смысле слова, наблюдается пристальное внимание к так называемому прецедентному праву и попытки сориентироваться в нормотворческой деятельности на достижения, примеры и выводы судебно-арбитражной практики.	слова	1
25	слова	Целью выполнения проекта является полная или частичная реструктуризация специализированных организаций и научно-исследовательских институтов, занимающихся всем спектром вопросов, связанных с гидросферой Иордании для более эффективного и оптимального управления (в общем смысле этого слова) водными ресурсами страны.	слова	1
26	слова	Проведенные рядом специалистов исследования доказали, что профессиональные вредности, в широком понимании этого слова, являются порождающими агентами изменений в организме, происходящих на клеточном, органном и системном уровнях [3, 25, 28].	слова	1
27	слова	В такой ситуации он кое-как делает уроки, чтобы освободить время для игр, поскольку на все его в буквальном смысле слова не хватает.	слова	1
28	слова	Это еще не рахит в полном смысле слова, но уже дефицит кальция, который при определенных условиях перерастает в рахит.	слова	1
29	слова	"В результате переговоров были заключены мировые соглашения, по которым правонарушители обязались прекратить использование слова ""Жигулевское "" для маркировки своей продукции, были заключены лицензионные договоры об использовании товарного знака с АООТ ""Исетский пивоваренный завод "" в Екатеринбурге, ОАО ""Афанасий -- пиво "" в Твери, ОАО ""Пивзавод Воронежский "", ОАО ""Ярпиво "", ОАО ""Чебоксарская пивоваренная компания "" Букет Чувашии ""."	слова	1
30	слова	Но только тс-с-с: никому ни слова!	слова	1
31	слова	И что нет в России свободы слова и демократии, уверенного экономического роста, какой был при тезке Ельцине.	слова	1
32	слова	Но уже через день стало ясно, что руководство газового монополиста не сдержало слова и внезапно вернулось к тому, от чего готово было отказаться.	слова	1
33	слова	Здесь ведущие спортсмены в прямом, а не в переносном смысле слова отстаивают честь стран или континентов.	слова	1
34	слова	И во всех падежах этого слова во множественном числе ударение будет стоять на первом слоге.	слова	1
35	слова	Бабки, деньжищи и еще раз деньжищи высыпались на экран, который так нравоучительно внушал нам про ценности демократии, про свободу слова, про права человека и т. д.	слова	1
36	слова	Всю дорогу до Назрани никто из нас не проронил ни слова.	слова	1
37	слова	Ни слова мужикам о том, сколько все это стоило.	слова	1
38	слова	Кямал рыдал и не мог вымолвить ни одного слова.	слова	1
39	слова	"Эта формулировка неизменно присутствовала в качестве дефиниции слова ""математика "" во всех словарях и энциклопедиях коммунистического периода истории России."	слова	1
40	слова	Многим членам комиссии не дали слова.	слова	1
41	слова	А у них получилось такое правильное сочетание английскости (в хорошем смысле слова) и модерна.	слова	1
42	слова	С одной стороны, неистребимые традиции Кавказа, с другой -- влияние нежной поэзии мусульманских мастеров слова, с третьей -- русские мотивы, которые, похоже, вплелись естественным образом в возвышенные души кавказцев.	слова	1
43	слова	Здесь помнят его слова о значении русской культуры и русского слова.	слова	1
44	слова	Это служит одним из очередных свидетельств, что власть, пусть во многом формально, но намерена соблюдать принципы свободы слова.	слова	1
45	слова	Нет в GDI и дроссельной заслонки в привычном смысле слова -- режим работы мотора меняется в зависимости от количества топлива в цилиндрах.	слова	1
46	слова	Светлана Сорокина в эфире канала ТВ-6, не боясь показаться гонителем свободы слова, высказала мысль, которая в эти дни приходила в голову многим: недопустимо в подобных ситуациях вываливать в эфир все, что душе журналиста угодно.	слова	1
47	слова	В римском праве под «провокацией» понималась апелляция от магистрата к народу в уголовных делах; однако доминирующим впоследствии стало другое значение слова -- подстрекательство, вызов.	слова	1
48	слова	"После ужасных спектаклей, где нет ни слова правды, ни капли искренности, где царит безвкусица, к ""фоменкам "" припадаешь как к живому источнику: ""Счастливая деревня ""."	слова	1
49	слова	Несомненным достоинством словаря, выгодно отличающим его от большинства ранее изданных словарей по тунгусо-маньчжурским языкам, является то, что почти каждая словарная статья сопровождается обширным иллюстративным материалом, который подтверждает наличие слова или значения в языке, разъясняет значение слова в контексте, отражает наиболее типичные синтаксические конструкции и реальные словосочетания или предложения, взятые из обыденной речи или из фольклорного источника.	слова	1
50	слова	Придем, про парня ни слова!	слова	1
51	слова	"В слове ""апельсин "" есть два других слова -- ""апель "" и ""син ""."	слова	1
52	слова	Философ так или иначе всегда конформист в самом истинном и глубоком значении этого слова, подстраивающий не столько свое сознание под мир, сколько мир под себя.	слова	1
53	слова	Всю силу своего гневного слова обрушивала она на бюрократизацию редакционной работы.	слова	1
54	слова	Не случайно и не из одного только писательского желания сохранить в неприкосновенности свой текст он подчеркнул однажды (в письме к жене из Тамбова от 1927 года) четыре слова:	слова	1
55	слова	Но если чья-то любовь к жене не выдерживает моей свободы слова, такой брачный союз обречен.	слова	1
56	слова	Первый пласт содержания -- это то рациональное, что нам сообщают: смысл слова.	слова	1
57	слова	А еще все знают, что Татьяна Николаевна человек слова, очень требовательна, и прежде всего к себе.	слова	1
58	слова	Так же как дурной вкус в физическом смысле слова удовлетворяется только слишком пикантными или экзотическими приправами, так дурной вкус в искусстве радуется лишь эффектному орнаменту и не откликается на естественную красоту.	слова	1
59	слова	И не отказываюсь ни от одного сказанного слова.	слова	1
60	слова	С тех пор вот, с нечаянно молвленного в свадебную ночь слова, и пошло -- чудушко мое, чудушко мое.	слова	1
61	слова	Все шло своим чередом, пока в один прекрасный день Сонька не собрала вещички и не уехала, не сказав никому ни слова.	слова	1
62	слова	Высокий, худощавый, темноволосый старик всегда тщательно одевался, аккуратно с ножом и вилкой кушал, был церемонно вежлив и не выказывал предпочтения никому из обитавших на даче людей, но однажды, когда жарким воскресным днем старшая Колюнина кузина Тоня уселась за стол в не просохшем после озера купальнике, ни слова не говоря, поднялся и ушел.	слова	1
63	слова	У гуманитария же вообще нет возможности что-либо доказать в абсолютном смысле этого слова.	слова	1
64	слова	Безукоризненно честный в житейском смысле этого слова, Павел Алексеевич прожил всю свою профессиональную жизнь в советское время, давно привык пользоваться в статьях и монографиях некоторым условным языком, казенными зачинами с застывшими оборотами типа:	слова	1
65	слова	"Что же касается хлесткого словечка ""росворы "", то оно является производным от двух других слов: всем известной аббревиатуры ""Росвооружение "" и популярного в новой России слова ""воры ""."	слова	1
66	слова	Право же, она заслужила это своей праведной жизнью и хотя бы тем, что за жизнь свою не произнесла ни одного хульного слова против Бога.	слова	1
67	слова	Этот за все время моего пребывания в Мавзолее ни сказал ни слова, лишь сурово поглядывал на проходящих.	слова	1
68	слова	После пулемета и допросов в милиции, где упрямый сын не вымолвил ни слова, из дома выкинуто было все железное, мотоцикл же, найденный в сарае, отдан кружку юных техников при доме пионеров.	слова	1
69	слова	Вот и тогда он обронил два слова правды, которые, кажется, пустят насмарку всю его жизнь.	слова	1
70	слова	"Здесь жила с родителями Дагмара, отец ее, Вячеслав Романович, с насупленными бровями и сухими глазами, имевший мрачноватый вид, но человек добрый, говоривший ровно столько, сколько требуется, ни слова больше и ни слова меньше, -- отец Дагмары, начальствующий энергетик, в городе был известен и ездил на ""Волге ""."	слова	1
71	слова	Суточная сводка на сем обрывалась, близилось к концу первое и, возможно, последнее заседание Штаба, что стало очевидным из напутственного слова Георгия Семеновича.	слова	1
72	слова	"Оживленная ночная торговля на пути от метро ""Комсомольская "" к перронам развила в этих детях странствий невероятный дар слова."	слова	1
73	слова	Медвежонок не сказал ни слова.	слова	1
74	слова	Ольга же, напротив, пережила в ночь на 24 октября такое тяжелое потрясение, что ей отказал язык; племянница Вера в отчаянье и так к ней подъезжала, и сяк, но Ольга не могла ни слова из себя выдавить и только вращала безумными глазами, как механические совы на стенных часах или как сердечники во время жестокого приступа ишемии.	слова	1
75	слова	"Соседки сопровождали эти лингвистические ""поиски "" Алеши возгласами недоумения и даже ироническими замечаниями, но единственно правильного написания слова ""завтрак "" Алеша так и не произнес..."	слова	1
76	слова	"Конечно ""контекстуальный "" перевод, даже если каждый раз указывать исходный термин, тоже имеет свои недостатки ""бьющие "" прежде всего по читателю, которому может быть трудно согласовать между собой разные значения одного и того же слова, но эта трудность может быть частично устранена созданием терминологических словарей."	слова	1
77	слова	Тут между слегка распухшей Валькой и золотистой пожилой блондинкой начался разговор, в котором мастер Амати не понял ни слова, однако ему захотелось как-то прервать эту беседу, больше похожую на лай, и он придумал: достал из кармана пачку местных денег и протянул Вальке.	слова	1
78	слова	Слова ни говоря, она впялилась в шубу, накинула оренбургский дареный платок -- брала она подарки, если ей их приносили: коробки конфет, книги, конверты с деньгами.	Слова	1
79	слова	И конечно, дамы в самом высоком, эстетическом смысле этого слова...	слова	1
80	слова	"Особое удовлетворение он получал от слова ""соединение "" -- неизвестно почему и отчего возникшего в вечно хмельной голове Артюхи Колотушкина."	слова	1
81	слова	"Но ""чуждый "" человек тоже является человеком в полном смысле слова."	слова	1
82	слова	Тогда каждая молитва начнет оживать, делаться моей молитвой; вокруг каждого слова будут кристаллизоваться моменты моего собственного опыта.	слова	1
83	слова	"Опять-таки, когда я говорю ""ценой собственной жизни "", это не обязательно означает смерть, потому что можно целую жизнь отдать для одного человека или для какой-нибудь группы людей, без того чтобы умереть от этого в прямом смысле слова, телесно."	слова	1
