Index	Homograph	Context	TargetWord	Label
191	слова	Через сцену, опираясь на палочку, торопливо проходит Фирс, ездивший встречать Любовь Андреевну; он в старинной ливрее и в высокой шляпе; что-то говорит сам с собой, но нельзя разобрать ни одного слова.	слова	1
192	слова	"Когда присматриваешься к чисто вымытым и гладко выбритым физиономиям рассказов, повестей и романов, которые делают толстыми наши ""толстые "" журналы, когда пробираешься сквозь толпу наших молодых, подающих и начинающих оправдывать надежды, небезызвестных, почтенных, маститых и просто бездарных беллетристов, рождается мысль, что жизнь истощена, исчерпана до дна великими мастерами образного слова, что не осталось у нее явлений, комбинаций и положений, которые бы не подвергались уже творческой переработке, что вся художественная литература обречена на имитации и перепевы."	слова	1
193	слова	Потом, не говоря ни слова, он открыл дверь и вышел в темноту.	слова	1
194	слова	Я от своего слова не отказываюсь.	слова	1
195	слова	Яков тоже вспылил и побагровел весь, но не сказал ни слова, а взял под руку Марфу и повел ее из приемной.	слова	1
196	слова	Более тысячи часов я лежал без движения и не мог произнести ни слова, но изредка продолжал еще дышать.	слова	1
197	слова	За исключением разве, преступников «Мертвого дома», весьма объективно изображенных, все лица Достоевского суть в самом точном смысле слова создания его воображения.	слова	1
198	слова	Виноват, господа, я хочу сказать Андрюше два слова. (Отводит Нюнина в сторону.) Я, братец, немножко сконфужен...	слова	1
199	слова	От всех обиду терплю и ни от кого доброго слова не слышу...	слова	1
200	слова	А для тебя, Порфирий, одна инструкция: как только ты, чего боже оборони, завидишь в окрестностях казака, так сию же секунду, ни слова не говоря, беги и неси мне ружье, а я уж буду знать, как мне поступить!	слова	1
201	слова	Конечно, приятно слышать хорошие слова о себе, но вы не совсем правы.	слова	2
202	слова	Это я для наглядности, чтобы не просто, как говорится, слова!	слова	2
203	слова	Очень сильные слова, по-моему.	слова	2
204	слова	Главное, чтоб он эти слова не пускал на ветер.	слова	2
205	слова	мне эти слова почти ничего не говорят.	слова	2
206	слова	Двукратный обладатель премии Оскар, актер умело воплотился в образ скупого на слова и серьезного федерального агента, который идет по следам бандита.	слова	2
207	слова	Хотя подобная история отношений с творением Рязанова неуникальна, наверное, каждый второй может подтвердить мои слова…	слова	2
208	слова	Ключевые слова: корь, краснуха, эпидемический паротит, эпидемиологическая ситуация, вакцинопрофилактика	слова	2
209	слова	"Дело в том, что в настоящей работе предлагается использование исключительно словарно-шаблонного механизма генерации текстов (разумеется, вместо термина ""шаблон "" можно использовать более красивые слова типа ""пассивный фрейм "" или даже ""гештальт "", однако сути дела это не меняет)."	слова	2
210	слова	"Потому что, когда у мужчины спрашивают: ""Любишь? "", то, конечно, он отвечает: ""Да "" -- и мучительно ищет нужные слова..."	слова	2
211	слова	На этапе формирования образа релевантного документа из запроса пользователя выделяются значимые слова и термины предметной области, которые используются для формирования поискового образа с применением эвристических правил и вывода на онтологии.	слова	2
212	слова	"Слова значились как ""народные ""."	Слова	2
213	слова	Удивительно слышать от человека, занимающего выборную должность, такие слова.	слова	2
214	слова	"А ведь совсем недавно сами слова ""эрзац-кофе "" бодрили не хуже хорошей чашки натурального."	слова	2
215	слова	Слова-цвета собираются в рассказ.	Слова	2
216	слова	Но, видимо, он все-таки доволен ответом: его следующие слова уже и не брюзжание, а так.	слова	2
217	слова	Недавно смотрела по Евровидению конкурс песни и меня возмутили слова:	слова	2
218	слова	Спасибо за добрые слова!	слова	2
219	слова	Мрачность и величавость властвуют здесь: слова уходят и чувства растворяются.	слова	2
220	слова	Успокаивающие слова Дорна ничего не могут поправить: Аркадиной уже не оправиться от удара.	слова	2
221	слова	"Есть говорящие кошки, которые произносят слова, созвучные их природному ""мяу "", -- ""мама """" мясо ""."	слова	2
222	слова	Я здесь сошлюсь на слова одного из самых уважаемых мною в оппозиции людей, на человека, который прекрасно знал армию -- на покойного Льва Рохлина.	слова	2
223	слова	Не вдаваясь здесь в подробности, достаточно привести слова самого Рамана:	слова	2
224	слова	Когда звонил телефон, когда я шел из другой комнаты, когда я снимал трубку, когда я слышал первые слова матери -- не пойму точно, когда, но я все знал.	слова	2
225	слова	""" Значение слова неизвестно ""."	слова	2
226	слова	Вряд ли такие слова произносятся госслужащими без санкции сверху.	слова	2
227	слова	Есть слова о том, что детский театр -- самый ответственный и самый совестливый театр.	слова	2
228	слова	Эти слова тронули Эле-Фантика.	слова	2
229	слова	Коллектив, группа, общество --эти слова мы привыкли слышать только в приложении к человеку.	слова	2
230	слова	Это золотые слова, и к ним очень и очень нужно прислушиваться.	слова	2
231	слова	"Надо признать, что язык психологии сильно засорен ""сверхучеными "" словами, в частности, транслитерациями английских слов (т. е. записями на кириллице звучания иноязычных терминов), для которых возможны подходящие слова родного языка."	слова	2
232	слова	"Прочитал в первом номере ""Аргументов и фактов "" слова Е. Гайдара о том, что ""социализма не хотят даже коммунисты "", и возмутился."	слова	2
233	слова	Для усложнения задачи слова предъявлялись с поворотом на 60 и 120 градусов от горизонтали.	слова	2
234	слова	"Я хочу верить, что нашим девизом еще на долгие годы станут слова -- ""Азарт, качество, разум ""."	слова	2
235	слова	Несмотря на попытку забрать свои слова обратно, уже через несколько дней выяснилось, что конфликт есть и угрозы были небеспочвенны.	слова	2
236	слова	Слова Фрея были таковы:	Слова	2
237	слова	Рента, рента! -- заветные слова у всех на устах.	слова	2
238	слова	Иногда они произносят слова, чтобы скрыть свои мысли.	слова	2
239	слова	В итоге зал автоматически аплодировал всякий раз, заслышав заветные слова.	слова	2
240	слова	Косвенным подтверждением тому, что в Кремле не придали большого значения демаршу главы правительства, явились умиротворяющие слова, произнесенные президентом на встрече с Германом Грефом в прошлый понедельник.	слова	2
241	слова	Вполне возможно, что подобные слова могут восходить к очень древним истокам.	слова	2
242	слова	И нельзя разрешать каждой общине вкладывать свой смысл в слова Священного Писания или по-своему отправлять таинства!	слова	2
243	слова	Деньги, выброшенные на слова	слова	2
244	слова	Главное -- чаще удивлять друг друга, говорить слова любви, с участием относиться к интересам друг друга -- вот это, на мой взгляд, основная движущая сила добрых супружеских отношений.	слова	2
245	слова	Моя мама помнит те моменты, когда я, еще совсем малышка, совершенно серьезно пела баллады о любви, толком не понимая слова.	слова	2
246	слова	Беда еще и в том, что слова подтверждаются фактами.	слова	2
247	слова	"Но самым впечатляющим заявлением стали слова Вешняковой о том, что высказывания премьер-министра Михаила Касьянова по поводу ситуации вокруг НК ""ЮКОС "" являются некорректными."	слова	2
248	слова	Не воспримут ли читатели эти слова как желание сэкономить на их здоровье?	слова	2
249	слова	Слава Богу, успел тебе нужные слова сказать, а что не сказал, то записал.	слова	2
250	слова	Я бы назвал его слова обмолвкой, невольно обнажившей нищету корпоративной идеологии и морали узкого круга, который держит ресурсы и финансы страны.	слова	2
251	слова	Неразумные слова.	слова	2
252	слова	Проверь еще раз, все ли слова ты написала правильно, нет ли лишнего that?	слова	2
253	слова	Ваши слова и мысли приобретут необычную силу.	слова	2
254	слова	Ненапрасные слова Центральным моментом в выступлении Гринспена перед палатой представителей бюджетного комитета Конгресса США стал призыв к сенаторам жестко ограничить бюджетные расходы.	слова	2
255	слова	Слова о справедливости были чеканены на украшенном гербом щите Курфюрста.	Слова	2
256	слова	Слова Грефа, музыка Александрова	Слова	2
257	слова	В памяти всплывают ссоры, неосторожно сказанные слова, несовершенные поступки -- словом, все то, что омрачало наши взаимоотношения.	слова	2
258	слова	"По мере же того как испанское общество становилось все менее религиозным, святотатственная брань выходила из употребления: лингвисты отмечают, что теперь только богобоязненные старички в глубинке, попав себе молотком по пальцу, по-прежнему говорят ""Me cago en la Virgen Santisima "" -- страшные слова, за которые в более ответственные времена людям делали в языке дырку особенным раскаленным гвоздем."	слова	2
259	слова	"Недавно прочитал в одной газете слова главного тренера ""Нефтехимика "" Владимира Крикунова:"	слова	2
260	слова	Эти слова подтвердил министр внутренних дел России Борис Грызлов.	слова	2
261	слова	"Слова Полякова оказались почти правдой -- ""газовики "" действительно внесли взнос за участие в первенстве страны, но за пару дней до его старта отозвали свою заявку, видимо, поняв, что на весь сезон денег не хватит."	Слова	2
262	слова	Уже в самолете, когда со мной рядом оказался французский кларнетист Мишель Летьек, артистический директор Фестиваля имени Пабло Казальса, я вспомнила слова Бориса Мездрича о Новосибирске как о музыкальном холдинге.	слова	2
263	слова	"Кажется, пророчески звучат в этом контексте так часто цитируемые Достоевским слова Гоголя из ""Записок сумасшедшего "":"	слова	2
264	слова	Какие слова ты чаще всего говоришь актерам?	слова	2
265	слова	Эти слова я запомнил навсегда.	слова	2
266	слова	"Три года назад в статье о Ферапонтове в ""Известиях "" были приведены слова Герольда Вздорнова, считающего, что ваш музей должен быть ""небольшим, но образцовым "" и не превращаться ""в объект массового туризма -- этой чумы новейшей цивилизации ""."	слова	2
267	слова	Частично слова г-на Хужамова подтверждаются статистикой департамента страхнадзора.	слова	2
268	слова	"Цитированные слова Печорина -- ""зачем я жил? "" и т. д. -- содержат еще одну фразу, пока ""не угаданную "" читателями, и вновь текст Киркегора наводит на вероятную разгадку."	слова	2
269	слова	Его слова показались хотя и осторожными, но достаточно откровенными:	слова	2
270	слова	Основной месседж, пожалуй, несли не заученно-бесстрастные слова лидера американцев, а его внешний вид.	слова	2
271	слова	"Но, кстати, для японцев бумага напрямую связана с божественным началом, даже сами слова ""божество "" и ""бумага "" звучат одинаково, хотя обозначаются различными иероглифами."	слова	2
272	слова	Эти слова прекрасно описывали и качество игры нашей команды в первых матчах предварительного турнира, когда мы последовательно проиграли гораздо более слабым сборным Болгарии и Франции, с трудом одолев в последний день совсем хилый Тунис.	слова	2
273	слова	И это не красивые слова.	слова	2
274	слова	Petersburg Open он, словно автоответчик, повторял одни и те же слова:	слова	2
275	слова	"Все игры ведут одинаково рафинированные люди с повадками шулеров, одетые в одинаковые серые костюмы с ""искрой "", говорящие одни и те же слова в студии, которая, как кажется, одна на всех..."	слова	2
276	слова	Слова услышали стоящие рядом чеченцы.	Слова	2
277	слова	Как часто вспоминала я эти слова!	слова	2
278	слова	Он хотел приготовить слова, но слова не подбирались.	слова	2
279	слова	"Обратим внимание на слова ""трактуемое как ""."	слова	2
280	слова	Слова знакомые и незнакомые	Слова	2
281	слова	Я очень надеюсь, что мои слова будут услышаны.	слова	2
282	слова	Иначе любимой -- долгая и мучительная смерть, подробно описанная ему в такой форме, что даже самые страшные слова не нужны.	слова	2
283	слова	Слова, вынесенные в заголовок рецензируемой книги, широко известны в Монголии.	Слова	2
284	слова	Здесь помнят его слова о значении русской культуры и русского слова.	слова	2
285	слова	Жизнь подтвердила слова А. Сэбина о том, что вакцинные вирусы полиомиелита могут в течение длительного времени циркулировать среди неиммунного или недостаточно вакцинированного населения, полностью восстанавливая свойства дикого вируса [9].	слова	2
286	слова	Весь вечер следующего дня приходящие в эфир политики призывали журналистов: аккуратнее, осторожнее, выбирайте слова.	слова	2
287	слова	Либерал Кармазинов произносит слова, сводившие с ума Михаила Булгакова:	слова	2
288	слова	Съесть нужно лакомство и сказать волшебные слова:	слова	2
289	слова	Ему не нужны критики-интерпретаторы: его мысль оформляется хоть в слова, хоть в танцевальные периоды с одинаково исчерпывающей точностью.	слова	2
290	слова	"Ахматовский цикл Прокофьева и ""Сатиры "" Шостаковича на слова Саши Черного -- то, что можно здесь назвать хитами."	слова	2
291	слова	Сайт НТВ. ру цитирует слова Коха о его намерениях принять участие в тендере на покупку НТВ, если таковой будет объявлен.	слова	2
292	слова	И какие-то слова.	слова	2
293	слова	Слова президента следует понимать либо как метафору -- на огромном экране в своей американской резиденции Вячеслав Фетисов словно через увеличительное стекло будет рассматривать действия каждого игрока и увидит, как один выдал неточный пас, а другой ковырялся в носу во время смены составов, -- либо как призыв к определенной модели поведения: гоняйте шайбу, ребята, а уж Вячеслав Александрович сам посмотрит и решит.	Слова	2
294	слова	"Даже слова главного инвестора ""Флориды "" Алана Коэна, накануне публично высказавшего поддержку политике руководящего штаба, уже никто не принимал всерьез."	слова	2
295	слова	Так или иначе, существует вероятность, что человечество в обозримом будущем исправит одну из фатальных ошибок, совершенных на заре времен, когда, увлекшись игрой в слова -- неоднозначные и неточные, обманчиво легкие в эксплуатации, -- оно разучилось видеть мир таким, каков он есть на самом деле, и, извините за выражение, оглохло.	слова	2
296	слова	Начать без Лесина было никак нельзя -- именно он стал тем человеком, который произнес первые слова: министр и зампред ВГТРК Александр Акопов придумали основные сюжетные линии, а Лесин еще и нарисовал семейные связи будущих героев фильма от начала истории до 1994 года.	слова	2
297	слова	В одном из писем есть замечательные слова:	слова	2
298	слова	Живые слова, полные внутреннего содержания, обветшали, умерли, распались и не значат ничего, но продолжают плодить фантомы и призраки, раскручивая цепную реакцию самопорождения мнимых величин.	слова	2
299	слова	Когда Родману передали процитированные слова, он, как показалось, даже обиделся:	слова	2
300	слова	Нет нужды и возможности комментировать эти слова.	слова	2
